/usr/bin/java  -classpath /home/sebastiaoamaro/phd/torefidevel/tests/redis/ycsb-0.17.0/conf:/home/sebastiaoamaro/phd/torefidevel/tests/redis/ycsb-0.17.0/lib/HdrHistogram-2.1.4.jar:/home/sebastiaoamaro/phd/torefidevel/tests/redis/ycsb-0.17.0/lib/core-0.17.0.jar:/home/sebastiaoamaro/phd/torefidevel/tests/redis/ycsb-0.17.0/lib/htrace-core4-4.1.0-incubating.jar:/home/sebastiaoamaro/phd/torefidevel/tests/redis/ycsb-0.17.0/lib/jackson-core-asl-1.9.4.jar:/home/sebastiaoamaro/phd/torefidevel/tests/redis/ycsb-0.17.0/lib/jackson-mapper-asl-1.9.4.jar:/home/sebastiaoamaro/phd/torefidevel/tests/redis/ycsb-0.17.0/redis-binding/lib/commons-pool2-2.4.2.jar:/home/sebastiaoamaro/phd/torefidevel/tests/redis/ycsb-0.17.0/redis-binding/lib/jedis-2.9.0.jar:/home/sebastiaoamaro/phd/torefidevel/tests/redis/ycsb-0.17.0/redis-binding/lib/redis-binding-0.17.0.jar site.ycsb.Client -t -db site.ycsb.db.RedisClient -P workloads/workloada -s -p status.interval=1 -p operationcount=2500000 -p redis.host=172.38.0.11 -p redis.port=6379 -p redis.cluster=true -s
Command line: -t -db site.ycsb.db.RedisClient -P workloads/workloada -s -p status.interval=1 -p operationcount=2500000 -p redis.host=172.38.0.11 -p redis.port=6379 -p redis.cluster=true -s
YCSB Client 0.17.0

Loading workload...
Starting test.
2024-09-25 16:44:31:886 0 sec: 0 operations; est completion in 0 second 
DBWrapper: report latency for each error is false and specific error codes to track for latency are: []
2024-09-25 16:44:32:852 1 sec: 12845 operations; 12845 current ops/sec; est completion in 3 minutes [READ: Count=6437, Max=4175, Min=19, Avg=65,94, 90=97, 99=183, 99.9=322, 99.99=2807] [UPDATE: Count=6442, Max=2583, Min=19, Avg=69,61, 90=107, 99=187, 99.9=269, 99.99=467] 
2024-09-25 16:44:33:852 2 sec: 33957 operations; 21112 current ops/sec; est completion in 2 minutes [READ: Count=10720, Max=509, Min=18, Avg=45,24, 90=75, 99=147, 99.9=224, 99.99=301] [UPDATE: Count=10370, Max=369, Min=18, Avg=46,02, 90=78, 99=159, 99.9=243, 99.99=357] 
2024-09-25 16:44:34:852 3 sec: 70606 operations; 36649 current ops/sec; est completion in 1 minute [READ: Count=18297, Max=511, Min=19, Avg=26,82, 90=31, 99=79, 99.9=154, 99.99=240] [UPDATE: Count=18350, Max=479, Min=17, Avg=25,66, 90=29, 99=81, 99.9=155, 99.99=447] 
2024-09-25 16:44:35:852 4 sec: 104852 operations; 34246 current ops/sec; est completion in 1 minute [READ: Count=17061, Max=534, Min=18, Avg=28,11, 90=51, 99=87, 99.9=155, 99.99=236] [UPDATE: Count=17191, Max=712, Min=16, Avg=28,38, 90=54, 99=89, 99.9=168, 99.99=265] 
2024-09-25 16:44:36:852 5 sec: 142514 operations; 37662 current ops/sec; est completion in 1 minute [READ: Count=18747, Max=224, Min=18, Avg=25,77, 90=28, 99=67, 99.9=136, 99.99=218] [UPDATE: Count=18912, Max=245, Min=18, Avg=25,54, 90=28, 99=69, 99.9=159, 99.99=220] 
2024-09-25 16:44:37:852 6 sec: 164097 operations; 21583 current ops/sec; est completion in 1 minute [READ: Count=10823, Max=998, Min=18, Avg=45,42, 90=72, 99=138, 99.9=215, 99.99=476] [UPDATE: Count=10755, Max=485, Min=18, Avg=45,05, 90=74, 99=140, 99.9=226, 99.99=382] 
2024-09-25 16:44:38:852 7 sec: 190105 operations; 26008 current ops/sec; est completion in 1 minute [READ: Count=12966, Max=476, Min=14, Avg=36,98, 90=66, 99=117, 99.9=168, 99.99=295] [UPDATE: Count=13044, Max=741, Min=18, Avg=37,89, 90=69, 99=125, 99.9=175, 99.99=235] 
2024-09-25 16:44:39:852 8 sec: 225074 operations; 34969 current ops/sec; est completion in 1 minute [READ: Count=17436, Max=754, Min=18, Avg=27,63, 90=48, 99=102, 99.9=209, 99.99=321] [UPDATE: Count=17530, Max=957, Min=16, Avg=27,86, 90=50, 99=109, 99.9=183, 99.99=269] 
2024-09-25 16:44:40:852 9 sec: 259988 operations; 34914 current ops/sec; est completion in 1 minute [READ: Count=17408, Max=598, Min=18, Avg=27,67, 90=47, 99=72, 99.9=151, 99.99=233] [UPDATE: Count=17503, Max=1204, Min=18, Avg=27,76, 90=49, 99=77, 99.9=159, 99.99=390] 
2024-09-25 16:44:41:852 10 sec: 286833 operations; 26845 current ops/sec; est completion in 1 minute [READ: Count=13455, Max=403, Min=18, Avg=35,96, 90=60, 99=137, 99.9=254, 99.99=391] [UPDATE: Count=13396, Max=551, Min=17, Avg=36,63, 90=63, 99=142, 99.9=254, 99.99=398] 
2024-09-25 16:44:42:852 11 sec: 317569 operations; 30736 current ops/sec; est completion in 1 minute [READ: Count=15438, Max=446, Min=18, Avg=31,16, 90=57, 99=103, 99.9=192, 99.99=271] [UPDATE: Count=15327, Max=461, Min=18, Avg=32,03, 90=60, 99=111, 99.9=181, 99.99=444] 
2024-09-25 16:44:43:852 12 sec: 349241 operations; 31672 current ops/sec; est completion in 1 minute [READ: Count=15822, Max=833, Min=18, Avg=30,46, 90=55, 99=102, 99.9=180, 99.99=236] [UPDATE: Count=15843, Max=942, Min=18, Avg=30,81, 90=57, 99=104, 99.9=180, 99.99=341] 
2024-09-25 16:44:44:852 13 sec: 383528 operations; 34287 current ops/sec; est completion in 1 minute [READ: Count=17104, Max=274, Min=18, Avg=28,14, 90=47, 99=83, 99.9=154, 99.99=218] [UPDATE: Count=17169, Max=591, Min=18, Avg=28,33, 90=49, 99=82, 99.9=162, 99.99=243] 
2024-09-25 16:44:45:852 14 sec: 406478 operations; 22950 current ops/sec; est completion in 1 minute [READ: Count=11411, Max=423, Min=18, Avg=41,63, 90=64, 99=116, 99.9=187, 99.99=359] [UPDATE: Count=11532, Max=244, Min=17, Avg=43,26, 90=69, 99=131, 99.9=178, 99.99=243] 
2024-09-25 16:44:46:852 15 sec: 433526 operations; 27048 current ops/sec; est completion in 1 minute [READ: Count=13648, Max=800, Min=18, Avg=35,49, 90=61, 99=106, 99.9=248, 99.99=468] [UPDATE: Count=13411, Max=894, Min=18, Avg=36,3, 90=64, 99=118, 99.9=424, 99.99=486] 
2024-09-25 16:44:47:852 16 sec: 458734 operations; 25208 current ops/sec; est completion in 1 minute [READ: Count=12666, Max=499, Min=18, Avg=38,19, 90=61, 99=116, 99.9=174, 99.99=239] [UPDATE: Count=12534, Max=557, Min=18, Avg=38,96, 90=64, 99=120, 99.9=230, 99.99=396] 
2024-09-25 16:44:48:852 17 sec: 494559 operations; 35825 current ops/sec; est completion in 1 minute [READ: Count=17907, Max=945, Min=18, Avg=26,82, 90=50, 99=69, 99.9=129, 99.99=221] [UPDATE: Count=17909, Max=646, Min=15, Avg=27,33, 90=53, 99=73, 99.9=157, 99.99=238] 
2024-09-25 16:44:49:852 18 sec: 532098 operations; 37539 current ops/sec; est completion in 1 minute [READ: Count=18804, Max=1677, Min=18, Avg=25,81, 90=46, 99=76, 99.9=147, 99.99=376] [UPDATE: Count=18743, Max=585, Min=18, Avg=25,76, 90=47, 99=78, 99.9=157, 99.99=254] 
2024-09-25 16:44:50:852 19 sec: 567430 operations; 35332 current ops/sec; est completion in 1 minute [READ: Count=17924, Max=450, Min=18, Avg=27,41, 90=47, 99=76, 99.9=162, 99.99=350] [UPDATE: Count=17408, Max=479, Min=18, Avg=27,44, 90=50, 99=79, 99.9=181, 99.99=470] 
2024-09-25 16:44:51:852 20 sec: 600138 operations; 32708 current ops/sec; est completion in 1 minute [READ: Count=16363, Max=248, Min=18, Avg=29,53, 90=50, 99=90, 99.9=162, 99.99=236] [UPDATE: Count=16342, Max=703, Min=18, Avg=29,7, 90=53, 99=94, 99.9=157, 99.99=215] 
2024-09-25 16:44:52:852 21 sec: 633455 operations; 33317 current ops/sec; est completion in 1 minute [READ: Count=16557, Max=512, Min=18, Avg=28,94, 90=51, 99=80, 99.9=165, 99.99=230] [UPDATE: Count=16765, Max=696, Min=18, Avg=29,31, 90=54, 99=90, 99.9=154, 99.99=224] 
2024-09-25 16:44:53:852 22 sec: 665887 operations; 32432 current ops/sec; est completion in 1 minute [READ: Count=16229, Max=899, Min=18, Avg=29,8, 90=50, 99=100, 99.9=163, 99.99=499] [UPDATE: Count=16206, Max=357, Min=18, Avg=30, 90=54, 99=101, 99.9=177, 99.99=287] 
2024-09-25 16:44:54:852 23 sec: 697601 operations; 31714 current ops/sec; est completion in 1 minute [READ: Count=15793, Max=445, Min=17, Avg=30,43, 90=55, 99=96, 99.9=167, 99.99=278] [UPDATE: Count=15913, Max=458, Min=18, Avg=30,83, 90=58, 99=102, 99.9=168, 99.99=228] 
2024-09-25 16:44:55:852 24 sec: 727651 operations; 30050 current ops/sec; est completion in 59 seconds [READ: Count=15127, Max=718, Min=18, Avg=31,98, 90=58, 99=133, 99.9=340, 99.99=470] [UPDATE: Count=14922, Max=1072, Min=17, Avg=32,7, 90=61, 99=139, 99.9=348, 99.99=982] 
2024-09-25 16:44:56:852 25 sec: 757597 operations; 29946 current ops/sec; est completion in 58 seconds [READ: Count=14969, Max=1079, Min=18, Avg=32,36, 90=56, 99=99, 99.9=175, 99.99=339] [UPDATE: Count=14978, Max=300, Min=18, Avg=32,43, 90=58, 99=106, 99.9=177, 99.99=259] 
2024-09-25 16:44:57:852 26 sec: 787995 operations; 30398 current ops/sec; est completion in 57 seconds [READ: Count=15113, Max=245, Min=18, Avg=31,82, 90=56, 99=97, 99.9=186, 99.99=233] [UPDATE: Count=15291, Max=562, Min=18, Avg=32,19, 90=59, 99=110, 99.9=186, 99.99=269] 
2024-09-25 16:44:58:852 27 sec: 822977 operations; 34982 current ops/sec; est completion in 56 seconds [READ: Count=17430, Max=458, Min=18, Avg=27,55, 90=49, 99=73, 99.9=169, 99.99=443] [UPDATE: Count=17559, Max=635, Min=17, Avg=27,81, 90=52, 99=79, 99.9=164, 99.99=257] 
2024-09-25 16:44:59:852 28 sec: 857274 operations; 34297 current ops/sec; est completion in 54 seconds [READ: Count=17168, Max=535, Min=18, Avg=28,18, 90=51, 99=77, 99.9=143, 99.99=381] [UPDATE: Count=17126, Max=454, Min=17, Avg=28,33, 90=54, 99=79, 99.9=157, 99.99=258] 
2024-09-25 16:45:00:852 29 sec: 891759 operations; 34485 current ops/sec; est completion in 53 seconds [READ: Count=17369, Max=434, Min=18, Avg=27,89, 90=47, 99=80, 99.9=156, 99.99=336] [UPDATE: Count=17109, Max=268, Min=17, Avg=28,32, 90=50, 99=83, 99.9=163, 99.99=246] 
2024-09-25 16:45:01:852 30 sec: 913356 operations; 21597 current ops/sec; est completion in 53 seconds [READ: Count=10809, Max=1691, Min=18, Avg=44,95, 90=75, 99=132, 99.9=260, 99.99=943] [UPDATE: Count=10778, Max=1047, Min=17, Avg=45,49, 90=78, 99=139, 99.9=220, 99.99=914] 
2024-09-25 16:45:02:852 31 sec: 927720 operations; 14364 current ops/sec; est completion in 53 seconds [READ: Count=7283, Max=1233, Min=18, Avg=66,8, 90=103, 99=210, 99.9=772, 99.99=876] [UPDATE: Count=7093, Max=1239, Min=18, Avg=69,74, 90=108, 99=227, 99.9=837, 99.99=985] 
2024-09-25 16:45:03:852 32 sec: 942734 operations; 15014 current ops/sec; est completion in 53 seconds [READ: Count=7382, Max=1136, Min=19, Avg=63,67, 90=110, 99=236, 99.9=755, 99.99=1114] [UPDATE: Count=7628, Max=1311, Min=19, Avg=66,84, 90=118, 99=246, 99.9=921, 99.99=1235] 
2024-09-25 16:45:04:852 33 sec: 962909 operations; 20175 current ops/sec; est completion in 53 seconds [READ: Count=10106, Max=1093, Min=18, Avg=47,76, 90=81, 99=151, 99.9=256, 99.99=911] [UPDATE: Count=10064, Max=1146, Min=18, Avg=49,24, 90=85, 99=163, 99.9=330, 99.99=1144] 
2024-09-25 16:45:05:852 34 sec: 981717 operations; 18808 current ops/sec; est completion in 53 seconds [READ: Count=9355, Max=1568, Min=18, Avg=51,04, 90=79, 99=166, 99.9=414, 99.99=1308] [UPDATE: Count=9462, Max=1768, Min=18, Avg=52,9, 90=83, 99=176, 99.9=477, 99.99=993] 
2024-09-25 16:45:06:852 35 sec: 1001445 operations; 19728 current ops/sec; est completion in 53 seconds [READ: Count=9773, Max=1078, Min=18, Avg=49,17, 90=85, 99=177, 99.9=320, 99.99=463] [UPDATE: Count=9953, Max=390, Min=18, Avg=49,92, 90=88, 99=185, 99.9=318, 99.99=378] 
2024-09-25 16:45:07:852 36 sec: 1032526 operations; 31081 current ops/sec; est completion in 52 seconds [READ: Count=15533, Max=522, Min=18, Avg=31,02, 90=51, 99=99, 99.9=172, 99.99=232] [UPDATE: Count=15550, Max=965, Min=18, Avg=31,36, 90=53, 99=105, 99.9=169, 99.99=371] 
2024-09-25 16:45:08:852 37 sec: 1063402 operations; 30876 current ops/sec; est completion in 50 seconds [READ: Count=15319, Max=1010, Min=18, Avg=31,01, 90=55, 99=79, 99.9=147, 99.99=261] [UPDATE: Count=15554, Max=238, Min=18, Avg=31,87, 90=57, 99=86, 99.9=165, 99.99=215] 
2024-09-25 16:45:09:852 38 sec: 1089875 operations; 26473 current ops/sec; est completion in 50 seconds [READ: Count=13184, Max=4451, Min=18, Avg=36,54, 90=65, 99=125, 99.9=252, 99.99=3875] [UPDATE: Count=13300, Max=450, Min=18, Avg=36,83, 90=68, 99=139, 99.9=270, 99.99=422] 
2024-09-25 16:45:10:852 39 sec: 1118851 operations; 28976 current ops/sec; est completion in 49 seconds [READ: Count=14552, Max=392, Min=18, Avg=33,18, 90=59, 99=125, 99.9=212, 99.99=257] [UPDATE: Count=14414, Max=330, Min=17, Avg=33,99, 90=62, 99=139, 99.9=229, 99.99=317] 
2024-09-25 16:45:11:852 40 sec: 1153730 operations; 34879 current ops/sec; est completion in 47 seconds [READ: Count=17476, Max=539, Min=18, Avg=27,89, 90=46, 99=86, 99.9=159, 99.99=409] [UPDATE: Count=17408, Max=506, Min=17, Avg=27,54, 90=48, 99=86, 99.9=163, 99.99=232] 
2024-09-25 16:45:12:852 41 sec: 1179821 operations; 26091 current ops/sec; est completion in 46 seconds [READ: Count=13008, Max=995, Min=18, Avg=36,99, 90=65, 99=109, 99.9=181, 99.99=271] [UPDATE: Count=13079, Max=400, Min=18, Avg=37,61, 90=67, 99=124, 99.9=204, 99.99=338] 
2024-09-25 16:45:13:852 42 sec: 1205605 operations; 25784 current ops/sec; est completion in 46 seconds [READ: Count=13033, Max=280, Min=18, Avg=37,41, 90=62, 99=107, 99.9=176, 99.99=273] [UPDATE: Count=12753, Max=1045, Min=18, Avg=38,11, 90=65, 99=114, 99.9=168, 99.99=271] 
2024-09-25 16:45:14:852 43 sec: 1239744 operations; 34139 current ops/sec; est completion in 44 seconds [READ: Count=17225, Max=228, Min=18, Avg=28,22, 90=51, 99=71, 99.9=145, 99.99=201] [UPDATE: Count=16912, Max=600, Min=16, Avg=28,64, 90=54, 99=76, 99.9=162, 99.99=257] 
2024-09-25 16:45:15:852 44 sec: 1270368 operations; 30624 current ops/sec; est completion in 43 seconds [READ: Count=15411, Max=854, Min=18, Avg=31,44, 90=56, 99=114, 99.9=173, 99.99=234] [UPDATE: Count=15218, Max=501, Min=18, Avg=31,91, 90=58, 99=119, 99.9=192, 99.99=273] 
2024-09-25 16:45:16:852 45 sec: 1298937 operations; 28569 current ops/sec; est completion in 42 seconds [READ: Count=14271, Max=328, Min=15, Avg=33,78, 90=58, 99=116, 99.9=183, 99.99=283] [UPDATE: Count=14288, Max=264, Min=18, Avg=34,2, 90=60, 99=116, 99.9=183, 99.99=241] 
2024-09-25 16:45:17:852 46 sec: 1328035 operations; 29098 current ops/sec; est completion in 41 seconds [READ: Count=14536, Max=474, Min=18, Avg=32,93, 90=57, 99=98, 99.9=193, 99.99=460] [UPDATE: Count=14568, Max=420, Min=18, Avg=33,97, 90=60, 99=109, 99.9=206, 99.99=312] 
2024-09-25 16:45:18:852 47 sec: 1366043 operations; 38008 current ops/sec; est completion in 40 seconds [READ: Count=19044, Max=670, Min=18, Avg=25,46, 90=31, 99=76, 99.9=140, 99.99=249] [UPDATE: Count=18963, Max=345, Min=15, Avg=25,43, 90=31, 99=76, 99.9=155, 99.99=251] 
2024-09-25 16:45:19:852 48 sec: 1397782 operations; 31707,29 current ops/sec; est completion in 38 seconds [READ: Count=15897, Max=257, Min=18, Avg=30,5, 90=55, 99=94, 99.9=184, 99.99=244] [UPDATE: Count=15845, Max=863, Min=18, Avg=30,71, 90=58, 99=95, 99.9=187, 99.99=272] 
2024-09-25 16:45:20:852 49 sec: 1430532 operations; 32782,78 current ops/sec; est completion in 37 seconds [READ: Count=16260, Max=1115, Min=18, Avg=29,28, 90=54, 99=99, 99.9=177, 99.99=479] [UPDATE: Count=16491, Max=352, Min=18, Avg=30,02, 90=57, 99=97, 99.9=190, 99.99=280] 
2024-09-25 16:45:21:852 50 sec: 1456561 operations; 26029 current ops/sec; est completion in 36 seconds [READ: Count=12945, Max=3291, Min=18, Avg=37,15, 90=65, 99=135, 99.9=223, 99.99=428] [UPDATE: Count=13080, Max=322, Min=18, Avg=37,66, 90=67, 99=144, 99.9=251, 99.99=287] 
2024-09-25 16:45:22:852 51 sec: 1492992 operations; 36431 current ops/sec; est completion in 35 seconds [READ: Count=18260, Max=450, Min=18, Avg=26,49, 90=35, 99=65, 99.9=127, 99.99=317] [UPDATE: Count=18164, Max=526, Min=18, Avg=26,53, 90=35, 99=70, 99.9=135, 99.99=461] 
2024-09-25 16:45:23:852 52 sec: 1527831 operations; 34839 current ops/sec; est completion in 34 seconds [READ: Count=17400, Max=221, Min=18, Avg=27,58, 90=49, 99=82, 99.9=139, 99.99=188] [UPDATE: Count=17441, Max=1211, Min=18, Avg=28,03, 90=52, 99=89, 99.9=156, 99.99=285] 
2024-09-25 16:45:24:852 53 sec: 1565024 operations; 37193 current ops/sec; est completion in 32 seconds [READ: Count=18589, Max=236, Min=18, Avg=25,87, 90=37, 99=68, 99.9=141, 99.99=207] [UPDATE: Count=18606, Max=935, Min=18, Avg=26,14, 90=40, 99=74, 99.9=158, 99.99=281] 
2024-09-25 16:45:25:852 54 sec: 1599424 operations; 34400 current ops/sec; est completion in 31 seconds [READ: Count=17178, Max=1137, Min=17, Avg=28,18, 90=48, 99=105, 99.9=183, 99.99=350] [UPDATE: Count=17221, Max=483, Min=18, Avg=28,16, 90=50, 99=112, 99.9=205, 99.99=267] 
2024-09-25 16:45:26:852 55 sec: 1635773 operations; 36349 current ops/sec; est completion in 30 seconds [READ: Count=18198, Max=276, Min=18, Avg=26,57, 90=39, 99=66, 99.9=133, 99.99=192] [UPDATE: Count=18156, Max=296, Min=18, Avg=26,67, 90=42, 99=68, 99.9=163, 99.99=252] 
2024-09-25 16:45:27:852 56 sec: 1665805 operations; 30032 current ops/sec; est completion in 29 seconds [READ: Count=15107, Max=1320, Min=18, Avg=32,33, 90=59, 99=104, 99.9=169, 99.99=212] [UPDATE: Count=14926, Max=248, Min=18, Avg=32,4, 90=61, 99=105, 99.9=168, 99.99=247] 
2024-09-25 16:45:28:852 57 sec: 1701521 operations; 35716 current ops/sec; est completion in 27 seconds [READ: Count=17923, Max=1433, Min=18, Avg=27,17, 90=40, 99=83, 99.9=174, 99.99=511] [UPDATE: Count=17792, Max=348, Min=18, Avg=26,99, 90=43, 99=83, 99.9=166, 99.99=291] 
2024-09-25 16:45:29:852 58 sec: 1727755 operations; 26234 current ops/sec; est completion in 26 seconds [READ: Count=13049, Max=1058, Min=18, Avg=36,66, 90=61, 99=112, 99.9=169, 99.99=464] [UPDATE: Count=13186, Max=1077, Min=17, Avg=37,55, 90=65, 99=124, 99.9=190, 99.99=452] 
2024-09-25 16:45:30:852 59 sec: 1759551 operations; 31796 current ops/sec; est completion in 25 seconds [READ: Count=15979, Max=581, Min=18, Avg=30,25, 90=55, 99=118, 99.9=204, 99.99=321] [UPDATE: Count=15808, Max=648, Min=17, Avg=30,87, 90=59, 99=128, 99.9=205, 99.99=337] 
2024-09-25 16:45:31:852 60 sec: 1789466 operations; 29915 current ops/sec; est completion in 24 seconds [READ: Count=14945, Max=355, Min=18, Avg=32,25, 90=55, 99=102, 99.9=171, 99.99=260] [UPDATE: Count=14979, Max=503, Min=18, Avg=32,61, 90=58, 99=120, 99.9=193, 99.99=483] 
2024-09-25 16:45:32:852 61 sec: 1822561 operations; 33095 current ops/sec; est completion in 23 seconds [READ: Count=16616, Max=427, Min=18, Avg=29,18, 90=47, 99=95, 99.9=163, 99.99=231] [UPDATE: Count=16469, Max=972, Min=17, Avg=29,33, 90=48, 99=97, 99.9=172, 99.99=268] 
2024-09-25 16:45:33:852 62 sec: 1847803 operations; 25242 current ops/sec; est completion in 22 seconds [READ: Count=12633, Max=977, Min=18, Avg=38,15, 90=63, 99=108, 99.9=169, 99.99=746] [UPDATE: Count=12612, Max=661, Min=18, Avg=39,1, 90=66, 99=120, 99.9=178, 99.99=345] 
2024-09-25 16:45:34:852 63 sec: 1884087 operations; 36284 current ops/sec; est completion in 21 seconds [READ: Count=18192, Max=472, Min=18, Avg=26,71, 90=31, 99=62, 99.9=133, 99.99=379] [UPDATE: Count=18097, Max=463, Min=18, Avg=26,47, 90=31, 99=65, 99.9=133, 99.99=248] 
2024-09-25 16:45:35:852 64 sec: 1917661 operations; 33574 current ops/sec; est completion in 20 seconds [READ: Count=16849, Max=451, Min=17, Avg=28,65, 90=51, 99=75, 99.9=148, 99.99=258] [UPDATE: Count=16725, Max=462, Min=18, Avg=29,1, 90=54, 99=83, 99.9=159, 99.99=299] 
2024-09-25 16:45:36:852 65 sec: 1945180 operations; 27519 current ops/sec; est completion in 19 seconds [READ: Count=14017, Max=289, Min=18, Avg=34,77, 90=63, 99=113, 99.9=185, 99.99=251] [UPDATE: Count=13492, Max=439, Min=17, Avg=36,01, 90=67, 99=128, 99.9=219, 99.99=338] 
2024-09-25 16:45:37:852 66 sec: 1983378 operations; 38198 current ops/sec; est completion in 18 seconds [READ: Count=19121, Max=439, Min=18, Avg=25,21, 90=38, 99=71, 99.9=163, 99.99=367] [UPDATE: Count=19081, Max=1160, Min=17, Avg=25,46, 90=39, 99=75, 99.9=159, 99.99=231] 
2024-09-25 16:45:38:852 67 sec: 2010209 operations; 26831 current ops/sec; est completion in 17 seconds [READ: Count=13472, Max=741, Min=18, Avg=36,06, 90=62, 99=114, 99.9=230, 99.99=463] [UPDATE: Count=13364, Max=713, Min=18, Avg=36,5, 90=65, 99=120, 99.9=214, 99.99=300] 
2024-09-25 16:45:39:852 68 sec: 2047187 operations; 36978 current ops/sec; est completion in 16 seconds [READ: Count=18523, Max=446, Min=18, Avg=26,13, 90=31, 99=69, 99.9=138, 99.99=223] [UPDATE: Count=18450, Max=274, Min=17, Avg=26,13, 90=31, 99=72, 99.9=166, 99.99=248] 
2024-09-25 16:45:40:852 69 sec: 2080627 operations; 33440 current ops/sec; est completion in 14 seconds [READ: Count=16650, Max=507, Min=18, Avg=29,04, 90=51, 99=103, 99.9=184, 99.99=376] [UPDATE: Count=16795, Max=332, Min=18, Avg=28,93, 90=53, 99=96, 99.9=177, 99.99=261] 
2024-09-25 16:45:41:852 70 sec: 2117027 operations; 36400 current ops/sec; est completion in 13 seconds [READ: Count=18221, Max=456, Min=18, Avg=26,58, 90=41, 99=76, 99.9=142, 99.99=230] [UPDATE: Count=18179, Max=916, Min=17, Avg=26,57, 90=40, 99=79, 99.9=163, 99.99=462] 
2024-09-25 16:45:42:852 71 sec: 2144100 operations; 27073 current ops/sec; est completion in 12 seconds [READ: Count=13446, Max=699, Min=18, Avg=35,83, 90=63, 99=102, 99.9=173, 99.99=290] [UPDATE: Count=13624, Max=908, Min=18, Avg=36,09, 90=65, 99=107, 99.9=176, 99.99=232] 
2024-09-25 16:45:43:852 72 sec: 2177848 operations; 33748 current ops/sec; est completion in 11 seconds [READ: Count=16917, Max=469, Min=18, Avg=28,53, 90=50, 99=88, 99.9=181, 99.99=295] [UPDATE: Count=16827, Max=664, Min=17, Avg=28,92, 90=53, 99=90, 99.9=187, 99.99=467] 
2024-09-25 16:45:44:852 73 sec: 2206938 operations; 29090 current ops/sec; est completion in 10 seconds [READ: Count=14544, Max=303, Min=14, Avg=32,99, 90=59, 99=110, 99.9=181, 99.99=280] [UPDATE: Count=14557, Max=901, Min=18, Avg=33,87, 90=62, 99=117, 99.9=199, 99.99=436] 
2024-09-25 16:45:45:852 74 sec: 2232939 operations; 26001 current ops/sec; est completion in 9 second [READ: Count=12942, Max=276, Min=18, Avg=36,96, 90=63, 99=127, 99.9=200, 99.99=254] [UPDATE: Count=13045, Max=2111, Min=18, Avg=37,82, 90=66, 99=125, 99.9=213, 99.99=512] 
2024-09-25 16:45:46:852 75 sec: 2261191 operations; 28252 current ops/sec; est completion in 8 second [READ: Count=14171, Max=704, Min=18, Avg=34,16, 90=58, 99=104, 99.9=181, 99.99=379] [UPDATE: Count=14092, Max=372, Min=18, Avg=34,73, 90=61, 99=108, 99.9=180, 99.99=249] 
2024-09-25 16:45:47:852 76 sec: 2296488 operations; 35297 current ops/sec; est completion in 7 second [READ: Count=17739, Max=679, Min=18, Avg=27,24, 90=50, 99=80, 99.9=183, 99.99=425] [UPDATE: Count=17548, Max=498, Min=17, Avg=27,67, 90=53, 99=92, 99.9=177, 99.99=395] 
2024-09-25 16:45:48:852 77 sec: 2328587 operations; 32099 current ops/sec; est completion in 6 second [READ: Count=16088, Max=512, Min=18, Avg=29,97, 90=54, 99=92, 99.9=186, 99.99=256] [UPDATE: Count=16019, Max=690, Min=17, Avg=30,55, 90=56, 99=90, 99.9=165, 99.99=449] 
2024-09-25 16:45:49:852 78 sec: 2353489 operations; 24902 current ops/sec; est completion in 5 second [READ: Count=12427, Max=350, Min=18, Avg=38,58, 90=67, 99=127, 99.9=186, 99.99=253] [UPDATE: Count=12472, Max=880, Min=18, Avg=39,6, 90=70, 99=132, 99.9=209, 99.99=468] 
2024-09-25 16:45:50:852 79 sec: 2373028 operations; 19539 current ops/sec; est completion in 5 second [READ: Count=9951, Max=406, Min=18, Avg=48,41, 90=77, 99=149, 99.9=312, 99.99=363] [UPDATE: Count=9586, Max=11215, Min=17, Avg=51,85, 90=80, 99=167, 99.9=319, 99.99=5111] 
2024-09-25 16:45:51:852 80 sec: 2404269 operations; 31241 current ops/sec; est completion in 4 second [READ: Count=15699, Max=502, Min=18, Avg=30,75, 90=54, 99=90, 99.9=167, 99.99=339] [UPDATE: Count=15544, Max=907, Min=18, Avg=31,48, 90=57, 99=105, 99.9=192, 99.99=328] 
2024-09-25 16:45:52:852 81 sec: 2438290 operations; 34021 current ops/sec; est completion in 3 second [READ: Count=17022, Max=584, Min=18, Avg=28,53, 90=49, 99=77, 99.9=161, 99.99=366] [UPDATE: Count=17000, Max=262, Min=17, Avg=28,44, 90=51, 99=77, 99.9=162, 99.99=216] 
2024-09-25 16:45:53:852 82 sec: 2461173 operations; 22883 current ops/sec; est completion in 2 second [READ: Count=11459, Max=3785, Min=18, Avg=41,99, 90=69, 99=139, 99.9=252, 99.99=1942] [UPDATE: Count=11420, Max=11759, Min=18, Avg=42,97, 90=70, 99=148, 99.9=274, 99.99=530] 
2024-09-25 16:45:54:852 83 sec: 2484194 operations; 23021 current ops/sec; est completion in 1 second [READ: Count=11427, Max=2355, Min=18, Avg=41,77, 90=67, 99=131, 99.9=216, 99.99=828] [UPDATE: Count=11600, Max=5691, Min=18, Avg=42,9, 90=69, 99=139, 99.9=231, 99.99=489] 
2024-09-25 16:45:55:494 83 sec: 2500000 operations; 24581,65 current ops/sec; [READ: Count=8012, Max=430, Min=18, Avg=39,41, 90=70, 99=169, 99.9=258, 99.99=410] [CLEANUP: Count=1, Max=680, Min=680, Avg=680, 90=680, 99=680, 99.9=680, 99.99=680] [UPDATE: Count=7782, Max=410, Min=18, Avg=39,63, 90=71, 99=169, 99.9=281, 99.99=363] 
[OVERALL], RunTime(ms), 83643
[OVERALL], Throughput(ops/sec), 29888.93272599022
[TOTAL_GCS_G1_Young_Generation], Count, 31
[TOTAL_GC_TIME_G1_Young_Generation], Time(ms), 23
[TOTAL_GC_TIME_%_G1_Young_Generation], Time(%), 0.027497818107911003
[TOTAL_GCS_G1_Old_Generation], Count, 0
[TOTAL_GC_TIME_G1_Old_Generation], Time(ms), 0
[TOTAL_GC_TIME_%_G1_Old_Generation], Time(%), 0.0
[TOTAL_GCs], Count, 31
[TOTAL_GC_TIME], Time(ms), 23
[TOTAL_GC_TIME_%], Time(%), 0.027497818107911003
[READ], Operations, 1251360
[READ], AverageLatency(us), 32.21897455568342
[READ], MinLatency(us), 14
[READ], MaxLatency(us), 4451
[READ], 95thPercentileLatency(us), 68
[READ], 99thPercentileLatency(us), 111
[READ], Return=OK, 1251360
[CLEANUP], Operations, 1
[CLEANUP], AverageLatency(us), 680.0
[CLEANUP], MinLatency(us), 680
[CLEANUP], MaxLatency(us), 680
[CLEANUP], 95thPercentileLatency(us), 680
[CLEANUP], 99thPercentileLatency(us), 680
[UPDATE], Operations, 1248640
[UPDATE], AverageLatency(us), 32.67497116863147
[UPDATE], MinLatency(us), 15
[UPDATE], MaxLatency(us), 11759
[UPDATE], 95thPercentileLatency(us), 71
[UPDATE], 99thPercentileLatency(us), 117
[UPDATE], Return=OK, 1248640
