/usr/bin/java  -classpath /home/sebastiaoamaro/phd/torefidevel/tests/redis/ycsb-0.17.0/conf:/home/sebastiaoamaro/phd/torefidevel/tests/redis/ycsb-0.17.0/lib/HdrHistogram-2.1.4.jar:/home/sebastiaoamaro/phd/torefidevel/tests/redis/ycsb-0.17.0/lib/core-0.17.0.jar:/home/sebastiaoamaro/phd/torefidevel/tests/redis/ycsb-0.17.0/lib/htrace-core4-4.1.0-incubating.jar:/home/sebastiaoamaro/phd/torefidevel/tests/redis/ycsb-0.17.0/lib/jackson-core-asl-1.9.4.jar:/home/sebastiaoamaro/phd/torefidevel/tests/redis/ycsb-0.17.0/lib/jackson-mapper-asl-1.9.4.jar:/home/sebastiaoamaro/phd/torefidevel/tests/redis/ycsb-0.17.0/redis-binding/lib/commons-pool2-2.4.2.jar:/home/sebastiaoamaro/phd/torefidevel/tests/redis/ycsb-0.17.0/redis-binding/lib/jedis-2.9.0.jar:/home/sebastiaoamaro/phd/torefidevel/tests/redis/ycsb-0.17.0/redis-binding/lib/redis-binding-0.17.0.jar site.ycsb.Client -t -db site.ycsb.db.RedisClient -P workloads/workloada -s -p status.interval=1 -p operationcount=1000000 -p redis.host=172.38.0.11 -p redis.port=6379 -p redis.cluster=true -s
Command line: -t -db site.ycsb.db.RedisClient -P workloads/workloada -s -p status.interval=1 -p operationcount=1000000 -p redis.host=172.38.0.11 -p redis.port=6379 -p redis.cluster=true -s
YCSB Client 0.17.0

Loading workload...
Starting test.
2024-07-18 22:48:05:218 0 sec: 0 operations; est completion in 0 second 
DBWrapper: report latency for each error is false and specific error codes to track for latency are: []
2024-07-18 22:48:06:179 1 sec: 12818 operations; 12818 current ops/sec; est completion in 1 minute [READ: Count=6443, Max=5947, Min=14, Avg=58,1, 90=91, 99=303, 99.9=747, 99.99=976] [UPDATE: Count=6441, Max=1356, Min=15, Avg=65,01, 90=106, 99=344, 99.9=843, 99.99=1040] 
2024-07-18 22:48:07:179 2 sec: 31753 operations; 18935 current ops/sec; est completion in 1 minute [READ: Count=9605, Max=6207, Min=13, Avg=49,25, 90=72, 99=177, 99.9=1606, 99.99=5423] [UPDATE: Count=9290, Max=8463, Min=14, Avg=51,23, 90=79, 99=194, 99.9=486, 99.99=4275] 
2024-07-18 22:48:08:179 3 sec: 42575 operations; 10822 current ops/sec; est completion in 1 minute [READ: Count=5402, Max=1182, Min=15, Avg=85,93, 90=156, 99=293, 99.9=436, 99.99=1165] [UPDATE: Count=5443, Max=1138, Min=14, Avg=90,41, 90=174, 99=314, 99.9=466, 99.99=719] 
2024-07-18 22:48:09:179 4 sec: 54151 operations; 11576 current ops/sec; est completion in 1 minute [READ: Count=5718, Max=912, Min=16, Avg=80,81, 90=149, 99=304, 99.9=451, 99.99=605] [UPDATE: Count=5820, Max=769, Min=15, Avg=85,2, 90=162, 99=333, 99.9=475, 99.99=635] 
2024-07-18 22:48:10:179 5 sec: 64334 operations; 10183 current ops/sec; est completion in 1 minute [READ: Count=5133, Max=984, Min=17, Avg=90,77, 90=158, 99=291, 99.9=468, 99.99=644] [UPDATE: Count=5051, Max=595, Min=15, Avg=98,27, 90=180, 99=347, 99.9=476, 99.99=554] 
2024-07-18 22:48:11:179 6 sec: 75232 operations; 10898 current ops/sec; est completion in 1 minute [READ: Count=5417, Max=631, Min=15, Avg=86,36, 90=158, 99=311, 99.9=424, 99.99=549] [UPDATE: Count=5490, Max=684, Min=14, Avg=91,31, 90=175, 99=317, 99.9=537, 99.99=648] 
2024-07-18 22:48:12:180 7 sec: 87479 operations; 12247 current ops/sec; est completion in 1 minute [READ: Count=6148, Max=543, Min=16, Avg=77,72, 90=148, 99=305, 99.9=453, 99.99=537] [UPDATE: Count=6090, Max=589, Min=15, Avg=80,7, 90=158, 99=311, 99.9=453, 99.99=569] 
2024-07-18 22:48:13:179 8 sec: 98975 operations; 11496 current ops/sec; est completion in 1 minute [READ: Count=5791, Max=6387, Min=14, Avg=82,39, 90=147, 99=323, 99.9=471, 99.99=837] [UPDATE: Count=5699, Max=1108, Min=14, Avg=85,48, 90=159, 99=323, 99.9=487, 99.99=685] 
2024-07-18 22:48:14:179 9 sec: 110901 operations; 11926 current ops/sec; est completion in 1 minute [READ: Count=5954, Max=717, Min=14, Avg=76,52, 90=149, 99=307, 99.9=467, 99.99=532] [UPDATE: Count=5987, Max=780, Min=14, Avg=86,26, 90=171, 99=366, 99.9=583, 99.99=754] 
2024-07-18 22:48:15:180 10 sec: 125162 operations; 14261 current ops/sec; est completion in 1 minute [READ: Count=7154, Max=756, Min=13, Avg=64,76, 90=120, 99=237, 99.9=404, 99.99=459] [UPDATE: Count=7103, Max=526, Min=14, Avg=71,71, 90=135, 99=283, 99.9=427, 99.99=524] 
2024-07-18 22:48:16:180 11 sec: 133421 operations; 8259 current ops/sec; est completion in 1 minute [READ: Count=4140, Max=1306, Min=19, Avg=112,65, 90=202, 99=354, 99.9=551, 99.99=1306] [UPDATE: Count=4110, Max=816, Min=19, Avg=123,84, 90=225, 99=410, 99.9=696, 99.99=816] 
2024-07-18 22:48:17:180 12 sec: 144239 operations; 10818 current ops/sec; est completion in 1 minute [READ: Count=5495, Max=4081, Min=14, Avg=83,76, 90=157, 99=361, 99.9=1923, 99.99=2499] [UPDATE: Count=5337, Max=10847, Min=14, Avg=95,91, 90=183, 99=374, 99.9=2077, 99.99=4167] 
2024-07-18 22:48:18:179 13 sec: 154438 operations; 10199 current ops/sec; est completion in 1 minute [READ: Count=5136, Max=833, Min=14, Avg=91,62, 90=178, 99=336, 99.9=519, 99.99=777] [UPDATE: Count=5048, Max=829, Min=15, Avg=99,58, 90=192, 99=356, 99.9=530, 99.99=706] 
2024-07-18 22:48:19:180 14 sec: 165297 operations; 10859 current ops/sec; est completion in 1 minute [READ: Count=5369, Max=636, Min=16, Avg=84,79, 90=163, 99=325, 99.9=523, 99.99=580] [UPDATE: Count=5496, Max=1140, Min=14, Avg=94,61, 90=189, 99=380, 99.9=656, 99.99=777] 
2024-07-18 22:48:20:179 15 sec: 174599 operations; 9302 current ops/sec; est completion in 1 minute [READ: Count=4645, Max=1009, Min=15, Avg=99,88, 90=186, 99=350, 99.9=541, 99.99=1009] [UPDATE: Count=4657, Max=937, Min=16, Avg=109,69, 90=209, 99=368, 99.9=497, 99.99=937] 
2024-07-18 22:48:21:180 16 sec: 185895 operations; 11296 current ops/sec; est completion in 1 minute [READ: Count=5612, Max=5039, Min=15, Avg=81,98, 90=146, 99=290, 99.9=414, 99.99=606] [UPDATE: Count=5695, Max=733, Min=14, Avg=90,22, 90=166, 99=327, 99.9=443, 99.99=670] 
2024-07-18 22:48:22:180 17 sec: 196025 operations; 10130 current ops/sec; est completion in 1 minute [READ: Count=5084, Max=530, Min=24, Avg=90,51, 90=152, 99=277, 99.9=404, 99.99=476] [UPDATE: Count=5035, Max=684, Min=23, Avg=102,26, 90=178, 99=317, 99.9=456, 99.99=635] 
2024-07-18 22:48:23:180 18 sec: 206342 operations; 10317 current ops/sec; est completion in 1 minute [READ: Count=5133, Max=1180, Min=14, Avg=89,72, 90=162, 99=320, 99.9=467, 99.99=548] [UPDATE: Count=5187, Max=600, Min=13, Avg=99,2, 90=188, 99=354, 99.9=511, 99.99=589] 
2024-07-18 22:48:24:179 19 sec: 216625 operations; 10283 current ops/sec; est completion in 1 minute [READ: Count=5134, Max=1229, Min=14, Avg=90,87, 90=176, 99=340, 99.9=452, 99.99=586] [UPDATE: Count=5137, Max=737, Min=14, Avg=98,78, 90=193, 99=347, 99.9=521, 99.99=695] 
2024-07-18 22:48:25:179 20 sec: 226873 operations; 10248 current ops/sec; est completion in 1 minute [READ: Count=5167, Max=645, Min=14, Avg=89,96, 90=165, 99=314, 99.9=476, 99.99=607] [UPDATE: Count=5082, Max=1285, Min=14, Avg=100,44, 90=189, 99=364, 99.9=582, 99.99=965] 
2024-07-18 22:48:26:180 21 sec: 237024 operations; 10151 current ops/sec; est completion in 1 minute [READ: Count=4996, Max=1047, Min=15, Avg=91,72, 90=165, 99=299, 99.9=515, 99.99=1047] [UPDATE: Count=5155, Max=586, Min=14, Avg=100,16, 90=187, 99=350, 99.9=491, 99.99=583] 
2024-07-18 22:48:27:179 22 sec: 253434 operations; 16410 current ops/sec; est completion in 1 minute [READ: Count=8208, Max=539, Min=14, Avg=56,2, 90=111, 99=239, 99.9=383, 99.99=499] [UPDATE: Count=8205, Max=807, Min=13, Avg=62,31, 90=124, 99=278, 99.9=464, 99.99=669] 
2024-07-18 22:48:28:179 23 sec: 268518 operations; 15084 current ops/sec; est completion in 1 minute [READ: Count=7539, Max=2981, Min=14, Avg=61,29, 90=110, 99=224, 99.9=342, 99.99=502] [UPDATE: Count=7547, Max=479, Min=14, Avg=67,58, 90=122, 99=252, 99.9=358, 99.99=452] 
2024-07-18 22:48:29:179 24 sec: 279694 operations; 11176 current ops/sec; est completion in 1 minute [READ: Count=5584, Max=1572, Min=16, Avg=84,11, 90=154, 99=302, 99.9=578, 99.99=961] [UPDATE: Count=5589, Max=766, Min=15, Avg=90,44, 90=171, 99=320, 99.9=480, 99.99=590] 
2024-07-18 22:48:30:180 25 sec: 292602 operations; 12908 current ops/sec; est completion in 1 minute [READ: Count=6455, Max=965, Min=15, Avg=71,8, 90=128, 99=274, 99.9=470, 99.99=789] [UPDATE: Count=6451, Max=736, Min=14, Avg=78,94, 90=146, 99=312, 99.9=498, 99.99=687] 
2024-07-18 22:48:31:179 26 sec: 307444 operations; 14842 current ops/sec; est completion in 59 seconds [READ: Count=7346, Max=648, Min=14, Avg=62,63, 90=106, 99=235, 99.9=475, 99.99=558] [UPDATE: Count=7502, Max=732, Min=14, Avg=68,18, 90=118, 99=245, 99.9=419, 99.99=724] 
2024-07-18 22:48:32:179 27 sec: 321681 operations; 14237 current ops/sec; est completion in 57 seconds [READ: Count=7191, Max=1022, Min=14, Avg=64,81, 90=129, 99=309, 99.9=546, 99.99=948] [UPDATE: Count=7052, Max=1536, Min=14, Avg=71,68, 90=137, 99=371, 99.9=640, 99.99=1117] 
2024-07-18 22:48:33:180 28 sec: 334830 operations; 13149 current ops/sec; est completion in 56 seconds [READ: Count=6623, Max=639, Min=14, Avg=70,25, 90=127, 99=247, 99.9=378, 99.99=469] [UPDATE: Count=6518, Max=1144, Min=14, Avg=78,09, 90=143, 99=294, 99.9=447, 99.99=696] 
2024-07-18 22:48:34:179 29 sec: 349174 operations; 14344 current ops/sec; est completion in 55 seconds [READ: Count=7203, Max=2347, Min=14, Avg=63,3, 90=108, 99=254, 99.9=746, 99.99=2193] [UPDATE: Count=7143, Max=5151, Min=14, Avg=71,54, 90=121, 99=283, 99.9=1412, 99.99=4611] 
2024-07-18 22:48:35:179 30 sec: 364178 operations; 15004 current ops/sec; est completion in 53 seconds [READ: Count=7525, Max=4283, Min=13, Avg=62,27, 90=111, 99=275, 99.9=916, 99.99=2747] [UPDATE: Count=7475, Max=7127, Min=14, Avg=66,99, 90=122, 99=300, 99.9=573, 99.99=3737] 
2024-07-18 22:48:36:179 31 sec: 375773 operations; 11595 current ops/sec; est completion in 52 seconds [READ: Count=5801, Max=1014, Min=15, Avg=80,26, 90=159, 99=332, 99.9=534, 99.99=967] [UPDATE: Count=5793, Max=1014, Min=15, Avg=87,4, 90=184, 99=353, 99.9=544, 99.99=758] 
2024-07-18 22:48:37:179 32 sec: 389684 operations; 13911 current ops/sec; est completion in 51 seconds [READ: Count=6978, Max=1143, Min=14, Avg=67,15, 90=134, 99=316, 99.9=567, 99.99=1081] [UPDATE: Count=6931, Max=939, Min=14, Avg=72,58, 90=150, 99=350, 99.9=602, 99.99=787] 
2024-07-18 22:48:38:180 33 sec: 402617 operations; 12933 current ops/sec; est completion in 49 seconds [READ: Count=6534, Max=1025, Min=14, Avg=72,11, 90=131, 99=293, 99.9=455, 99.99=963] [UPDATE: Count=6398, Max=853, Min=13, Avg=78,57, 90=148, 99=323, 99.9=519, 99.99=839] 
2024-07-18 22:48:39:179 34 sec: 420083 operations; 17466 current ops/sec; est completion in 47 seconds [READ: Count=8842, Max=671, Min=13, Avg=53,3, 90=100, 99=267, 99.9=414, 99.99=644] [UPDATE: Count=8625, Max=1237, Min=13, Avg=57,91, 90=111, 99=293, 99.9=594, 99.99=1140] 
2024-07-18 22:48:40:180 35 sec: 432920 operations; 12837 current ops/sec; est completion in 46 seconds [READ: Count=6404, Max=1699, Min=14, Avg=72,61, 90=134, 99=274, 99.9=506, 99.99=787] [UPDATE: Count=6435, Max=852, Min=14, Avg=79,35, 90=152, 99=318, 99.9=456, 99.99=681] 
2024-07-18 22:48:41:180 36 sec: 440657 operations; 7737 current ops/sec; est completion in 46 seconds [READ: Count=3881, Max=1001, Min=14, Avg=118,18, 90=222, 99=378, 99.9=556, 99.99=1001] [UPDATE: Count=3860, Max=1048, Min=14, Avg=133,89, 90=259, 99=414, 99.9=592, 99.99=1048] 
2024-07-18 22:48:42:179 37 sec: 451221 operations; 10564 current ops/sec; est completion in 45 seconds [READ: Count=5256, Max=655, Min=14, Avg=87,64, 90=164, 99=305, 99.9=439, 99.99=646] [UPDATE: Count=5308, Max=711, Min=14, Avg=96,58, 90=186, 99=332, 99.9=500, 99.99=578] 
2024-07-18 22:48:43:180 38 sec: 460530 operations; 9309 current ops/sec; est completion in 45 seconds [READ: Count=4629, Max=699, Min=16, Avg=99,47, 90=183, 99=325, 99.9=439, 99.99=699] [UPDATE: Count=4673, Max=637, Min=16, Avg=110,12, 90=204, 99=365, 99.9=527, 99.99=637] 
2024-07-18 22:48:44:180 39 sec: 471621 operations; 11091 current ops/sec; est completion in 44 seconds [READ: Count=5507, Max=698, Min=14, Avg=83,6, 90=154, 99=307, 99.9=495, 99.99=660] [UPDATE: Count=5591, Max=703, Min=14, Avg=92,04, 90=177, 99=351, 99.9=497, 99.99=643] 
2024-07-18 22:48:45:179 40 sec: 481222 operations; 9601 current ops/sec; est completion in 44 seconds [READ: Count=4772, Max=995, Min=15, Avg=96,48, 90=173, 99=306, 99.9=574, 99.99=995] [UPDATE: Count=4828, Max=2317, Min=15, Avg=106,27, 90=199, 99=337, 99.9=456, 99.99=2317] 
2024-07-18 22:48:46:179 41 sec: 493692 operations; 12470 current ops/sec; est completion in 43 seconds [READ: Count=6294, Max=784, Min=14, Avg=73,06, 90=140, 99=299, 99.9=440, 99.99=710] [UPDATE: Count=6168, Max=674, Min=14, Avg=83,15, 90=160, 99=337, 99.9=539, 99.99=670] 
2024-07-18 22:48:47:179 42 sec: 504541 operations; 10849 current ops/sec; est completion in 42 seconds [READ: Count=5489, Max=803, Min=14, Avg=84,52, 90=161, 99=314, 99.9=621, 99.99=799] [UPDATE: Count=5366, Max=830, Min=14, Avg=95,28, 90=193, 99=357, 99.9=556, 99.99=689] 
2024-07-18 22:48:48:180 43 sec: 514435 operations; 9894 current ops/sec; est completion in 41 seconds [READ: Count=5015, Max=743, Min=15, Avg=92,97, 90=182, 99=349, 99.9=535, 99.99=647] [UPDATE: Count=4877, Max=920, Min=14, Avg=103,04, 90=203, 99=373, 99.9=688, 99.99=920] 
2024-07-18 22:48:49:179 44 sec: 525603 operations; 11168 current ops/sec; est completion in 40 seconds [READ: Count=5566, Max=845, Min=14, Avg=83,12, 90=159, 99=315, 99.9=530, 99.99=706] [UPDATE: Count=5600, Max=1295, Min=14, Avg=91,36, 90=175, 99=339, 99.9=544, 99.99=657] 
2024-07-18 22:48:50:180 45 sec: 535865 operations; 10262 current ops/sec; est completion in 39 seconds [READ: Count=5214, Max=2239, Min=15, Avg=90,47, 90=191, 99=370, 99.9=616, 99.99=1038] [UPDATE: Count=5054, Max=1089, Min=15, Avg=99,31, 90=217, 99=423, 99.9=661, 99.99=929] 
2024-07-18 22:48:51:180 46 sec: 546665 operations; 10800 current ops/sec; est completion in 39 seconds [READ: Count=5456, Max=935, Min=14, Avg=86,02, 90=171, 99=313, 99.9=583, 99.99=721] [UPDATE: Count=5341, Max=668, Min=14, Avg=94,11, 90=191, 99=357, 99.9=593, 99.99=653] 
2024-07-18 22:48:52:179 47 sec: 557889 operations; 11224 current ops/sec; est completion in 38 seconds [READ: Count=5601, Max=839, Min=14, Avg=82,61, 90=159, 99=319, 99.9=497, 99.99=838] [UPDATE: Count=5628, Max=709, Min=14, Avg=90,63, 90=180, 99=350, 99.9=551, 99.99=668] 
2024-07-18 22:48:53:179 48 sec: 567443 operations; 9554 current ops/sec; est completion in 37 seconds [READ: Count=4796, Max=918, Min=15, Avg=97,4, 90=179, 99=333, 99.9=484, 99.99=918] [UPDATE: Count=4750, Max=722, Min=15, Avg=106,89, 90=205, 99=362, 99.9=519, 99.99=722] 
2024-07-18 22:48:54:180 49 sec: 576242 operations; 8799 current ops/sec; est completion in 37 seconds [READ: Count=4374, Max=523, Min=17, Avg=105,05, 90=201, 99=330, 99.9=465, 99.99=523] [UPDATE: Count=4429, Max=723, Min=16, Avg=116,66, 90=226, 99=372, 99.9=586, 99.99=723] 
2024-07-18 22:48:55:179 50 sec: 588415 operations; 12173 current ops/sec; est completion in 35 seconds [READ: Count=6047, Max=1027, Min=14, Avg=75,57, 90=149, 99=322, 99.9=495, 99.99=708] [UPDATE: Count=6126, Max=895, Min=15, Avg=84, 90=167, 99=357, 99.9=576, 99.99=796] 
2024-07-18 22:48:56:179 51 sec: 600194 operations; 11779 current ops/sec; est completion in 34 seconds [READ: Count=5919, Max=568, Min=15, Avg=77,26, 90=148, 99=285, 99.9=409, 99.99=546] [UPDATE: Count=5859, Max=3927, Min=14, Avg=88,03, 90=170, 99=332, 99.9=469, 99.99=863] 
2024-07-18 22:48:57:179 52 sec: 614032 operations; 13838 current ops/sec; est completion in 33 seconds [READ: Count=7007, Max=670, Min=14, Avg=66,8, 90=126, 99=268, 99.9=393, 99.99=625] [UPDATE: Count=6831, Max=758, Min=14, Avg=73,88, 90=142, 99=306, 99.9=491, 99.99=722] 
2024-07-18 22:48:58:180 53 sec: 626843 operations; 12811 current ops/sec; est completion in 32 seconds [READ: Count=6353, Max=716, Min=15, Avg=72,92, 90=135, 99=278, 99.9=458, 99.99=662] [UPDATE: Count=6465, Max=760, Min=15, Avg=78,97, 90=146, 99=291, 99.9=446, 99.99=743] 
2024-07-18 22:48:59:179 54 sec: 636841 operations; 9998 current ops/sec; est completion in 31 seconds [READ: Count=4973, Max=597, Min=15, Avg=91,4, 90=170, 99=339, 99.9=499, 99.99=597] [UPDATE: Count=5016, Max=856, Min=14, Avg=103,39, 90=197, 99=369, 99.9=628, 99.99=778] 
2024-07-18 22:49:00:179 55 sec: 651257 operations; 14416 current ops/sec; est completion in 30 seconds [READ: Count=7153, Max=595, Min=14, Avg=63,85, 90=125, 99=265, 99.9=418, 99.99=575] [UPDATE: Count=7264, Max=821, Min=14, Avg=70,95, 90=142, 99=308, 99.9=496, 99.99=621] 
2024-07-18 22:49:01:179 56 sec: 666701 operations; 15444 current ops/sec; est completion in 28 seconds [READ: Count=7676, Max=590, Min=14, Avg=59,93, 90=110, 99=224, 99.9=329, 99.99=551] [UPDATE: Count=7769, Max=545, Min=14, Avg=66,11, 90=123, 99=261, 99.9=386, 99.99=535] 
2024-07-18 22:49:02:179 57 sec: 676343 operations; 9642 current ops/sec; est completion in 28 seconds [READ: Count=4923, Max=1776, Min=16, Avg=96,08, 90=175, 99=314, 99.9=481, 99.99=1776] [UPDATE: Count=4716, Max=6171, Min=20, Avg=107,8, 90=198, 99=335, 99.9=522, 99.99=6171] 
2024-07-18 22:49:03:179 58 sec: 685949 operations; 9606 current ops/sec; est completion in 27 seconds [READ: Count=4757, Max=804, Min=14, Avg=95,46, 90=190, 99=332, 99.9=519, 99.99=804] [UPDATE: Count=4853, Max=891, Min=14, Avg=105,81, 90=218, 99=372, 99.9=478, 99.99=891] 
2024-07-18 22:49:04:180 59 sec: 696300 operations; 10351 current ops/sec; est completion in 26 seconds [READ: Count=5230, Max=653, Min=15, Avg=89,83, 90=163, 99=306, 99.9=437, 99.99=560] [UPDATE: Count=5114, Max=1091, Min=16, Avg=98,56, 90=181, 99=321, 99.9=499, 99.99=852] 
2024-07-18 22:49:05:179 60 sec: 705781 operations; 9481 current ops/sec; est completion in 26 seconds [READ: Count=4740, Max=5331, Min=14, Avg=98,58, 90=195, 99=368, 99.9=587, 99.99=5331] [UPDATE: Count=4765, Max=884, Min=14, Avg=106,33, 90=223, 99=390, 99.9=562, 99.99=884] 
2024-07-18 22:49:06:179 61 sec: 717505 operations; 11724 current ops/sec; est completion in 25 seconds [READ: Count=5875, Max=619, Min=13, Avg=78,44, 90=145, 99=301, 99.9=467, 99.99=539] [UPDATE: Count=5828, Max=882, Min=14, Avg=87,89, 90=168, 99=348, 99.9=608, 99.99=874] 
2024-07-18 22:49:07:179 62 sec: 730045 operations; 12540 current ops/sec; est completion in 23 seconds [READ: Count=6313, Max=683, Min=14, Avg=74,49, 90=139, 99=281, 99.9=452, 99.99=547] [UPDATE: Count=6233, Max=712, Min=14, Avg=80,64, 90=155, 99=320, 99.9=508, 99.99=585] 
2024-07-18 22:49:08:180 63 sec: 742609 operations; 12564 current ops/sec; est completion in 22 seconds [READ: Count=6395, Max=1134, Min=14, Avg=73,63, 90=136, 99=287, 99.9=504, 99.99=1001] [UPDATE: Count=6163, Max=1472, Min=14, Avg=81,5, 90=154, 99=328, 99.9=503, 99.99=740] 
2024-07-18 22:49:09:179 64 sec: 755530 operations; 12921 current ops/sec; est completion in 21 seconds [READ: Count=6502, Max=818, Min=14, Avg=71,72, 90=140, 99=285, 99.9=447, 99.99=812] [UPDATE: Count=6422, Max=1281, Min=14, Avg=78,76, 90=157, 99=318, 99.9=522, 99.99=1025] 
2024-07-18 22:49:10:179 65 sec: 766320 operations; 10790 current ops/sec; est completion in 20 seconds [READ: Count=5417, Max=15599, Min=15, Avg=87,17, 90=156, 99=333, 99.9=1006, 99.99=5659] [UPDATE: Count=5375, Max=8067, Min=16, Avg=92,87, 90=177, 99=346, 99.9=719, 99.99=1352] 
2024-07-18 22:49:11:179 66 sec: 780746 operations; 14426 current ops/sec; est completion in 19 seconds [READ: Count=7195, Max=927, Min=13, Avg=63,49, 90=117, 99=268, 99.9=473, 99.99=625] [UPDATE: Count=7230, Max=7131, Min=14, Avg=71,33, 90=131, 99=311, 99.9=549, 99.99=1540] 
2024-07-18 22:49:12:179 67 sec: 793845 operations; 13099 current ops/sec; est completion in 18 seconds [READ: Count=6565, Max=977, Min=15, Avg=70,89, 90=127, 99=268, 99.9=412, 99.99=716] [UPDATE: Count=6531, Max=740, Min=15, Avg=77,69, 90=145, 99=307, 99.9=473, 99.99=721] 
2024-07-18 22:49:13:179 68 sec: 806404 operations; 12559 current ops/sec; est completion in 17 seconds [READ: Count=6199, Max=706, Min=14, Avg=74,68, 90=133, 99=279, 99.9=397, 99.99=491] [UPDATE: Count=6362, Max=948, Min=14, Avg=80,28, 90=147, 99=308, 99.9=477, 99.99=766] 
2024-07-18 22:49:14:179 69 sec: 818838 operations; 12434 current ops/sec; est completion in 16 seconds [READ: Count=6199, Max=880, Min=14, Avg=74,86, 90=146, 99=297, 99.9=478, 99.99=790] [UPDATE: Count=6236, Max=578, Min=14, Avg=81,52, 90=166, 99=334, 99.9=473, 99.99=537] 
2024-07-18 22:49:15:179 70 sec: 831215 operations; 12377 current ops/sec; est completion in 15 seconds [READ: Count=6270, Max=769, Min=14, Avg=74,12, 90=147, 99=295, 99.9=483, 99.99=676] [UPDATE: Count=6106, Max=2219, Min=14, Avg=83,05, 90=168, 99=330, 99.9=527, 99.99=1176] 
2024-07-18 22:49:16:179 71 sec: 841799 operations; 10584 current ops/sec; est completion in 14 seconds [READ: Count=5273, Max=479, Min=15, Avg=87,01, 90=159, 99=312, 99.9=428, 99.99=478] [UPDATE: Count=5310, Max=3877, Min=15, Avg=97,61, 90=181, 99=365, 99.9=576, 99.99=926] 
2024-07-18 22:49:17:179 72 sec: 855365 operations; 13566 current ops/sec; est completion in 13 seconds [READ: Count=6782, Max=683, Min=14, Avg=67,48, 90=128, 99=286, 99.9=416, 99.99=482] [UPDATE: Count=6783, Max=1159, Min=14, Avg=75,37, 90=147, 99=320, 99.9=499, 99.99=699] 
2024-07-18 22:49:18:179 73 sec: 863782 operations; 8417 current ops/sec; est completion in 12 seconds [READ: Count=4135, Max=1880, Min=16, Avg=109,15, 90=200, 99=355, 99.9=612, 99.99=1880] [UPDATE: Count=4284, Max=964, Min=15, Avg=122,18, 90=226, 99=409, 99.9=600, 99.99=964] 
2024-07-18 22:49:19:179 74 sec: 875559 operations; 11777 current ops/sec; est completion in 11 seconds [READ: Count=5881, Max=722, Min=14, Avg=78,92, 90=141, 99=307, 99.9=513, 99.99=576] [UPDATE: Count=5895, Max=1370, Min=14, Avg=86,22, 90=157, 99=334, 99.9=462, 99.99=754] 
2024-07-18 22:49:20:179 75 sec: 888407 operations; 12848 current ops/sec; est completion in 10 seconds [READ: Count=6389, Max=1135, Min=14, Avg=72,22, 90=133, 99=306, 99.9=503, 99.99=777] [UPDATE: Count=6460, Max=661, Min=14, Avg=79,11, 90=155, 99=326, 99.9=488, 99.99=568] 
2024-07-18 22:49:21:179 76 sec: 899892 operations; 11485 current ops/sec; est completion in 9 second [READ: Count=5798, Max=589, Min=14, Avg=79,53, 90=144, 99=299, 99.9=444, 99.99=578] [UPDATE: Count=5684, Max=794, Min=14, Avg=90,03, 90=169, 99=349, 99.9=574, 99.99=775] 
2024-07-18 22:49:22:179 77 sec: 914664 operations; 14772 current ops/sec; est completion in 8 second [READ: Count=7367, Max=724, Min=14, Avg=62,36, 90=113, 99=261, 99.9=412, 99.99=544] [UPDATE: Count=7409, Max=841, Min=14, Avg=69,14, 90=130, 99=294, 99.9=503, 99.99=779] 
2024-07-18 22:49:23:180 78 sec: 924368 operations; 9704 current ops/sec; est completion in 7 second [READ: Count=4893, Max=621, Min=14, Avg=94,14, 90=174, 99=333, 99.9=486, 99.99=621] [UPDATE: Count=4807, Max=778, Min=15, Avg=107,12, 90=206, 99=387, 99.9=600, 99.99=778] 
2024-07-18 22:49:24:179 79 sec: 934290 operations; 9922 current ops/sec; est completion in 6 second [READ: Count=5029, Max=661, Min=15, Avg=91,67, 90=174, 99=333, 99.9=522, 99.99=617] [UPDATE: Count=4894, Max=5607, Min=15, Avg=104,91, 90=204, 99=407, 99.9=690, 99.99=5607] 
2024-07-18 22:49:25:179 80 sec: 946072 operations; 11782 current ops/sec; est completion in 5 second [READ: Count=5818, Max=693, Min=16, Avg=76,94, 90=148, 99=292, 99.9=422, 99.99=587] [UPDATE: Count=5969, Max=657, Min=15, Avg=87,79, 90=175, 99=344, 99.9=533, 99.99=601] 
2024-07-18 22:49:26:179 81 sec: 959090 operations; 13018 current ops/sec; est completion in 4 second [READ: Count=6488, Max=846, Min=15, Avg=71,08, 90=133, 99=274, 99.9=449, 99.99=778] [UPDATE: Count=6525, Max=721, Min=14, Avg=78,31, 90=149, 99=311, 99.9=427, 99.99=649] 
2024-07-18 22:49:27:179 82 sec: 969945 operations; 10855 current ops/sec; est completion in 3 second [READ: Count=5443, Max=1086, Min=14, Avg=85,48, 90=164, 99=320, 99.9=703, 99.99=1014] [UPDATE: Count=5411, Max=678, Min=14, Avg=93,96, 90=186, 99=339, 99.9=547, 99.99=665] 
2024-07-18 22:49:28:179 83 sec: 979676 operations; 9731 current ops/sec; est completion in 2 second [READ: Count=4832, Max=773, Min=14, Avg=94,62, 90=188, 99=354, 99.9=584, 99.99=773] [UPDATE: Count=4901, Max=2843, Min=14, Avg=105,29, 90=212, 99=404, 99.9=629, 99.99=2843] 
2024-07-18 22:49:29:179 84 sec: 989776 operations; 10100 current ops/sec; est completion in 1 second [READ: Count=4945, Max=1441, Min=14, Avg=92,1, 90=201, 99=384, 99.9=652, 99.99=1441] [UPDATE: Count=5154, Max=674, Min=14, Avg=100,49, 90=215, 99=424, 99.9=581, 99.99=653] 
2024-07-18 22:49:30:180 85 sec: 998920 operations; 9144 current ops/sec; est completion in 1 second [READ: Count=4649, Max=723, Min=17, Avg=100,08, 90=192, 99=357, 99.9=524, 99.99=723] [UPDATE: Count=4494, Max=995, Min=17, Avg=113,2, 90=234, 99=407, 99.9=627, 99.99=995] 
2024-07-18 22:49:30:312 85 sec: 1000000 operations; 8120,3 current ops/sec; [READ: Count=551, Max=557, Min=19, Avg=113,55, 90=229, 99=374, 99.9=543, 99.99=557] [CLEANUP: Count=1, Max=1831, Min=1831, Avg=1831, 90=1831, 99=1831, 99.9=1831, 99.99=1831] [UPDATE: Count=526, Max=1086, Min=20, Avg=122,3, 90=251, 99=356, 99.9=545, 99.99=1086] 
[OVERALL], RunTime(ms), 85133
[OVERALL], Throughput(ops/sec), 11746.326336438278
[TOTAL_GCS_G1_Young_Generation], Count, 13
[TOTAL_GC_TIME_G1_Young_Generation], Time(ms), 48
[TOTAL_GC_TIME_%_G1_Young_Generation], Time(%), 0.05638236641490374
[TOTAL_GCS_G1_Old_Generation], Count, 0
[TOTAL_GC_TIME_G1_Old_Generation], Time(ms), 0
[TOTAL_GC_TIME_%_G1_Old_Generation], Time(%), 0.0
[TOTAL_GCs], Count, 13
[TOTAL_GC_TIME], Time(ms), 48
[TOTAL_GC_TIME_%], Time(%), 0.05638236641490374
[READ], Operations, 500740
[READ], AverageLatency(us), 78.58553141350801
[READ], MinLatency(us), 13
[READ], MaxLatency(us), 15599
[READ], 95thPercentileLatency(us), 198
[READ], 99thPercentileLatency(us), 307
[READ], Return=OK, 500740
[CLEANUP], Operations, 1
[CLEANUP], AverageLatency(us), 1831.0
[CLEANUP], MinLatency(us), 1831
[CLEANUP], MaxLatency(us), 1831
[CLEANUP], 95thPercentileLatency(us), 1831
[CLEANUP], 99thPercentileLatency(us), 1831
[UPDATE], Operations, 499260
[UPDATE], AverageLatency(us), 86.59521091214998
[UPDATE], MinLatency(us), 13
[UPDATE], MaxLatency(us), 10847
[UPDATE], 95thPercentileLatency(us), 224
[UPDATE], 99thPercentileLatency(us), 342
[UPDATE], Return=OK, 499260
