/usr/bin/java  -classpath /home/sebastiaoamaro/phd/torefidevel/tests/redis/ycsb-0.17.0/conf:/home/sebastiaoamaro/phd/torefidevel/tests/redis/ycsb-0.17.0/lib/HdrHistogram-2.1.4.jar:/home/sebastiaoamaro/phd/torefidevel/tests/redis/ycsb-0.17.0/lib/core-0.17.0.jar:/home/sebastiaoamaro/phd/torefidevel/tests/redis/ycsb-0.17.0/lib/htrace-core4-4.1.0-incubating.jar:/home/sebastiaoamaro/phd/torefidevel/tests/redis/ycsb-0.17.0/lib/jackson-core-asl-1.9.4.jar:/home/sebastiaoamaro/phd/torefidevel/tests/redis/ycsb-0.17.0/lib/jackson-mapper-asl-1.9.4.jar:/home/sebastiaoamaro/phd/torefidevel/tests/redis/ycsb-0.17.0/redis-binding/lib/commons-pool2-2.4.2.jar:/home/sebastiaoamaro/phd/torefidevel/tests/redis/ycsb-0.17.0/redis-binding/lib/jedis-2.9.0.jar:/home/sebastiaoamaro/phd/torefidevel/tests/redis/ycsb-0.17.0/redis-binding/lib/redis-binding-0.17.0.jar site.ycsb.Client -t -db site.ycsb.db.RedisClient -P workloads/workloada -s -p status.interval=1 -p operationcount=2500000 -p redis.host=172.38.0.11 -p redis.port=6379 -p redis.cluster=true -s
Command line: -t -db site.ycsb.db.RedisClient -P workloads/workloada -s -p status.interval=1 -p operationcount=2500000 -p redis.host=172.38.0.11 -p redis.port=6379 -p redis.cluster=true -s
YCSB Client 0.17.0

Loading workload...
Starting test.
2024-09-17 18:25:44:621 0 sec: 0 operations; est completion in 0 second 
DBWrapper: report latency for each error is false and specific error codes to track for latency are: []
2024-09-17 18:25:45:598 1 sec: 9371 operations; 9371 current ops/sec; est completion in 4 minutes [READ: Count=4603, Max=5575, Min=19, Avg=86,33, 90=133, 99=237, 99.9=804, 99.99=5575] [UPDATE: Count=4808, Max=996, Min=20, Avg=94,38, 90=151, 99=275, 99.9=950, 99.99=996] 
2024-09-17 18:25:46:598 2 sec: 22368 operations; 12997 current ops/sec; est completion in 3 minutes [READ: Count=6484, Max=889, Min=19, Avg=72,45, 90=111, 99=222, 99.9=800, 99.99=867] [UPDATE: Count=6483, Max=8775, Min=19, Avg=76,29, 90=117, 99=227, 99.9=791, 99.99=2077] 
2024-09-17 18:25:47:598 3 sec: 40555 operations; 18187 current ops/sec; est completion in 3 minutes [READ: Count=9129, Max=875, Min=19, Avg=52,85, 90=85, 99=156, 99.9=479, 99.99=867] [UPDATE: Count=9061, Max=1003, Min=19, Avg=53,33, 90=87, 99=165, 99.9=473, 99.99=896] 
2024-09-17 18:25:48:598 4 sec: 55930 operations; 15375 current ops/sec; est completion in 2 minutes [READ: Count=7699, Max=833, Min=20, Avg=63,18, 90=98, 99=181, 99.9=346, 99.99=580] [UPDATE: Count=7675, Max=881, Min=19, Avg=62,85, 90=99, 99=189, 99.9=372, 99.99=642] 
2024-09-17 18:25:49:598 5 sec: 71361 operations; 15415,58 current ops/sec; est completion in 2 minutes [READ: Count=7648, Max=722, Min=20, Avg=62,87, 90=98, 99=191, 99.9=320, 99.99=446] [UPDATE: Count=7778, Max=486, Min=18, Avg=63,3, 90=101, 99=204, 99.9=359, 99.99=478] 
2024-09-17 18:25:50:598 6 sec: 104136 operations; 32807,81 current ops/sec; est completion in 2 minutes [READ: Count=16499, Max=683, Min=19, Avg=30,13, 90=49, 99=102, 99.9=184, 99.99=322] [UPDATE: Count=16285, Max=758, Min=18, Avg=28,78, 90=48, 99=103, 99.9=190, 99.99=321] 
2024-09-17 18:25:51:598 7 sec: 126038 operations; 21902 current ops/sec; est completion in 2 minutes [READ: Count=11100, Max=897, Min=19, Avg=43,89, 90=73, 99=144, 99.9=678, 99.99=875] [UPDATE: Count=10804, Max=1153, Min=19, Avg=45,17, 90=76, 99=152, 99.9=716, 99.99=975] 
2024-09-17 18:25:52:598 8 sec: 154071 operations; 28033 current ops/sec; est completion in 2 minutes [READ: Count=13915, Max=1166, Min=19, Avg=34,27, 90=62, 99=114, 99.9=208, 99.99=911] [UPDATE: Count=14112, Max=930, Min=19, Avg=34,99, 90=65, 99=122, 99.9=261, 99.99=842] 
2024-09-17 18:25:53:598 9 sec: 188113 operations; 34042 current ops/sec; est completion in 1 minute [READ: Count=17099, Max=917, Min=19, Avg=28,56, 90=48, 99=82, 99.9=147, 99.99=831] [UPDATE: Count=16934, Max=952, Min=18, Avg=28,35, 90=50, 99=83, 99.9=158, 99.99=895] 
2024-09-17 18:25:54:598 10 sec: 205823 operations; 17710 current ops/sec; est completion in 1 minute [READ: Count=8854, Max=379, Min=18, Avg=54,4, 90=92, 99=190, 99.9=288, 99.99=368] [UPDATE: Count=8859, Max=491, Min=18, Avg=56,08, 90=97, 99=201, 99.9=336, 99.99=406] 
2024-09-17 18:25:55:598 11 sec: 225101 operations; 19278 current ops/sec; est completion in 1 minute [READ: Count=9541, Max=427, Min=17, Avg=49,79, 90=86, 99=176, 99.9=248, 99.99=325] [UPDATE: Count=9737, Max=390, Min=19, Avg=51,73, 90=93, 99=192, 99.9=297, 99.99=369] 
2024-09-17 18:25:56:598 12 sec: 250618 operations; 25517 current ops/sec; est completion in 1 minute [READ: Count=12757, Max=343, Min=19, Avg=37,88, 90=66, 99=132, 99.9=226, 99.99=329] [UPDATE: Count=12767, Max=301, Min=19, Avg=38,44, 90=70, 99=138, 99.9=228, 99.99=296] 
2024-09-17 18:25:57:598 13 sec: 266632 operations; 16014 current ops/sec; est completion in 1 minute [READ: Count=8050, Max=884, Min=19, Avg=59,68, 90=97, 99=198, 99.9=338, 99.99=872] [UPDATE: Count=7958, Max=456, Min=19, Avg=62,64, 90=104, 99=215, 99.9=332, 99.99=407] 
2024-09-17 18:25:58:598 14 sec: 295614 operations; 28982 current ops/sec; est completion in 1 minute [READ: Count=14473, Max=342, Min=18, Avg=33,43, 90=66, 99=138, 99.9=241, 99.99=327] [UPDATE: Count=14512, Max=1122, Min=19, Avg=33,72, 90=67, 99=140, 99.9=237, 99.99=323] 
2024-09-17 18:25:59:598 15 sec: 317152 operations; 21538 current ops/sec; est completion in 1 minute [READ: Count=10682, Max=367, Min=19, Avg=44,56, 90=75, 99=134, 99.9=197, 99.99=277] [UPDATE: Count=10854, Max=897, Min=19, Avg=45,96, 90=78, 99=142, 99.9=221, 99.99=840] 
2024-09-17 18:26:00:598 16 sec: 348707 operations; 31555 current ops/sec; est completion in 1 minute [READ: Count=15547, Max=747, Min=19, Avg=30,49, 90=50, 99=106, 99.9=167, 99.99=517] [UPDATE: Count=16020, Max=3379, Min=19, Avg=30,87, 90=53, 99=114, 99.9=196, 99.99=297] 
2024-09-17 18:26:01:598 17 sec: 377774 operations; 29067 current ops/sec; est completion in 1 minute [READ: Count=14430, Max=894, Min=18, Avg=33,17, 90=60, 99=114, 99.9=209, 99.99=857] [UPDATE: Count=14627, Max=906, Min=17, Avg=33,82, 90=62, 99=124, 99.9=237, 99.99=844] 
2024-09-17 18:26:02:598 18 sec: 398109 operations; 20335 current ops/sec; est completion in 1 minute [READ: Count=10069, Max=895, Min=18, Avg=46,96, 90=85, 99=161, 99.9=305, 99.99=879] [UPDATE: Count=10263, Max=1018, Min=18, Avg=49,06, 90=88, 99=184, 99.9=535, 99.99=946] 
2024-09-17 18:26:03:598 19 sec: 416340 operations; 18231 current ops/sec; est completion in 1 minute [READ: Count=9122, Max=931, Min=19, Avg=53,1, 90=90, 99=178, 99.9=816, 99.99=914] [UPDATE: Count=9110, Max=990, Min=19, Avg=54,11, 90=94, 99=183, 99.9=790, 99.99=939] 
2024-09-17 18:26:04:598 20 sec: 440426 operations; 24061,94 current ops/sec; est completion in 1 minute [READ: Count=11976, Max=814, Min=19, Avg=39,79, 90=78, 99=144, 99.9=266, 99.99=806] [UPDATE: Count=12124, Max=896, Min=19, Avg=41,03, 90=81, 99=160, 99.9=271, 99.99=894] 
2024-09-17 18:26:05:598 21 sec: 475676 operations; 35285,29 current ops/sec; est completion in 1 minute [READ: Count=17518, Max=270, Min=19, Avg=27,43, 90=47, 99=87, 99.9=147, 99.99=249] [UPDATE: Count=17718, Max=1225, Min=18, Avg=27,48, 90=49, 99=87, 99.9=169, 99.99=290] 
2024-09-17 18:26:06:598 22 sec: 502167 operations; 26491 current ops/sec; est completion in 1 minute [READ: Count=13213, Max=966, Min=17, Avg=36,24, 90=60, 99=118, 99.9=201, 99.99=254] [UPDATE: Count=13280, Max=732, Min=18, Avg=37,12, 90=63, 99=124, 99.9=224, 99.99=492] 
2024-09-17 18:26:07:598 23 sec: 524414 operations; 22247 current ops/sec; est completion in 1 minute [READ: Count=11183, Max=881, Min=19, Avg=43,44, 90=73, 99=171, 99.9=406, 99.99=745] [UPDATE: Count=11060, Max=1016, Min=19, Avg=44,3, 90=77, 99=177, 99.9=366, 99.99=598] 
2024-09-17 18:26:08:598 24 sec: 549227 operations; 24813 current ops/sec; est completion in 1 minute [READ: Count=12541, Max=352, Min=14, Avg=38,85, 90=71, 99=134, 99.9=218, 99.99=311] [UPDATE: Count=12287, Max=253, Min=18, Avg=39,66, 90=74, 99=141, 99.9=206, 99.99=237] 
2024-09-17 18:26:09:598 25 sec: 572372 operations; 23145 current ops/sec; est completion in 1 minute [READ: Count=11582, Max=379, Min=19, Avg=41,91, 90=73, 99=133, 99.9=217, 99.99=285] [UPDATE: Count=11563, Max=421, Min=18, Avg=42,46, 90=75, 99=138, 99.9=250, 99.99=338] 
2024-09-17 18:26:10:598 26 sec: 596763 operations; 24391 current ops/sec; est completion in 1 minute [READ: Count=12247, Max=489, Min=15, Avg=39,42, 90=66, 99=142, 99.9=262, 99.99=395] [UPDATE: Count=12129, Max=663, Min=19, Avg=40,52, 90=70, 99=158, 99.9=294, 99.99=345] 
2024-09-17 18:26:11:598 27 sec: 612651 operations; 15888 current ops/sec; est completion in 1 minute [READ: Count=7968, Max=957, Min=19, Avg=60,79, 90=101, 99=217, 99.9=358, 99.99=937] [UPDATE: Count=7920, Max=650, Min=19, Avg=62,46, 90=105, 99=225, 99.9=429, 99.99=611] 
2024-09-17 18:26:12:598 28 sec: 629150 operations; 16499 current ops/sec; est completion in 1 minute [READ: Count=8293, Max=878, Min=19, Avg=58,2, 90=93, 99=177, 99.9=326, 99.99=859] [UPDATE: Count=8208, Max=1012, Min=19, Avg=60,41, 90=100, 99=188, 99.9=393, 99.99=886] 
2024-09-17 18:26:13:598 29 sec: 652177 operations; 23027 current ops/sec; est completion in 1 minute [READ: Count=11492, Max=877, Min=19, Avg=41,97, 90=77, 99=153, 99.9=292, 99.99=874] [UPDATE: Count=11543, Max=970, Min=19, Avg=42,73, 90=79, 99=159, 99.9=307, 99.99=918] 
2024-09-17 18:26:14:598 30 sec: 668453 operations; 16276 current ops/sec; est completion in 1 minute [READ: Count=7928, Max=2261, Min=19, Avg=58,5, 90=107, 99=243, 99.9=881, 99.99=1573] [UPDATE: Count=8336, Max=2441, Min=18, Avg=61,18, 90=116, 99=268, 99.9=865, 99.99=1346] 
2024-09-17 18:26:15:598 31 sec: 692085 operations; 23632 current ops/sec; est completion in 1 minute [READ: Count=11873, Max=910, Min=18, Avg=41,29, 90=70, 99=123, 99.9=654, 99.99=875] [UPDATE: Count=11759, Max=891, Min=18, Avg=41,21, 90=72, 99=127, 99.9=230, 99.99=874] 
2024-09-17 18:26:16:598 32 sec: 710101 operations; 18016 current ops/sec; est completion in 1 minute [READ: Count=8950, Max=900, Min=19, Avg=53,53, 90=86, 99=160, 99.9=789, 99.99=885] [UPDATE: Count=9068, Max=918, Min=19, Avg=55,02, 90=90, 99=177, 99.9=776, 99.99=868] 
2024-09-17 18:26:17:598 33 sec: 733159 operations; 23058 current ops/sec; est completion in 1 minute [READ: Count=11455, Max=1091, Min=19, Avg=41,74, 90=78, 99=140, 99.9=240, 99.99=995] [UPDATE: Count=11616, Max=923, Min=19, Avg=42,66, 90=81, 99=150, 99.9=318, 99.99=906] 
2024-09-17 18:26:18:598 34 sec: 760302 operations; 27143 current ops/sec; est completion in 1 minute [READ: Count=13552, Max=419, Min=19, Avg=35,64, 90=65, 99=136, 99.9=233, 99.99=407] [UPDATE: Count=13577, Max=376, Min=18, Avg=35,97, 90=68, 99=144, 99.9=244, 99.99=374] 
2024-09-17 18:26:19:598 35 sec: 784903 operations; 24601 current ops/sec; est completion in 1 minute [READ: Count=12303, Max=427, Min=18, Avg=38,99, 90=67, 99=175, 99.9=309, 99.99=413] [UPDATE: Count=12306, Max=924, Min=18, Avg=40,11, 90=71, 99=175, 99.9=311, 99.99=492] 
2024-09-17 18:26:20:598 36 sec: 813011 operations; 28108 current ops/sec; est completion in 1 minute [READ: Count=14075, Max=361, Min=19, Avg=34,3, 90=59, 99=126, 99.9=223, 99.99=350] [UPDATE: Count=14025, Max=421, Min=18, Avg=34,76, 90=62, 99=130, 99.9=230, 99.99=419] 
2024-09-17 18:26:21:598 37 sec: 832365 operations; 19354 current ops/sec; est completion in 1 minute [READ: Count=9735, Max=569, Min=18, Avg=48,69, 90=82, 99=186, 99.9=331, 99.99=501] [UPDATE: Count=9626, Max=10719, Min=17, Avg=52,15, 90=86, 99=204, 99.9=449, 99.99=3507] 
2024-09-17 18:26:22:598 38 sec: 850051 operations; 17686 current ops/sec; est completion in 1 minute [READ: Count=8834, Max=3657, Min=19, Avg=54,66, 90=91, 99=192, 99.9=313, 99.99=733] [UPDATE: Count=8846, Max=548, Min=19, Avg=55,8, 90=94, 99=207, 99.9=308, 99.99=547] 
2024-09-17 18:26:23:598 39 sec: 873152 operations; 23101 current ops/sec; est completion in 1 minute [READ: Count=11517, Max=837, Min=19, Avg=42,18, 90=72, 99=143, 99.9=263, 99.99=410] [UPDATE: Count=11591, Max=375, Min=19, Avg=42,22, 90=73, 99=139, 99.9=255, 99.99=349] 
2024-09-17 18:26:24:598 40 sec: 905350 operations; 32198 current ops/sec; est completion in 1 minute [READ: Count=16130, Max=797, Min=19, Avg=30,01, 90=54, 99=122, 99.9=233, 99.99=577] [UPDATE: Count=16061, Max=504, Min=18, Avg=30,18, 90=55, 99=130, 99.9=237, 99.99=342] 
2024-09-17 18:26:25:598 41 sec: 929243 operations; 23893 current ops/sec; est completion in 1 minute [READ: Count=11873, Max=854, Min=18, Avg=40,1, 90=68, 99=123, 99.9=230, 99.99=472] [UPDATE: Count=12021, Max=814, Min=18, Avg=41,45, 90=71, 99=137, 99.9=268, 99.99=707] 
2024-09-17 18:26:26:598 42 sec: 945031 operations; 15788 current ops/sec; est completion in 1 minute [READ: Count=8028, Max=3607, Min=19, Avg=60,65, 90=99, 99=226, 99.9=424, 99.99=1652] [UPDATE: Count=7754, Max=4803, Min=19, Avg=62,98, 90=105, 99=250, 99.9=392, 99.99=2477] 
2024-09-17 18:26:27:598 43 sec: 962470 operations; 17439 current ops/sec; est completion in 1 minute [READ: Count=8793, Max=1132, Min=19, Avg=55,12, 90=91, 99=195, 99.9=365, 99.99=635] [UPDATE: Count=8651, Max=1350, Min=19, Avg=57,05, 90=97, 99=201, 99.9=364, 99.99=538] 
2024-09-17 18:26:28:598 44 sec: 981512 operations; 19042 current ops/sec; est completion in 1 minute [READ: Count=9427, Max=736, Min=18, Avg=50,29, 90=89, 99=207, 99.9=310, 99.99=453] [UPDATE: Count=9613, Max=1062, Min=18, Avg=52,23, 90=95, 99=224, 99.9=354, 99.99=839] 
2024-09-17 18:26:29:598 45 sec: 999930 operations; 18418 current ops/sec; est completion in 1 minute [READ: Count=9241, Max=670, Min=18, Avg=52,52, 90=80, 99=169, 99.9=303, 99.99=419] [UPDATE: Count=9176, Max=818, Min=19, Avg=53,47, 90=83, 99=175, 99.9=355, 99.99=809] 
2024-09-17 18:26:30:598 46 sec: 1021049 operations; 21119 current ops/sec; est completion in 1 minute [READ: Count=10530, Max=1215, Min=18, Avg=45,92, 90=77, 99=157, 99.9=807, 99.99=944] [UPDATE: Count=10605, Max=995, Min=18, Avg=46,47, 90=80, 99=178, 99.9=560, 99.99=874] 
2024-09-17 18:26:31:598 47 sec: 1041402 operations; 20353 current ops/sec; est completion in 1 minute [READ: Count=10190, Max=1210, Min=19, Avg=47,28, 90=77, 99=182, 99.9=342, 99.99=1083] [UPDATE: Count=10154, Max=1062, Min=18, Avg=48,48, 90=80, 99=187, 99.9=366, 99.99=838] 
2024-09-17 18:26:32:598 48 sec: 1065359 operations; 23957 current ops/sec; est completion in 1 minute [READ: Count=12008, Max=858, Min=18, Avg=39,96, 90=68, 99=144, 99.9=242, 99.99=412] [UPDATE: Count=11945, Max=885, Min=19, Avg=41,35, 90=74, 99=155, 99.9=277, 99.99=768] 
2024-09-17 18:26:33:598 49 sec: 1085932 operations; 20573 current ops/sec; est completion in 1 minute [READ: Count=10437, Max=1664, Min=18, Avg=47,1, 90=79, 99=151, 99.9=260, 99.99=876] [UPDATE: Count=10144, Max=1419, Min=18, Avg=47,91, 90=81, 99=154, 99.9=659, 99.99=943] 
2024-09-17 18:26:34:598 50 sec: 1101581 operations; 15649 current ops/sec; est completion in 1 minute [READ: Count=7692, Max=796, Min=19, Avg=61,49, 90=100, 99=197, 99.9=309, 99.99=559] [UPDATE: Count=7949, Max=438, Min=19, Avg=63,57, 90=106, 99=211, 99.9=301, 99.99=421] 
2024-09-17 18:26:35:598 51 sec: 1126601 operations; 25020 current ops/sec; est completion in 1 minute [READ: Count=12641, Max=848, Min=19, Avg=38,62, 90=65, 99=131, 99.9=218, 99.99=795] [UPDATE: Count=12378, Max=840, Min=19, Avg=39,2, 90=67, 99=140, 99.9=259, 99.99=567] 
2024-09-17 18:26:36:598 52 sec: 1162993 operations; 36392 current ops/sec; est completion in 1 minute [READ: Count=18197, Max=551, Min=19, Avg=26,66, 90=40, 99=75, 99.9=147, 99.99=231] [UPDATE: Count=18198, Max=236, Min=17, Avg=26,49, 90=40, 99=75, 99.9=153, 99.99=210] 
2024-09-17 18:26:37:598 53 sec: 1192963 operations; 29940,06 current ops/sec; est completion in 59 seconds [READ: Count=14969, Max=860, Min=19, Avg=32,18, 90=56, 99=115, 99.9=192, 99.99=679] [UPDATE: Count=14998, Max=918, Min=18, Avg=32,54, 90=58, 99=123, 99.9=206, 99.99=912] 
2024-09-17 18:26:38:598 54 sec: 1209126 operations; 16179,18 current ops/sec; est completion in 58 seconds [READ: Count=8064, Max=1008, Min=19, Avg=59,13, 90=107, 99=228, 99.9=904, 99.99=980] [UPDATE: Count=8106, Max=1862, Min=19, Avg=62,08, 90=115, 99=244, 99.9=811, 99.99=1311] 
2024-09-17 18:26:39:598 55 sec: 1227851 operations; 18725 current ops/sec; est completion in 57 seconds [READ: Count=9402, Max=937, Min=19, Avg=51,3, 90=88, 99=165, 99.9=319, 99.99=914] [UPDATE: Count=9323, Max=1037, Min=18, Avg=53,08, 90=92, 99=179, 99.9=394, 99.99=927] 
2024-09-17 18:26:40:598 56 sec: 1250963 operations; 23112 current ops/sec; est completion in 56 seconds [READ: Count=11581, Max=890, Min=18, Avg=41,9, 90=73, 99=133, 99.9=313, 99.99=877] [UPDATE: Count=11535, Max=973, Min=19, Avg=42,48, 90=76, 99=137, 99.9=303, 99.99=907] 
2024-09-17 18:26:41:598 57 sec: 1289454 operations; 38491 current ops/sec; est completion in 54 seconds [READ: Count=19040, Max=268, Min=18, Avg=25,13, 90=27, 99=59, 99.9=146, 99.99=221] [UPDATE: Count=19447, Max=295, Min=18, Avg=24,92, 90=27, 99=63, 99.9=140, 99.99=235] 
2024-09-17 18:26:42:598 58 sec: 1314019 operations; 24565 current ops/sec; est completion in 53 seconds [READ: Count=12353, Max=1026, Min=19, Avg=39,26, 90=74, 99=136, 99.9=229, 99.99=958] [UPDATE: Count=12203, Max=1011, Min=15, Avg=40, 90=77, 99=141, 99.9=234, 99.99=823] 
2024-09-17 18:26:43:598 59 sec: 1333052 operations; 19033 current ops/sec; est completion in 52 seconds [READ: Count=9558, Max=952, Min=19, Avg=51,4, 90=89, 99=191, 99.9=851, 99.99=914] [UPDATE: Count=9474, Max=1270, Min=19, Avg=51,3, 90=90, 99=196, 99.9=405, 99.99=898] 
2024-09-17 18:26:44:598 60 sec: 1350522 operations; 17470 current ops/sec; est completion in 52 seconds [READ: Count=8672, Max=1003, Min=19, Avg=54,17, 90=89, 99=173, 99.9=734, 99.99=967] [UPDATE: Count=8802, Max=2457, Min=19, Avg=57,71, 90=95, 99=197, 99.9=824, 99.99=1116] 
2024-09-17 18:26:45:598 61 sec: 1374457 operations; 23935 current ops/sec; est completion in 50 seconds [READ: Count=11945, Max=1353, Min=18, Avg=40,22, 90=74, 99=143, 99.9=231, 99.99=637] [UPDATE: Count=11986, Max=541, Min=18, Avg=41,18, 90=77, 99=158, 99.9=249, 99.99=383] 
2024-09-17 18:26:46:598 62 sec: 1396923 operations; 22466 current ops/sec; est completion in 49 seconds [READ: Count=11253, Max=693, Min=18, Avg=42,86, 90=77, 99=167, 99.9=296, 99.99=449] [UPDATE: Count=11215, Max=444, Min=18, Avg=44,04, 90=80, 99=175, 99.9=323, 99.99=424] 
2024-09-17 18:26:47:598 63 sec: 1417733 operations; 20810 current ops/sec; est completion in 49 seconds [READ: Count=10413, Max=424, Min=19, Avg=45,72, 90=79, 99=169, 99.9=248, 99.99=338] [UPDATE: Count=10395, Max=1033, Min=18, Avg=48,2, 90=86, 99=176, 99.9=320, 99.99=526] 
2024-09-17 18:26:48:598 64 sec: 1445468 operations; 27735 current ops/sec; est completion in 47 seconds [READ: Count=13841, Max=737, Min=19, Avg=34,83, 90=61, 99=109, 99.9=171, 99.99=523] [UPDATE: Count=13895, Max=434, Min=19, Avg=35,28, 90=63, 99=107, 99.9=186, 99.99=370] 
2024-09-17 18:26:49:598 65 sec: 1466874 operations; 21406 current ops/sec; est completion in 46 seconds [READ: Count=10785, Max=365, Min=19, Avg=44,91, 90=78, 99=161, 99.9=245, 99.99=342] [UPDATE: Count=10625, Max=390, Min=18, Avg=46,23, 90=82, 99=166, 99.9=294, 99.99=375] 
2024-09-17 18:26:50:598 66 sec: 1497800 operations; 30926 current ops/sec; est completion in 45 seconds [READ: Count=15476, Max=2327, Min=18, Avg=31,32, 90=56, 99=118, 99.9=225, 99.99=448] [UPDATE: Count=15446, Max=542, Min=18, Avg=31,31, 90=58, 99=125, 99.9=233, 99.99=512] 
2024-09-17 18:26:51:598 67 sec: 1517860 operations; 20060 current ops/sec; est completion in 44 seconds [READ: Count=10051, Max=443, Min=19, Avg=47,82, 90=83, 99=164, 99.9=278, 99.99=435] [UPDATE: Count=10012, Max=399, Min=19, Avg=49,5, 90=88, 99=180, 99.9=278, 99.99=384] 
2024-09-17 18:26:52:598 68 sec: 1552022 operations; 34162 current ops/sec; est completion in 42 seconds [READ: Count=17064, Max=820, Min=18, Avg=28,3, 90=47, 99=90, 99.9=202, 99.99=273] [UPDATE: Count=17096, Max=299, Min=15, Avg=28,38, 90=49, 99=96, 99.9=189, 99.99=253] 
2024-09-17 18:26:53:598 69 sec: 1581807 operations; 29785 current ops/sec; est completion in 41 seconds [READ: Count=14900, Max=418, Min=13, Avg=32,39, 90=59, 99=108, 99.9=197, 99.99=391] [UPDATE: Count=14884, Max=406, Min=18, Avg=32,9, 90=61, 99=117, 99.9=205, 99.99=381] 
2024-09-17 18:26:54:597 70 sec: 1608233 operations; 26426 current ops/sec; est completion in 39 seconds [READ: Count=13226, Max=929, Min=19, Avg=36,54, 90=66, 99=132, 99.9=280, 99.99=924] [UPDATE: Count=13200, Max=956, Min=19, Avg=37,13, 90=69, 99=147, 99.9=268, 99.99=898] 
2024-09-17 18:26:55:598 71 sec: 1626275 operations; 18042 current ops/sec; est completion in 39 seconds [READ: Count=8990, Max=925, Min=19, Avg=53,16, 90=86, 99=162, 99.9=735, 99.99=899] [UPDATE: Count=9053, Max=973, Min=19, Avg=55,22, 90=90, 99=165, 99.9=816, 99.99=910] 
2024-09-17 18:26:56:598 72 sec: 1649877 operations; 23602 current ops/sec; est completion in 38 seconds [READ: Count=11946, Max=905, Min=19, Avg=41,11, 90=72, 99=140, 99.9=269, 99.99=899] [UPDATE: Count=11660, Max=928, Min=19, Avg=41,31, 90=75, 99=146, 99.9=235, 99.99=854] 
2024-09-17 18:26:57:598 73 sec: 1668406 operations; 18529 current ops/sec; est completion in 37 seconds [READ: Count=9265, Max=841, Min=20, Avg=51,78, 90=88, 99=177, 99.9=324, 99.99=811] [UPDATE: Count=9260, Max=1010, Min=17, Avg=53,7, 90=93, 99=194, 99.9=751, 99.99=871] 
2024-09-17 18:26:58:597 74 sec: 1690503 operations; 22097 current ops/sec; est completion in 36 seconds [READ: Count=11053, Max=888, Min=14, Avg=43,88, 90=75, 99=151, 99.9=303, 99.99=848] [UPDATE: Count=11041, Max=860, Min=18, Avg=44,26, 90=79, 99=158, 99.9=274, 99.99=860] 
2024-09-17 18:26:59:598 75 sec: 1708307 operations; 17804 current ops/sec; est completion in 35 seconds [READ: Count=9004, Max=720, Min=18, Avg=53,75, 90=88, 99=175, 99.9=318, 99.99=582] [UPDATE: Count=8804, Max=1024, Min=18, Avg=56,16, 90=93, 99=200, 99.9=296, 99.99=487] 
2024-09-17 18:27:00:598 76 sec: 1727408 operations; 19101 current ops/sec; est completion in 34 seconds [READ: Count=9547, Max=375, Min=13, Avg=50,47, 90=84, 99=161, 99.9=232, 99.99=309] [UPDATE: Count=9552, Max=441, Min=18, Avg=51,85, 90=88, 99=173, 99.9=285, 99.99=399] 
2024-09-17 18:27:01:598 77 sec: 1747871 operations; 20463 current ops/sec; est completion in 34 seconds [READ: Count=10271, Max=695, Min=18, Avg=47,04, 90=79, 99=154, 99.9=270, 99.99=681] [UPDATE: Count=10193, Max=354, Min=18, Avg=48,36, 90=82, 99=166, 99.9=247, 99.99=348] 
2024-09-17 18:27:02:598 78 sec: 1765225 operations; 17354 current ops/sec; est completion in 33 seconds [READ: Count=8763, Max=647, Min=19, Avg=55,26, 90=90, 99=170, 99.9=300, 99.99=572] [UPDATE: Count=8588, Max=616, Min=18, Avg=57,56, 90=98, 99=184, 99.9=295, 99.99=543] 
2024-09-17 18:27:03:598 79 sec: 1797675 operations; 32450 current ops/sec; est completion in 31 seconds [READ: Count=16284, Max=898, Min=19, Avg=29,67, 90=48, 99=98, 99.9=190, 99.99=798] [UPDATE: Count=16171, Max=880, Min=18, Avg=29,94, 90=51, 99=111, 99.9=204, 99.99=778] 
2024-09-17 18:27:04:598 80 sec: 1818911 operations; 21236 current ops/sec; est completion in 30 seconds [READ: Count=10589, Max=3869, Min=19, Avg=45,42, 90=77, 99=148, 99.9=255, 99.99=875] [UPDATE: Count=10644, Max=903, Min=19, Avg=46,52, 90=82, 99=159, 99.9=249, 99.99=861] 
2024-09-17 18:27:05:598 81 sec: 1841046 operations; 22135 current ops/sec; est completion in 29 seconds [READ: Count=11181, Max=379, Min=19, Avg=43,69, 90=77, 99=146, 99.9=247, 99.99=344] [UPDATE: Count=10958, Max=321, Min=18, Avg=44,39, 90=81, 99=152, 99.9=224, 99.99=319] 
2024-09-17 18:27:06:598 82 sec: 1863940 operations; 22894 current ops/sec; est completion in 28 seconds [READ: Count=11458, Max=1306, Min=19, Avg=42,15, 90=73, 99=138, 99.9=270, 99.99=598] [UPDATE: Count=11435, Max=352, Min=14, Avg=43,02, 90=76, 99=153, 99.9=243, 99.99=342] 
2024-09-17 18:27:07:598 83 sec: 1880647 operations; 16707 current ops/sec; est completion in 28 seconds [READ: Count=8364, Max=694, Min=19, Avg=57,75, 90=98, 99=199, 99.9=336, 99.99=411] [UPDATE: Count=8340, Max=498, Min=19, Avg=59,5, 90=102, 99=211, 99.9=352, 99.99=461] 
2024-09-17 18:27:08:597 84 sec: 1901097 operations; 20450 current ops/sec; est completion in 27 seconds [READ: Count=10133, Max=737, Min=18, Avg=46,94, 90=80, 99=165, 99.9=290, 99.99=656] [UPDATE: Count=10324, Max=2061, Min=18, Avg=48,47, 90=85, 99=175, 99.9=315, 99.99=1140] 
2024-09-17 18:27:09:598 85 sec: 1936102 operations; 35005 current ops/sec; est completion in 25 seconds [READ: Count=17366, Max=288, Min=18, Avg=27,75, 90=49, 99=92, 99.9=156, 99.99=221] [UPDATE: Count=17635, Max=350, Min=18, Avg=27,63, 90=52, 99=92, 99.9=172, 99.99=254] 
2024-09-17 18:27:10:597 86 sec: 1960619 operations; 24517 current ops/sec; est completion in 24 seconds [READ: Count=12388, Max=718, Min=19, Avg=39,49, 90=71, 99=134, 99.9=258, 99.99=496] [UPDATE: Count=12134, Max=390, Min=18, Avg=39,91, 90=73, 99=141, 99.9=237, 99.99=370] 
2024-09-17 18:27:11:597 87 sec: 1995351 operations; 34732 current ops/sec; est completion in 23 seconds [READ: Count=17309, Max=349, Min=17, Avg=27,67, 90=49, 99=89, 99.9=157, 99.99=242] [UPDATE: Count=17421, Max=348, Min=17, Avg=28,01, 90=51, 99=95, 99.9=168, 99.99=247] 
2024-09-17 18:27:12:597 88 sec: 2031339 operations; 35988 current ops/sec; est completion in 21 seconds [READ: Count=18014, Max=377, Min=16, Avg=26,82, 90=49, 99=83, 99.9=148, 99.99=285] [UPDATE: Count=17967, Max=827, Min=16, Avg=26,95, 90=50, 99=91, 99.9=165, 99.99=335] 
2024-09-17 18:27:13:598 89 sec: 2071391 operations; 40052 current ops/sec; est completion in 19 seconds [READ: Count=19953, Max=289, Min=16, Avg=23,92, 90=36, 99=72, 99.9=149, 99.99=258] [UPDATE: Count=20105, Max=740, Min=15, Avg=24,21, 90=36, 99=76, 99.9=167, 99.99=297] 
2024-09-17 18:27:14:597 90 sec: 2108929 operations; 37538 current ops/sec; est completion in 17 seconds [READ: Count=18683, Max=921, Min=16, Avg=25,59, 90=41, 99=96, 99.9=193, 99.99=283] [UPDATE: Count=18848, Max=1284, Min=16, Avg=25,83, 90=43, 99=105, 99.9=204, 99.99=277] 
2024-09-17 18:27:15:597 91 sec: 2144362 operations; 35433 current ops/sec; est completion in 16 seconds [READ: Count=17682, Max=588, Min=16, Avg=27,17, 90=46, 99=70, 99.9=136, 99.99=200] [UPDATE: Count=17754, Max=1088, Min=14, Avg=27,32, 90=48, 99=73, 99.9=145, 99.99=221] 
2024-09-17 18:27:16:597 92 sec: 2180096 operations; 35734 current ops/sec; est completion in 14 seconds [READ: Count=17920, Max=330, Min=15, Avg=26,7, 90=44, 99=87, 99.9=162, 99.99=271] [UPDATE: Count=17821, Max=467, Min=14, Avg=27,37, 90=47, 99=84, 99.9=162, 99.99=377] 
2024-09-17 18:27:17:597 93 sec: 2222341 operations; 42245 current ops/sec; est completion in 12 seconds [READ: Count=21183, Max=1072, Min=13, Avg=22,55, 90=37, 99=54, 99.9=109, 99.99=194] [UPDATE: Count=21056, Max=694, Min=13, Avg=22,94, 90=40, 99=58, 99.9=110, 99.99=211] 
2024-09-17 18:27:18:597 94 sec: 2261608 operations; 39267 current ops/sec; est completion in 10 seconds [READ: Count=19814, Max=228, Min=13, Avg=24,24, 90=39, 99=68, 99.9=123, 99.99=201] [UPDATE: Count=19454, Max=285, Min=12, Avg=24,8, 90=42, 99=72, 99.9=142, 99.99=241] 
2024-09-17 18:27:19:597 95 sec: 2314448 operations; 52840 current ops/sec; est completion in 8 second [READ: Count=26520, Max=964, Min=13, Avg=17,91, 90=24, 99=41, 99.9=99, 99.99=282] [UPDATE: Count=26322, Max=245, Min=12, Avg=18,27, 90=27, 99=46, 99.9=116, 99.99=170] 
2024-09-17 18:27:20:597 96 sec: 2363688 operations; 49240 current ops/sec; est completion in 6 second [READ: Count=24601, Max=354, Min=13, Avg=19,22, 90=27, 99=46, 99.9=139, 99.99=305] [UPDATE: Count=24644, Max=2031, Min=12, Avg=19,54, 90=28, 99=49, 99.9=136, 99.99=313] 
2024-09-17 18:27:21:597 97 sec: 2420851 operations; 57163 current ops/sec; est completion in 4 second [READ: Count=28612, Max=10455, Min=13, Avg=16,58, 90=23, 99=31, 99.9=95, 99.99=185] [UPDATE: Count=28560, Max=4215, Min=12, Avg=16,7, 90=26, 99=34, 99.9=102, 99.99=215] 
2024-09-17 18:27:22:597 98 sec: 2475988 operations; 55137 current ops/sec; est completion in 1 second [READ: Count=27380, Max=3325, Min=12, Avg=17,12, 90=24, 99=41, 99.9=103, 99.99=293] [UPDATE: Count=27742, Max=10679, Min=11, Avg=17,38, 90=26, 99=43, 99.9=115, 99.99=219] 
2024-09-17 18:27:23:017 98 sec: 2500000 operations; 57171,43 current ops/sec; [READ: Count=12185, Max=5067, Min=12, Avg=16,55, 90=25, 99=32, 99.9=88, 99.99=245] [CLEANUP: Count=1, Max=784, Min=784, Avg=784, 90=784, 99=784, 99.9=784, 99.99=784] [UPDATE: Count=11820, Max=225, Min=11, Avg=16,62, 90=28, 99=37, 99.9=101, 99.99=201] 
[OVERALL], RunTime(ms), 98420
[OVERALL], Throughput(ops/sec), 25401.341190814874
[TOTAL_GCS_G1_Young_Generation], Count, 31
[TOTAL_GC_TIME_G1_Young_Generation], Time(ms), 25
[TOTAL_GC_TIME_%_G1_Young_Generation], Time(%), 0.025401341190814875
[TOTAL_GCS_G1_Old_Generation], Count, 0
[TOTAL_GC_TIME_G1_Old_Generation], Time(ms), 0
[TOTAL_GC_TIME_%_G1_Old_Generation], Time(%), 0.0
[TOTAL_GCs], Count, 31
[TOTAL_GC_TIME], Time(ms), 25
[TOTAL_GC_TIME_%], Time(%), 0.025401341190814875
[READ], Operations, 1250174
[READ], AverageLatency(us), 37.823142218603174
[READ], MinLatency(us), 12
[READ], MaxLatency(us), 10455
[READ], 95thPercentileLatency(us), 87
[READ], 99thPercentileLatency(us), 145
[READ], Return=OK, 1250174
[CLEANUP], Operations, 1
[CLEANUP], AverageLatency(us), 784.0
[CLEANUP], MinLatency(us), 784
[CLEANUP], MaxLatency(us), 784
[CLEANUP], 95thPercentileLatency(us), 784
[CLEANUP], 99thPercentileLatency(us), 784
[UPDATE], Operations, 1249826
[UPDATE], AverageLatency(us), 38.636222162124966
[UPDATE], MinLatency(us), 11
[UPDATE], MaxLatency(us), 10719
[UPDATE], 95thPercentileLatency(us), 91
[UPDATE], 99thPercentileLatency(us), 155
[UPDATE], Return=OK, 1249826
