/usr/bin/java  -classpath /home/sebastiaoamaro/phd/torefidevel/tests/redis/ycsb-0.17.0/conf:/home/sebastiaoamaro/phd/torefidevel/tests/redis/ycsb-0.17.0/lib/HdrHistogram-2.1.4.jar:/home/sebastiaoamaro/phd/torefidevel/tests/redis/ycsb-0.17.0/lib/core-0.17.0.jar:/home/sebastiaoamaro/phd/torefidevel/tests/redis/ycsb-0.17.0/lib/htrace-core4-4.1.0-incubating.jar:/home/sebastiaoamaro/phd/torefidevel/tests/redis/ycsb-0.17.0/lib/jackson-core-asl-1.9.4.jar:/home/sebastiaoamaro/phd/torefidevel/tests/redis/ycsb-0.17.0/lib/jackson-mapper-asl-1.9.4.jar:/home/sebastiaoamaro/phd/torefidevel/tests/redis/ycsb-0.17.0/redis-binding/lib/commons-pool2-2.4.2.jar:/home/sebastiaoamaro/phd/torefidevel/tests/redis/ycsb-0.17.0/redis-binding/lib/jedis-2.9.0.jar:/home/sebastiaoamaro/phd/torefidevel/tests/redis/ycsb-0.17.0/redis-binding/lib/redis-binding-0.17.0.jar site.ycsb.Client -t -db site.ycsb.db.RedisClient -P workloads/workloada -s -p status.interval=1 -p operationcount=2500000 -p redis.host=172.38.0.11 -p redis.port=6379 -p redis.cluster=true -s
Command line: -t -db site.ycsb.db.RedisClient -P workloads/workloada -s -p status.interval=1 -p operationcount=2500000 -p redis.host=172.38.0.11 -p redis.port=6379 -p redis.cluster=true -s
YCSB Client 0.17.0

Loading workload...
Starting test.
2024-09-17 18:30:58:064 0 sec: 0 operations; est completion in 106751991167300 days 15 hours 
DBWrapper: report latency for each error is false and specific error codes to track for latency are: []
2024-09-17 18:30:59:045 1 sec: 17066 operations; 17066 current ops/sec; est completion in 2 minutes [READ: Count=8636, Max=2851, Min=19, Avg=49,9, 90=70, 99=142, 99.9=232, 99.99=2803] [UPDATE: Count=8454, Max=2523, Min=19, Avg=52,23, 90=76, 99=151, 99.9=233, 99.99=1810] 
2024-09-17 18:31:00:045 2 sec: 40130 operations; 23064 current ops/sec; est completion in 2 minutes [READ: Count=11692, Max=690, Min=19, Avg=41,71, 90=68, 99=128, 99.9=211, 99.99=280] [UPDATE: Count=11361, Max=763, Min=18, Avg=41,68, 90=70, 99=131, 99.9=253, 99.99=728] 
2024-09-17 18:31:01:045 3 sec: 73294 operations; 33164 current ops/sec; est completion in 1 minute [READ: Count=16665, Max=297, Min=20, Avg=29,45, 90=53, 99=102, 99.9=182, 99.99=282] [UPDATE: Count=16495, Max=542, Min=18, Avg=28,6, 90=55, 99=106, 99.9=187, 99.99=298] 
2024-09-17 18:31:02:045 4 sec: 104665 operations; 31371 current ops/sec; est completion in 1 minute [READ: Count=15722, Max=265, Min=18, Avg=30,94, 90=56, 99=106, 99.9=204, 99.99=248] [UPDATE: Count=15661, Max=337, Min=19, Avg=30,52, 90=57, 99=107, 99.9=203, 99.99=277] 
2024-09-17 18:31:03:045 5 sec: 136373 operations; 31708 current ops/sec; est completion in 1 minute [READ: Count=15733, Max=343, Min=17, Avg=30,36, 90=54, 99=97, 99.9=157, 99.99=299] [UPDATE: Count=15975, Max=267, Min=18, Avg=30,77, 90=57, 99=98, 99.9=172, 99.99=262] 
2024-09-17 18:31:04:045 6 sec: 166496 operations; 30123 current ops/sec; est completion in 1 minute [READ: Count=14921, Max=1056, Min=18, Avg=32,03, 90=58, 99=106, 99.9=192, 99.99=482] [UPDATE: Count=15199, Max=408, Min=18, Avg=32,5, 90=62, 99=107, 99.9=189, 99.99=300] 
2024-09-17 18:31:05:045 7 sec: 197370 operations; 30874 current ops/sec; est completion in 1 minute [READ: Count=15413, Max=1880, Min=19, Avg=31,09, 90=55, 99=93, 99.9=182, 99.99=285] [UPDATE: Count=15458, Max=268, Min=18, Avg=31,83, 90=58, 99=106, 99.9=187, 99.99=238] 
2024-09-17 18:31:06:045 8 sec: 229468 operations; 32098 current ops/sec; est completion in 1 minute [READ: Count=15965, Max=271, Min=18, Avg=29,94, 90=52, 99=79, 99.9=145, 99.99=218] [UPDATE: Count=16129, Max=286, Min=18, Avg=30,5, 90=56, 99=90, 99.9=179, 99.99=254] 
2024-09-17 18:31:07:045 9 sec: 262596 operations; 33128 current ops/sec; est completion in 1 minute [READ: Count=16607, Max=304, Min=18, Avg=29,09, 90=52, 99=95, 99.9=176, 99.99=225] [UPDATE: Count=16514, Max=268, Min=18, Avg=29,43, 90=54, 99=92, 99.9=180, 99.99=231] 
2024-09-17 18:31:08:045 10 sec: 300385 operations; 37789 current ops/sec; est completion in 1 minute [READ: Count=18927, Max=1803, Min=14, Avg=25,53, 90=40, 99=68, 99.9=152, 99.99=230] [UPDATE: Count=18874, Max=266, Min=18, Avg=25,72, 90=40, 99=71, 99.9=155, 99.99=247] 
2024-09-17 18:31:09:045 11 sec: 341012 operations; 40627 current ops/sec; est completion in 1 minute [READ: Count=20404, Max=352, Min=18, Avg=23,6, 90=29, 99=66, 99.9=117, 99.99=164] [UPDATE: Count=20211, Max=318, Min=18, Avg=23,92, 90=29, 99=69, 99.9=147, 99.99=205] 
2024-09-17 18:31:10:045 12 sec: 379155 operations; 38143 current ops/sec; est completion in 1 minute [READ: Count=18973, Max=1920, Min=18, Avg=25,29, 90=32, 99=79, 99.9=153, 99.99=238] [UPDATE: Count=19187, Max=323, Min=16, Avg=25,42, 90=33, 99=81, 99.9=159, 99.99=245] 
2024-09-17 18:31:11:045 13 sec: 413860 operations; 34705 current ops/sec; est completion in 1 minute [READ: Count=17443, Max=269, Min=18, Avg=27,81, 90=53, 99=85, 99.9=141, 99.99=199] [UPDATE: Count=17248, Max=239, Min=17, Avg=28,06, 90=55, 99=85, 99.9=158, 99.99=236] 
2024-09-17 18:31:12:045 14 sec: 445055 operations; 31195 current ops/sec; est completion in 1 minute [READ: Count=15509, Max=1581, Min=18, Avg=30,9, 90=57, 99=105, 99.9=171, 99.99=239] [UPDATE: Count=15694, Max=460, Min=18, Avg=31,41, 90=59, 99=114, 99.9=184, 99.99=284] 
2024-09-17 18:31:13:045 15 sec: 480718 operations; 35663 current ops/sec; est completion in 1 minute [READ: Count=17945, Max=279, Min=18, Avg=26,95, 90=49, 99=71, 99.9=140, 99.99=213] [UPDATE: Count=17707, Max=512, Min=18, Avg=27,34, 90=51, 99=77, 99.9=154, 99.99=295] 
2024-09-17 18:31:14:045 16 sec: 518535 operations; 37817 current ops/sec; est completion in 1 minute [READ: Count=19016, Max=1647, Min=18, Avg=25,6, 90=35, 99=65, 99.9=124, 99.99=179] [UPDATE: Count=18814, Max=241, Min=17, Avg=25,49, 90=35, 99=66, 99.9=138, 99.99=225] 
2024-09-17 18:31:15:045 17 sec: 553245 operations; 34710 current ops/sec; est completion in 1 minute [READ: Count=17218, Max=258, Min=18, Avg=27,73, 90=49, 99=86, 99.9=176, 99.99=251] [UPDATE: Count=17487, Max=281, Min=18, Avg=28,1, 90=53, 99=87, 99.9=175, 99.99=253] 
2024-09-17 18:31:16:045 18 sec: 585374 operations; 32129 current ops/sec; est completion in 59 seconds [READ: Count=16054, Max=866, Min=18, Avg=29,82, 90=54, 99=81, 99.9=142, 99.99=259] [UPDATE: Count=16073, Max=212, Min=18, Avg=30,6, 90=57, 99=88, 99.9=150, 99.99=182] 
2024-09-17 18:31:17:045 19 sec: 621296 operations; 35922 current ops/sec; est completion in 58 seconds [READ: Count=17834, Max=230, Min=18, Avg=26,91, 90=50, 99=66, 99.9=138, 99.99=220] [UPDATE: Count=18092, Max=234, Min=18, Avg=26,92, 90=52, 99=68, 99.9=132, 99.99=201] 
2024-09-17 18:31:18:045 20 sec: 663199 operations; 41903 current ops/sec; est completion in 56 seconds [READ: Count=21091, Max=326, Min=19, Avg=22,83, 90=24, 99=60, 99.9=130, 99.99=247] [UPDATE: Count=20811, Max=238, Min=18, Avg=23,22, 90=25, 99=63, 99.9=129, 99.99=226] 
2024-09-17 18:31:19:045 21 sec: 697660 operations; 34461 current ops/sec; est completion in 55 seconds [READ: Count=17213, Max=363, Min=17, Avg=27,76, 90=50, 99=70, 99.9=136, 99.99=184] [UPDATE: Count=17245, Max=2020, Min=18, Avg=28,48, 90=54, 99=73, 99.9=148, 99.99=232] 
2024-09-17 18:31:20:045 22 sec: 734429 operations; 36769 current ops/sec; est completion in 53 seconds [READ: Count=18340, Max=329, Min=16, Avg=26,04, 90=41, 99=75, 99.9=138, 99.99=249] [UPDATE: Count=18430, Max=399, Min=18, Avg=26,54, 90=44, 99=81, 99.9=147, 99.99=235] 
2024-09-17 18:31:21:045 23 sec: 774929 operations; 40500 current ops/sec; est completion in 52 seconds [READ: Count=20199, Max=1530, Min=18, Avg=23,69, 90=28, 99=62, 99.9=125, 99.99=212] [UPDATE: Count=20295, Max=515, Min=16, Avg=23,98, 90=29, 99=67, 99.9=138, 99.99=233] 
2024-09-17 18:31:22:045 24 sec: 812112 operations; 37183 current ops/sec; est completion in 50 seconds [READ: Count=18579, Max=301, Min=18, Avg=25,9, 90=40, 99=73, 99.9=148, 99.99=251] [UPDATE: Count=18602, Max=454, Min=18, Avg=26,13, 90=40, 99=78, 99.9=170, 99.99=263] 
2024-09-17 18:31:23:045 25 sec: 850814 operations; 38702 current ops/sec; est completion in 49 seconds [READ: Count=19385, Max=1784, Min=18, Avg=24,79, 90=31, 99=66, 99.9=132, 99.99=222] [UPDATE: Count=19321, Max=233, Min=17, Avg=25,16, 90=31, 99=71, 99.9=138, 99.99=214] 
2024-09-17 18:31:24:045 26 sec: 888459 operations; 37645 current ops/sec; est completion in 48 seconds [READ: Count=18972, Max=229, Min=18, Avg=25,63, 90=42, 99=67, 99.9=135, 99.99=209] [UPDATE: Count=18669, Max=178, Min=18, Avg=25,79, 90=41, 99=69, 99.9=131, 99.99=169] 
2024-09-17 18:31:25:045 27 sec: 923781 operations; 35322 current ops/sec; est completion in 47 seconds [READ: Count=17516, Max=388, Min=12, Avg=27,27, 90=52, 99=71, 99.9=140, 99.99=225] [UPDATE: Count=17816, Max=383, Min=18, Avg=27,54, 90=55, 99=74, 99.9=136, 99.99=228] 
2024-09-17 18:31:26:045 28 sec: 958165 operations; 34384 current ops/sec; est completion in 46 seconds [READ: Count=17348, Max=1612, Min=19, Avg=27,95, 90=52, 99=70, 99.9=134, 99.99=217] [UPDATE: Count=17033, Max=930, Min=18, Avg=28,44, 90=56, 99=72, 99.9=152, 99.99=230] 
2024-09-17 18:31:27:045 29 sec: 993290 operations; 35125 current ops/sec; est completion in 44 seconds [READ: Count=17563, Max=229, Min=19, Avg=27,45, 90=48, 99=74, 99.9=151, 99.99=224] [UPDATE: Count=17559, Max=245, Min=18, Avg=27,68, 90=51, 99=78, 99.9=150, 99.99=228] 
2024-09-17 18:31:28:045 30 sec: 1018016 operations; 24726 current ops/sec; est completion in 44 seconds [READ: Count=12295, Max=1515, Min=19, Avg=39,09, 90=66, 99=130, 99.9=221, 99.99=1019] [UPDATE: Count=12430, Max=982, Min=18, Avg=39,69, 90=69, 99=136, 99.9=257, 99.99=869] 
2024-09-17 18:31:29:045 31 sec: 1034164 operations; 16148 current ops/sec; est completion in 44 seconds [READ: Count=8124, Max=880, Min=19, Avg=58,43, 90=83, 99=158, 99.9=477, 99.99=850] [UPDATE: Count=8021, Max=1021, Min=19, Avg=63,09, 90=92, 99=193, 99.9=815, 99.99=903] 
2024-09-17 18:31:30:045 32 sec: 1056394 operations; 22230 current ops/sec; est completion in 44 seconds [READ: Count=11149, Max=918, Min=19, Avg=43,48, 90=78, 99=155, 99.9=258, 99.99=892] [UPDATE: Count=11078, Max=815, Min=19, Avg=44,28, 90=82, 99=163, 99.9=287, 99.99=743] 
2024-09-17 18:31:31:045 33 sec: 1075525 operations; 19131 current ops/sec; est completion in 44 seconds [READ: Count=9428, Max=1008, Min=19, Avg=50,15, 90=82, 99=178, 99.9=438, 99.99=907] [UPDATE: Count=9709, Max=909, Min=19, Avg=52,15, 90=87, 99=187, 99.9=646, 99.99=862] 
2024-09-17 18:31:32:045 34 sec: 1099406 operations; 23881 current ops/sec; est completion in 44 seconds [READ: Count=11860, Max=1926, Min=19, Avg=40,3, 90=72, 99=163, 99.9=299, 99.99=882] [UPDATE: Count=12020, Max=973, Min=19, Avg=41,08, 90=77, 99=165, 99.9=350, 99.99=930] 
2024-09-17 18:31:33:045 35 sec: 1126316 operations; 26910 current ops/sec; est completion in 43 seconds [READ: Count=13481, Max=926, Min=19, Avg=36,24, 90=66, 99=122, 99.9=223, 99.99=879] [UPDATE: Count=13430, Max=776, Min=18, Avg=36,02, 90=68, 99=128, 99.9=205, 99.99=694] 
2024-09-17 18:31:34:045 36 sec: 1147507 operations; 21191 current ops/sec; est completion in 43 seconds [READ: Count=10611, Max=1417, Min=18, Avg=45,62, 90=80, 99=178, 99.9=372, 99.99=966] [UPDATE: Count=10579, Max=754, Min=18, Avg=46,67, 90=84, 99=198, 99.9=400, 99.99=547] 
2024-09-17 18:31:35:045 37 sec: 1163913 operations; 16406 current ops/sec; est completion in 43 seconds [READ: Count=8121, Max=945, Min=19, Avg=58,23, 90=102, 99=210, 99.9=463, 99.99=935] [UPDATE: Count=8291, Max=1065, Min=19, Avg=61,03, 90=108, 99=232, 99.9=673, 99.99=972] 
2024-09-17 18:31:36:045 38 sec: 1186764 operations; 22851 current ops/sec; est completion in 43 seconds [READ: Count=11443, Max=2003, Min=18, Avg=42,18, 90=69, 99=138, 99.9=246, 99.99=1909] [UPDATE: Count=11402, Max=387, Min=18, Avg=43,36, 90=73, 99=149, 99.9=244, 99.99=376] 
2024-09-17 18:31:37:045 39 sec: 1209485 operations; 22721 current ops/sec; est completion in 42 seconds [READ: Count=11362, Max=334, Min=19, Avg=42,31, 90=74, 99=141, 99.9=227, 99.99=313] [UPDATE: Count=11357, Max=759, Min=19, Avg=43,49, 90=77, 99=140, 99.9=224, 99.99=360] 
2024-09-17 18:31:38:045 40 sec: 1224902 operations; 15417 current ops/sec; est completion in 42 seconds [READ: Count=7773, Max=741, Min=19, Avg=61,27, 90=106, 99=220, 99.9=357, 99.99=463] [UPDATE: Count=7652, Max=604, Min=19, Avg=65,65, 90=119, 99=248, 99.9=359, 99.99=428] 
2024-09-17 18:31:39:045 41 sec: 1241261 operations; 16359 current ops/sec; est completion in 42 seconds [READ: Count=8140, Max=1923, Min=18, Avg=58,26, 90=103, 99=220, 99.9=848, 99.99=1147] [UPDATE: Count=8210, Max=1314, Min=18, Avg=61,31, 90=110, 99=234, 99.9=836, 99.99=1040] 
2024-09-17 18:31:40:045 42 sec: 1261636 operations; 20375 current ops/sec; est completion in 42 seconds [READ: Count=10199, Max=973, Min=13, Avg=47,62, 90=78, 99=155, 99.9=827, 99.99=943] [UPDATE: Count=10182, Max=919, Min=18, Avg=48,29, 90=81, 99=152, 99.9=723, 99.99=890] 
2024-09-17 18:31:41:045 43 sec: 1284961 operations; 23325 current ops/sec; est completion in 41 seconds [READ: Count=11680, Max=902, Min=19, Avg=41,33, 90=68, 99=134, 99.9=218, 99.99=895] [UPDATE: Count=11642, Max=949, Min=18, Avg=42,26, 90=72, 99=139, 99.9=251, 99.99=845] 
2024-09-17 18:31:42:045 44 sec: 1298195 operations; 13234 current ops/sec; est completion in 41 seconds [READ: Count=6622, Max=835, Min=19, Avg=71,87, 90=113, 99=248, 99.9=795, 99.99=825] [UPDATE: Count=6611, Max=944, Min=19, Avg=76,14, 90=126, 99=259, 99.9=710, 99.99=888] 
2024-09-17 18:31:43:045 45 sec: 1314013 operations; 15818 current ops/sec; est completion in 41 seconds [READ: Count=7875, Max=965, Min=19, Avg=60,1, 90=87, 99=176, 99.9=762, 99.99=893] [UPDATE: Count=7943, Max=950, Min=19, Avg=63,63, 90=94, 99=187, 99.9=820, 99.99=864] 
2024-09-17 18:31:44:045 46 sec: 1328418 operations; 14405 current ops/sec; est completion in 41 seconds [READ: Count=7174, Max=897, Min=20, Avg=65,94, 90=100, 99=208, 99.9=791, 99.99=841] [UPDATE: Count=7230, Max=1122, Min=18, Avg=70,09, 90=107, 99=228, 99.9=810, 99.99=1067] 
2024-09-17 18:31:45:045 47 sec: 1341507 operations; 13089 current ops/sec; est completion in 41 seconds [READ: Count=6477, Max=1174, Min=19, Avg=73,19, 90=123, 99=274, 99.9=865, 99.99=980] [UPDATE: Count=6618, Max=1814, Min=19, Avg=76,58, 90=130, 99=274, 99.9=941, 99.99=1562] 
2024-09-17 18:31:46:045 48 sec: 1361650 operations; 20143 current ops/sec; est completion in 41 seconds [READ: Count=10054, Max=2107, Min=14, Avg=48,03, 90=80, 99=153, 99.9=500, 99.99=965] [UPDATE: Count=10086, Max=1067, Min=19, Avg=48,86, 90=82, 99=159, 99.9=379, 99.99=868] 
2024-09-17 18:31:47:045 49 sec: 1388749 operations; 27099 current ops/sec; est completion in 40 seconds [READ: Count=13713, Max=978, Min=19, Avg=35,45, 90=63, 99=128, 99.9=215, 99.99=882] [UPDATE: Count=13385, Max=984, Min=18, Avg=36,43, 90=69, 99=136, 99.9=251, 99.99=717] 
2024-09-17 18:31:48:045 50 sec: 1403763 operations; 15014 current ops/sec; est completion in 40 seconds [READ: Count=7601, Max=1964, Min=19, Avg=63,98, 90=108, 99=231, 99.9=827, 99.99=1275] [UPDATE: Count=7420, Max=1271, Min=19, Avg=66,14, 90=114, 99=230, 99.9=754, 99.99=982] 
2024-09-17 18:31:49:045 51 sec: 1425832 operations; 22069 current ops/sec; est completion in 39 seconds [READ: Count=11077, Max=517, Min=18, Avg=43,99, 90=71, 99=152, 99.9=248, 99.99=400] [UPDATE: Count=10987, Max=417, Min=18, Avg=44,54, 90=73, 99=154, 99.9=252, 99.99=398] 
2024-09-17 18:31:50:045 52 sec: 1447950 operations; 22118 current ops/sec; est completion in 38 seconds [READ: Count=11009, Max=835, Min=19, Avg=43,2, 90=80, 99=194, 99.9=379, 99.99=754] [UPDATE: Count=11109, Max=1010, Min=18, Avg=44,92, 90=84, 99=208, 99.9=428, 99.99=977] 
2024-09-17 18:31:51:045 53 sec: 1461585 operations; 13635 current ops/sec; est completion in 38 seconds [READ: Count=6898, Max=4603, Min=19, Avg=68,24, 90=102, 99=287, 99.9=809, 99.99=1032] [UPDATE: Count=6737, Max=2425, Min=19, Avg=75,43, 90=112, 99=367, 99.9=923, 99.99=1898] 
2024-09-17 18:31:52:045 54 sec: 1474539 operations; 12954 current ops/sec; est completion in 38 seconds [READ: Count=6378, Max=1656, Min=20, Avg=73,29, 90=115, 99=267, 99.9=829, 99.99=1075] [UPDATE: Count=6580, Max=966, Min=20, Avg=77,71, 90=126, 99=286, 99.9=798, 99.99=945] 
2024-09-17 18:31:53:045 55 sec: 1488150 operations; 13611 current ops/sec; est completion in 38 seconds [READ: Count=6887, Max=2261, Min=20, Avg=70,15, 90=111, 99=300, 99.9=771, 99.99=1281] [UPDATE: Count=6716, Max=3665, Min=20, Avg=73,23, 90=119, 99=309, 99.9=773, 99.99=2363] 
2024-09-17 18:31:54:045 56 sec: 1504489 operations; 16339 current ops/sec; est completion in 38 seconds [READ: Count=8119, Max=825, Min=19, Avg=58,58, 90=94, 99=188, 99.9=350, 99.99=411] [UPDATE: Count=8220, Max=668, Min=16, Avg=61,37, 90=100, 99=205, 99.9=340, 99.99=593] 
2024-09-17 18:31:55:045 57 sec: 1519880 operations; 15391 current ops/sec; est completion in 37 seconds [READ: Count=7750, Max=1214, Min=19, Avg=62,15, 90=103, 99=221, 99.9=347, 99.99=756] [UPDATE: Count=7647, Max=628, Min=19, Avg=65,1, 90=113, 99=247, 99.9=392, 99.99=472] 
2024-09-17 18:31:56:045 58 sec: 1548739 operations; 28859 current ops/sec; est completion in 36 seconds [READ: Count=14474, Max=376, Min=17, Avg=33,49, 90=58, 99=109, 99.9=197, 99.99=275] [UPDATE: Count=14381, Max=396, Min=11, Avg=33,92, 90=61, 99=121, 99.9=205, 99.99=385] 
2024-09-17 18:31:57:045 59 sec: 1567711 operations; 18972 current ops/sec; est completion in 36 seconds [READ: Count=9498, Max=3201, Min=19, Avg=51,28, 90=94, 99=243, 99.9=416, 99.99=1039] [UPDATE: Count=9474, Max=881, Min=18, Avg=51,58, 90=98, 99=248, 99.9=417, 99.99=503] 
2024-09-17 18:31:58:045 60 sec: 1591174 operations; 23463 current ops/sec; est completion in 35 seconds [READ: Count=11779, Max=625, Min=18, Avg=41,28, 90=74, 99=192, 99.9=355, 99.99=420] [UPDATE: Count=11682, Max=1363, Min=19, Avg=41,79, 90=77, 99=181, 99.9=344, 99.99=472] 
2024-09-17 18:31:59:045 61 sec: 1614160 operations; 22986 current ops/sec; est completion in 34 seconds [READ: Count=11592, Max=850, Min=18, Avg=42,19, 90=82, 99=182, 99.9=348, 99.99=814] [UPDATE: Count=11398, Max=838, Min=19, Avg=42,56, 90=82, 99=186, 99.9=357, 99.99=752] 
2024-09-17 18:32:00:045 62 sec: 1634213 operations; 20053 current ops/sec; est completion in 33 seconds [READ: Count=10181, Max=909, Min=19, Avg=48,49, 90=81, 99=151, 99.9=809, 99.99=905] [UPDATE: Count=9869, Max=920, Min=19, Avg=48,94, 90=84, 99=157, 99.9=416, 99.99=888] 
2024-09-17 18:32:01:045 63 sec: 1656483 operations; 22270 current ops/sec; est completion in 33 seconds [READ: Count=11159, Max=415, Min=18, Avg=43,16, 90=73, 99=136, 99.9=238, 99.99=377] [UPDATE: Count=11109, Max=435, Min=18, Avg=44,52, 90=77, 99=145, 99.9=231, 99.99=360] 
2024-09-17 18:32:02:045 64 sec: 1680278 operations; 23795 current ops/sec; est completion in 32 seconds [READ: Count=11903, Max=331, Min=17, Avg=40,54, 90=74, 99=129, 99.9=224, 99.99=303] [UPDATE: Count=11891, Max=700, Min=18, Avg=41,36, 90=77, 99=134, 99.9=260, 99.99=444] 
2024-09-17 18:32:03:045 65 sec: 1704349 operations; 24071 current ops/sec; est completion in 31 seconds [READ: Count=11894, Max=369, Min=19, Avg=40,15, 90=70, 99=137, 99.9=226, 99.99=317] [UPDATE: Count=12176, Max=412, Min=17, Avg=40,96, 90=73, 99=144, 99.9=243, 99.99=386] 
2024-09-17 18:32:04:045 66 sec: 1728914 operations; 24565 current ops/sec; est completion in 30 seconds [READ: Count=12297, Max=700, Min=19, Avg=39,36, 90=67, 99=130, 99.9=199, 99.99=516] [UPDATE: Count=12272, Max=330, Min=18, Avg=40,16, 90=71, 99=134, 99.9=220, 99.99=322] 
2024-09-17 18:32:05:045 67 sec: 1750787 operations; 21873 current ops/sec; est completion in 29 seconds [READ: Count=10954, Max=955, Min=19, Avg=43,6, 90=73, 99=140, 99.9=220, 99.99=386] [UPDATE: Count=10924, Max=1103, Min=19, Avg=45,56, 90=78, 99=150, 99.9=248, 99.99=443] 
2024-09-17 18:32:06:045 68 sec: 1777750 operations; 26963 current ops/sec; est completion in 28 seconds [READ: Count=13465, Max=910, Min=19, Avg=35,84, 90=60, 99=106, 99.9=198, 99.99=281] [UPDATE: Count=13497, Max=349, Min=19, Avg=36,32, 90=63, 99=111, 99.9=182, 99.99=262] 
2024-09-17 18:32:07:045 69 sec: 1805975 operations; 28225 current ops/sec; est completion in 27 seconds [READ: Count=14163, Max=363, Min=19, Avg=34,07, 90=59, 99=108, 99.9=204, 99.99=292] [UPDATE: Count=14055, Max=458, Min=18, Avg=34,67, 90=62, 99=122, 99.9=200, 99.99=347] 
2024-09-17 18:32:08:045 70 sec: 1828463 operations; 22488 current ops/sec; est completion in 26 seconds [READ: Count=11276, Max=403, Min=19, Avg=42,81, 90=79, 99=179, 99.9=310, 99.99=364] [UPDATE: Count=11214, Max=509, Min=18, Avg=43,82, 90=83, 99=181, 99.9=332, 99.99=493] 
2024-09-17 18:32:09:045 71 sec: 1852480 operations; 24017 current ops/sec; est completion in 25 seconds [READ: Count=11989, Max=1683, Min=19, Avg=40,34, 90=67, 99=149, 99.9=467, 99.99=1126] [UPDATE: Count=12031, Max=1468, Min=18, Avg=40,91, 90=70, 99=153, 99.9=542, 99.99=1042] 
2024-09-17 18:32:10:045 72 sec: 1870471 operations; 17991 current ops/sec; est completion in 25 seconds [READ: Count=8997, Max=1482, Min=19, Avg=52,98, 90=97, 99=212, 99.9=379, 99.99=683] [UPDATE: Count=8994, Max=1614, Min=18, Avg=55,4, 90=102, 99=249, 99.9=431, 99.99=1491] 
2024-09-17 18:32:11:045 73 sec: 1906255 operations; 35784 current ops/sec; est completion in 23 seconds [READ: Count=17813, Max=234, Min=18, Avg=26,98, 90=47, 99=76, 99.9=146, 99.99=213] [UPDATE: Count=17967, Max=229, Min=18, Avg=27,12, 90=50, 99=81, 99.9=146, 99.99=214] 
2024-09-17 18:32:12:045 74 sec: 1932048 operations; 25793 current ops/sec; est completion in 22 seconds [READ: Count=12900, Max=6823, Min=19, Avg=37,44, 90=64, 99=131, 99.9=261, 99.99=951] [UPDATE: Count=12898, Max=2475, Min=19, Avg=37,7, 90=66, 99=139, 99.9=346, 99.99=1978] 
2024-09-17 18:32:13:045 75 sec: 1959197 operations; 27149 current ops/sec; est completion in 21 seconds [READ: Count=13622, Max=879, Min=19, Avg=35,49, 90=65, 99=135, 99.9=234, 99.99=390] [UPDATE: Count=13523, Max=355, Min=15, Avg=36,28, 90=68, 99=141, 99.9=253, 99.99=343] 
2024-09-17 18:32:14:045 76 sec: 1988627 operations; 29430 current ops/sec; est completion in 20 seconds [READ: Count=14739, Max=973, Min=19, Avg=32,59, 90=59, 99=136, 99.9=226, 99.99=815] [UPDATE: Count=14690, Max=1200, Min=18, Avg=33,5, 90=62, 99=140, 99.9=293, 99.99=909] 
2024-09-17 18:32:15:045 77 sec: 2006782 operations; 18155 current ops/sec; est completion in 19 seconds [READ: Count=9053, Max=1022, Min=14, Avg=53,4, 90=90, 99=179, 99.9=770, 99.99=1002] [UPDATE: Count=9103, Max=885, Min=19, Avg=54,46, 90=94, 99=188, 99.9=548, 99.99=858] 
2024-09-17 18:32:16:045 78 sec: 2021826 operations; 15044 current ops/sec; est completion in 19 seconds [READ: Count=7495, Max=1139, Min=19, Avg=64,08, 90=115, 99=260, 99.9=777, 99.99=956] [UPDATE: Count=7552, Max=1089, Min=19, Avg=66,03, 90=120, 99=249, 99.9=540, 99.99=966] 
2024-09-17 18:32:17:045 79 sec: 2045535 operations; 23709 current ops/sec; est completion in 18 seconds [READ: Count=11837, Max=1019, Min=18, Avg=40,95, 90=66, 99=142, 99.9=378, 99.99=1014] [UPDATE: Count=11867, Max=997, Min=18, Avg=41,5, 90=69, 99=153, 99.9=303, 99.99=932] 
2024-09-17 18:32:18:045 80 sec: 2072023 operations; 26488 current ops/sec; est completion in 17 seconds [READ: Count=13262, Max=972, Min=19, Avg=36,49, 90=61, 99=140, 99.9=282, 99.99=888] [UPDATE: Count=13226, Max=1101, Min=19, Avg=37,04, 90=64, 99=154, 99.9=267, 99.99=917] 
2024-09-17 18:32:19:045 81 sec: 2087198 operations; 15175 current ops/sec; est completion in 17 seconds [READ: Count=7582, Max=1075, Min=19, Avg=63,09, 90=102, 99=189, 99.9=384, 99.99=994] [UPDATE: Count=7593, Max=1023, Min=18, Avg=66,19, 90=107, 99=215, 99.9=436, 99.99=906] 
2024-09-17 18:32:20:045 82 sec: 2100119 operations; 12921 current ops/sec; est completion in 16 seconds [READ: Count=6374, Max=2651, Min=19, Avg=74,09, 90=122, 99=266, 99.9=1006, 99.99=1543] [UPDATE: Count=6547, Max=1548, Min=19, Avg=76,45, 90=130, 99=285, 99.9=905, 99.99=1158] 
2024-09-17 18:32:21:045 83 sec: 2117439 operations; 17320 current ops/sec; est completion in 15 seconds [READ: Count=8693, Max=7435, Min=19, Avg=55,83, 90=104, 99=233, 99.9=818, 99.99=2857] [UPDATE: Count=8632, Max=4739, Min=19, Avg=56,57, 90=108, 99=272, 99.9=558, 99.99=988] 
2024-09-17 18:32:22:045 84 sec: 2132244 operations; 14805 current ops/sec; est completion in 15 seconds [READ: Count=7426, Max=4251, Min=19, Avg=64,97, 90=101, 99=224, 99.9=775, 99.99=951] [UPDATE: Count=7377, Max=885, Min=19, Avg=67,28, 90=111, 99=243, 99.9=449, 99.99=859] 
2024-09-17 18:32:23:045 85 sec: 2154391 operations; 22147 current ops/sec; est completion in 14 seconds [READ: Count=11002, Max=1859, Min=19, Avg=43,6, 90=76, 99=164, 99.9=290, 99.99=893] [UPDATE: Count=11143, Max=1698, Min=18, Avg=44,52, 90=81, 99=169, 99.9=299, 99.99=906] 
2024-09-17 18:32:24:045 86 sec: 2179548 operations; 25157 current ops/sec; est completion in 13 seconds [READ: Count=12637, Max=1180, Min=19, Avg=38,73, 90=72, 99=150, 99.9=635, 99.99=889] [UPDATE: Count=12524, Max=925, Min=17, Avg=38,84, 90=75, 99=152, 99.9=310, 99.99=894] 
2024-09-17 18:32:25:045 87 sec: 2197232 operations; 17684 current ops/sec; est completion in 12 seconds [READ: Count=8826, Max=997, Min=19, Avg=54,06, 90=92, 99=188, 99.9=741, 99.99=900] [UPDATE: Count=8859, Max=1008, Min=19, Avg=56,3, 90=97, 99=203, 99.9=795, 99.99=863] 
2024-09-17 18:32:26:045 88 sec: 2222487 operations; 25255 current ops/sec; est completion in 11 seconds [READ: Count=12734, Max=1270, Min=19, Avg=38,49, 90=63, 99=142, 99.9=276, 99.99=1032] [UPDATE: Count=12518, Max=607, Min=19, Avg=38,75, 90=66, 99=144, 99.9=267, 99.99=408] 
2024-09-17 18:32:27:045 89 sec: 2256550 operations; 34063 current ops/sec; est completion in 10 seconds [READ: Count=17211, Max=883, Min=19, Avg=28,37, 90=50, 99=84, 99.9=176, 99.99=797] [UPDATE: Count=16851, Max=870, Min=14, Avg=28,57, 90=53, 99=91, 99.9=178, 99.99=824] 
2024-09-17 18:32:28:045 90 sec: 2281698 operations; 25148 current ops/sec; est completion in 9 second [READ: Count=12532, Max=814, Min=19, Avg=38,28, 90=64, 99=138, 99.9=239, 99.99=810] [UPDATE: Count=12620, Max=968, Min=18, Avg=39,22, 90=67, 99=144, 99.9=273, 99.99=940] 
2024-09-17 18:32:29:045 91 sec: 2305009 operations; 23311 current ops/sec; est completion in 8 second [READ: Count=11586, Max=943, Min=19, Avg=41,02, 90=79, 99=189, 99.9=344, 99.99=832] [UPDATE: Count=11727, Max=997, Min=19, Avg=42,63, 90=85, 99=209, 99.9=403, 99.99=917] 
2024-09-17 18:32:30:045 92 sec: 2333994 operations; 28985 current ops/sec; est completion in 7 second [READ: Count=14469, Max=878, Min=19, Avg=33,22, 90=62, 99=123, 99.9=224, 99.99=835] [UPDATE: Count=14509, Max=625, Min=14, Avg=33,93, 90=66, 99=133, 99.9=207, 99.99=357] 
2024-09-17 18:32:31:045 93 sec: 2350686 operations; 16692 current ops/sec; est completion in 6 second [READ: Count=8267, Max=1160, Min=19, Avg=57,73, 90=99, 99=192, 99.9=607, 99.99=1063] [UPDATE: Count=8427, Max=1198, Min=19, Avg=59,52, 90=103, 99=218, 99.9=688, 99.99=1092] 
2024-09-17 18:32:32:045 94 sec: 2372622 operations; 21936 current ops/sec; est completion in 6 second [READ: Count=11026, Max=10015, Min=19, Avg=43,81, 90=74, 99=177, 99.9=536, 99.99=995] [UPDATE: Count=10917, Max=4403, Min=19, Avg=44,97, 90=78, 99=186, 99.9=478, 99.99=4127] 
2024-09-17 18:32:33:045 95 sec: 2399713 operations; 27091 current ops/sec; est completion in 4 second [READ: Count=13680, Max=378, Min=18, Avg=35,66, 90=60, 99=101, 99.9=155, 99.99=370] [UPDATE: Count=13403, Max=296, Min=18, Avg=36,24, 90=62, 99=99, 99.9=161, 99.99=246] 
2024-09-17 18:32:34:045 96 sec: 2416614 operations; 16901 current ops/sec; est completion in 4 second [READ: Count=8524, Max=882, Min=19, Avg=56,54, 90=108, 99=237, 99.9=459, 99.99=859] [UPDATE: Count=8377, Max=1068, Min=19, Avg=59,23, 90=116, 99=245, 99.9=549, 99.99=906] 
2024-09-17 18:32:35:045 97 sec: 2427963 operations; 11349 current ops/sec; est completion in 3 second [READ: Count=5736, Max=1053, Min=19, Avg=84,65, 90=139, 99=367, 99.9=890, 99.99=958] [UPDATE: Count=5613, Max=1018, Min=19, Avg=88,25, 90=150, 99=347, 99.9=933, 99.99=998] 
2024-09-17 18:32:36:045 98 sec: 2444895 operations; 16932 current ops/sec; est completion in 3 second [READ: Count=8562, Max=1601, Min=19, Avg=56,17, 90=85, 99=227, 99.9=809, 99.99=1467] [UPDATE: Count=8371, Max=1787, Min=19, Avg=59,38, 90=91, 99=259, 99.9=845, 99.99=1541] 
2024-09-17 18:32:37:045 99 sec: 2460730 operations; 15835 current ops/sec; est completion in 2 second [READ: Count=8004, Max=939, Min=19, Avg=60,17, 90=113, 99=244, 99.9=379, 99.99=569] [UPDATE: Count=7830, Max=5443, Min=18, Avg=63,64, 90=117, 99=266, 99.9=456, 99.99=4587] 
2024-09-17 18:32:38:045 100 sec: 2475397 operations; 14667 current ops/sec; est completion in 1 second [READ: Count=7392, Max=10511, Min=19, Avg=66,23, 90=108, 99=201, 99.9=701, 99.99=967] [UPDATE: Count=7278, Max=5207, Min=19, Avg=67,37, 90=110, 99=206, 99.9=816, 99.99=965] 
2024-09-17 18:32:39:045 101 sec: 2499268 operations; 23871 current ops/sec; est completion in 1 second [READ: Count=11813, Max=3885, Min=19, Avg=40,59, 90=72, 99=127, 99.9=226, 99.99=862] [UPDATE: Count=12059, Max=876, Min=14, Avg=41,06, 90=74, 99=136, 99.9=210, 99.99=742] 
2024-09-17 18:32:39:081 101 sec: 2500000 operations; 20914,29 current ops/sec; [READ: Count=364, Max=160, Min=22, Avg=43,49, 90=68, 99=95, 99.9=160, 99.99=160] [CLEANUP: Count=1, Max=1708, Min=1708, Avg=1708, 90=1708, 99=1708, 99.9=1708, 99.99=1708] [UPDATE: Count=361, Max=241, Min=22, Avg=44,89, 90=72, 99=113, 99.9=241, 99.99=241] 
[OVERALL], RunTime(ms), 101036
[OVERALL], Throughput(ops/sec), 24743.65572667168
[TOTAL_GCS_G1_Young_Generation], Count, 31
[TOTAL_GC_TIME_G1_Young_Generation], Time(ms), 37
[TOTAL_GC_TIME_%_G1_Young_Generation], Time(%), 0.03662061047547409
[TOTAL_GCS_G1_Old_Generation], Count, 0
[TOTAL_GC_TIME_G1_Old_Generation], Time(ms), 0
[TOTAL_GC_TIME_%_G1_Old_Generation], Time(%), 0.0
[TOTAL_GCs], Count, 31
[TOTAL_GC_TIME], Time(ms), 37
[TOTAL_GC_TIME_%], Time(%), 0.03662061047547409
[READ], Operations, 1250965
[READ], AverageLatency(us), 38.834949818739936
[READ], MinLatency(us), 12
[READ], MaxLatency(us), 10511
[READ], 95thPercentileLatency(us), 88
[READ], 99thPercentileLatency(us), 153
[READ], Return=OK, 1250965
[CLEANUP], Operations, 1
[CLEANUP], AverageLatency(us), 1708.0
[CLEANUP], MinLatency(us), 1708
[CLEANUP], MaxLatency(us), 1708
[CLEANUP], 95thPercentileLatency(us), 1708
[CLEANUP], 99thPercentileLatency(us), 1708
[UPDATE], Operations, 1249035
[UPDATE], AverageLatency(us), 39.78209577794057
[UPDATE], MinLatency(us), 11
[UPDATE], MaxLatency(us), 5443
[UPDATE], 95thPercentileLatency(us), 92
[UPDATE], 99thPercentileLatency(us), 163
[UPDATE], Return=OK, 1249035
