/usr/bin/java  -classpath /home/sebastiaoamaro/phd/torefidevel/tests/redis/ycsb-0.17.0/conf:/home/sebastiaoamaro/phd/torefidevel/tests/redis/ycsb-0.17.0/lib/HdrHistogram-2.1.4.jar:/home/sebastiaoamaro/phd/torefidevel/tests/redis/ycsb-0.17.0/lib/core-0.17.0.jar:/home/sebastiaoamaro/phd/torefidevel/tests/redis/ycsb-0.17.0/lib/htrace-core4-4.1.0-incubating.jar:/home/sebastiaoamaro/phd/torefidevel/tests/redis/ycsb-0.17.0/lib/jackson-core-asl-1.9.4.jar:/home/sebastiaoamaro/phd/torefidevel/tests/redis/ycsb-0.17.0/lib/jackson-mapper-asl-1.9.4.jar:/home/sebastiaoamaro/phd/torefidevel/tests/redis/ycsb-0.17.0/redis-binding/lib/commons-pool2-2.4.2.jar:/home/sebastiaoamaro/phd/torefidevel/tests/redis/ycsb-0.17.0/redis-binding/lib/jedis-2.9.0.jar:/home/sebastiaoamaro/phd/torefidevel/tests/redis/ycsb-0.17.0/redis-binding/lib/redis-binding-0.17.0.jar site.ycsb.Client -t -db site.ycsb.db.RedisClient -P workloads/workloada -s -p status.interval=1 -p operationcount=2500000 -p redis.host=172.38.0.11 -p redis.port=6379 -p redis.cluster=true -s
Command line: -t -db site.ycsb.db.RedisClient -P workloads/workloada -s -p status.interval=1 -p operationcount=2500000 -p redis.host=172.38.0.11 -p redis.port=6379 -p redis.cluster=true -s
YCSB Client 0.17.0

Loading workload...
Starting test.
2024-09-17 18:33:44:266 0 sec: 0 operations; est completion in 0 second 
DBWrapper: report latency for each error is false and specific error codes to track for latency are: []
2024-09-17 18:33:45:247 1 sec: 13364 operations; 13364 current ops/sec; est completion in 3 minutes [READ: Count=6738, Max=4027, Min=19, Avg=61,83, 90=102, 99=184, 99.9=272, 99.99=2721] [UPDATE: Count=6672, Max=2397, Min=20, Avg=66,59, 90=115, 99=202, 99.9=324, 99.99=519] 
2024-09-17 18:33:46:247 2 sec: 38122 operations; 24758 current ops/sec; est completion in 2 minutes [READ: Count=12294, Max=1828, Min=19, Avg=38,64, 90=67, 99=128, 99.9=245, 99.99=630] [UPDATE: Count=12432, Max=2995, Min=18, Avg=39,22, 90=70, 99=142, 99.9=222, 99.99=360] 
2024-09-17 18:33:47:247 3 sec: 66617 operations; 28495 current ops/sec; est completion in 1 minute [READ: Count=14442, Max=458, Min=19, Avg=34,39, 90=63, 99=108, 99.9=175, 99.99=427] [UPDATE: Count=14054, Max=239, Min=18, Avg=33,42, 90=64, 99=108, 99.9=161, 99.99=238] 
2024-09-17 18:33:48:247 4 sec: 97413 operations; 30796 current ops/sec; est completion in 1 minute [READ: Count=15324, Max=1442, Min=20, Avg=32,02, 90=51, 99=103, 99.9=205, 99.99=364] [UPDATE: Count=15471, Max=359, Min=19, Avg=30,6, 90=52, 99=108, 99.9=218, 99.99=328] 
2024-09-17 18:33:49:247 5 sec: 131315 operations; 33902 current ops/sec; est completion in 1 minute [READ: Count=16939, Max=677, Min=16, Avg=28,44, 90=49, 99=92, 99.9=190, 99.99=512] [UPDATE: Count=16960, Max=1127, Min=19, Avg=28,6, 90=51, 99=98, 99.9=205, 99.99=760] 
2024-09-17 18:33:50:247 6 sec: 159196 operations; 27881 current ops/sec; est completion in 1 minute [READ: Count=14012, Max=384, Min=19, Avg=34,83, 90=61, 99=114, 99.9=176, 99.99=252] [UPDATE: Count=13878, Max=295, Min=19, Avg=34,76, 90=62, 99=114, 99.9=174, 99.99=245] 
2024-09-17 18:33:51:247 7 sec: 192184 operations; 32988 current ops/sec; est completion in 1 minute [READ: Count=16660, Max=830, Min=19, Avg=29,27, 90=49, 99=80, 99.9=168, 99.99=239] [UPDATE: Count=16341, Max=277, Min=19, Avg=29,36, 90=52, 99=88, 99.9=172, 99.99=248] 
2024-09-17 18:33:52:247 8 sec: 222712 operations; 30528 current ops/sec; est completion in 1 minute [READ: Count=15171, Max=249, Min=19, Avg=31,5, 90=56, 99=97, 99.9=170, 99.99=219] [UPDATE: Count=15355, Max=446, Min=18, Avg=32,07, 90=59, 99=107, 99.9=180, 99.99=268] 
2024-09-17 18:33:53:247 9 sec: 258357 operations; 35645 current ops/sec; est completion in 1 minute [READ: Count=17760, Max=284, Min=19, Avg=27,03, 90=48, 99=68, 99.9=143, 99.99=209] [UPDATE: Count=17894, Max=262, Min=19, Avg=27,2, 90=50, 99=74, 99.9=140, 99.99=196] 
2024-09-17 18:33:54:247 10 sec: 290981 operations; 32624 current ops/sec; est completion in 1 minute [READ: Count=16308, Max=1613, Min=19, Avg=29,67, 90=53, 99=84, 99.9=159, 99.99=248] [UPDATE: Count=16302, Max=450, Min=18, Avg=29,74, 90=55, 99=88, 99.9=153, 99.99=250] 
2024-09-17 18:33:55:247 11 sec: 324028 operations; 33047 current ops/sec; est completion in 1 minute [READ: Count=16416, Max=371, Min=19, Avg=29,2, 90=50, 99=86, 99.9=164, 99.99=257] [UPDATE: Count=16617, Max=333, Min=18, Avg=29,39, 90=52, 99=98, 99.9=173, 99.99=319] 
2024-09-17 18:33:56:247 12 sec: 358417 operations; 34389 current ops/sec; est completion in 1 minute [READ: Count=17112, Max=987, Min=15, Avg=28,04, 90=48, 99=78, 99.9=157, 99.99=239] [UPDATE: Count=17280, Max=1191, Min=18, Avg=28,27, 90=51, 99=85, 99.9=170, 99.99=248] 
2024-09-17 18:33:57:247 13 sec: 389083 operations; 30666 current ops/sec; est completion in 1 minute [READ: Count=15323, Max=271, Min=18, Avg=31,47, 90=57, 99=98, 99.9=169, 99.99=237] [UPDATE: Count=15349, Max=305, Min=18, Avg=31,88, 90=59, 99=108, 99.9=185, 99.99=237] 
2024-09-17 18:33:58:247 14 sec: 423611 operations; 34528 current ops/sec; est completion in 1 minute [READ: Count=17227, Max=891, Min=19, Avg=27,98, 90=53, 99=83, 99.9=148, 99.99=479] [UPDATE: Count=17299, Max=426, Min=17, Avg=28,11, 90=56, 99=85, 99.9=167, 99.99=351] 
2024-09-17 18:33:59:247 15 sec: 452506 operations; 28895 current ops/sec; est completion in 1 minute [READ: Count=14410, Max=1055, Min=18, Avg=33,55, 90=58, 99=97, 99.9=187, 99.99=336] [UPDATE: Count=14478, Max=274, Min=18, Avg=33,71, 90=61, 99=106, 99.9=168, 99.99=256] 
2024-09-17 18:34:00:247 16 sec: 482901 operations; 30395 current ops/sec; est completion in 1 minute [READ: Count=15156, Max=273, Min=19, Avg=31,68, 90=57, 99=97, 99.9=176, 99.99=251] [UPDATE: Count=15233, Max=264, Min=18, Avg=32,24, 90=60, 99=105, 99.9=163, 99.99=235] 
2024-09-17 18:34:01:247 17 sec: 512442 operations; 29541 current ops/sec; est completion in 1 minute [READ: Count=14744, Max=810, Min=19, Avg=32,74, 90=58, 99=88, 99.9=152, 99.99=289] [UPDATE: Count=14809, Max=446, Min=18, Avg=33,05, 90=60, 99=98, 99.9=157, 99.99=431] 
2024-09-17 18:34:02:247 18 sec: 534938 operations; 22496 current ops/sec; est completion in 1 minute [READ: Count=11194, Max=394, Min=19, Avg=42,98, 90=70, 99=131, 99.9=211, 99.99=312] [UPDATE: Count=11292, Max=331, Min=19, Avg=43,63, 90=73, 99=139, 99.9=220, 99.99=275] 
2024-09-17 18:34:03:247 19 sec: 562850 operations; 27912 current ops/sec; est completion in 1 minute [READ: Count=13967, Max=478, Min=18, Avg=34,54, 90=62, 99=117, 99.9=166, 99.99=274] [UPDATE: Count=13942, Max=266, Min=19, Avg=35,33, 90=64, 99=126, 99.9=195, 99.99=262] 
2024-09-17 18:34:04:247 20 sec: 587566 operations; 24716 current ops/sec; est completion in 1 minute [READ: Count=12298, Max=868, Min=19, Avg=39,16, 90=69, 99=132, 99.9=208, 99.99=361] [UPDATE: Count=12420, Max=356, Min=19, Avg=39,58, 90=71, 99=133, 99.9=209, 99.99=282] 
2024-09-17 18:34:05:247 21 sec: 611602 operations; 24036 current ops/sec; est completion in 1 minute [READ: Count=12055, Max=747, Min=19, Avg=39,94, 90=70, 99=129, 99.9=196, 99.99=267] [UPDATE: Count=11985, Max=753, Min=18, Avg=41,24, 90=73, 99=133, 99.9=229, 99.99=337] 
2024-09-17 18:34:06:247 22 sec: 643797 operations; 32195 current ops/sec; est completion in 1 minute [READ: Count=16050, Max=368, Min=18, Avg=29,93, 90=54, 99=111, 99.9=200, 99.99=275] [UPDATE: Count=16149, Max=361, Min=18, Avg=30,26, 90=56, 99=111, 99.9=206, 99.99=291] 
2024-09-17 18:34:07:247 23 sec: 678749 operations; 34952 current ops/sec; est completion in 1 minute [READ: Count=17382, Max=215, Min=19, Avg=27,62, 90=49, 99=70, 99.9=139, 99.99=208] [UPDATE: Count=17589, Max=269, Min=18, Avg=27,8, 90=51, 99=72, 99.9=146, 99.99=228] 
2024-09-17 18:34:08:247 24 sec: 708239 operations; 29490 current ops/sec; est completion in 1 minute [READ: Count=14807, Max=384, Min=12, Avg=32,65, 90=61, 99=109, 99.9=176, 99.99=304] [UPDATE: Count=14660, Max=337, Min=18, Avg=33,32, 90=63, 99=119, 99.9=177, 99.99=235] 
2024-09-17 18:34:09:247 25 sec: 735637 operations; 27398 current ops/sec; est completion in 1 minute [READ: Count=13854, Max=247, Min=18, Avg=35,17, 90=60, 99=117, 99.9=189, 99.99=245] [UPDATE: Count=13538, Max=451, Min=18, Avg=35,83, 90=63, 99=122, 99.9=204, 99.99=240] 
2024-09-17 18:34:10:247 26 sec: 769115 operations; 33478 current ops/sec; est completion in 59 seconds [READ: Count=16714, Max=1100, Min=19, Avg=28,91, 90=54, 99=79, 99.9=169, 99.99=243] [UPDATE: Count=16767, Max=185, Min=15, Avg=29, 90=57, 99=83, 99.9=145, 99.99=180] 
2024-09-17 18:34:11:247 27 sec: 799696 operations; 30581 current ops/sec; est completion in 58 seconds [READ: Count=15333, Max=398, Min=19, Avg=31,61, 90=56, 99=101, 99.9=160, 99.99=207] [UPDATE: Count=15248, Max=583, Min=18, Avg=31,84, 90=58, 99=104, 99.9=185, 99.99=299] 
2024-09-17 18:34:12:247 28 sec: 831399 operations; 31703 current ops/sec; est completion in 57 seconds [READ: Count=15713, Max=254, Min=18, Avg=30,46, 90=56, 99=79, 99.9=161, 99.99=243] [UPDATE: Count=15992, Max=255, Min=19, Avg=30,75, 90=58, 99=83, 99.9=165, 99.99=242] 
2024-09-17 18:34:13:247 29 sec: 871583 operations; 40184 current ops/sec; est completion in 55 seconds [READ: Count=20093, Max=327, Min=19, Avg=23,86, 90=29, 99=72, 99.9=138, 99.99=220] [UPDATE: Count=20087, Max=1099, Min=18, Avg=24,16, 90=29, 99=75, 99.9=154, 99.99=227] 
2024-09-17 18:34:14:247 30 sec: 896232 operations; 24649 current ops/sec; est completion in 54 seconds [READ: Count=12346, Max=306, Min=17, Avg=39,4, 90=67, 99=128, 99.9=212, 99.99=303] [UPDATE: Count=12303, Max=395, Min=19, Avg=39,76, 90=69, 99=132, 99.9=224, 99.99=364] 
2024-09-17 18:34:15:247 31 sec: 923014 operations; 26782 current ops/sec; est completion in 53 seconds [READ: Count=13338, Max=254, Min=19, Avg=36,12, 90=64, 99=116, 99.9=181, 99.99=231] [UPDATE: Count=13449, Max=356, Min=19, Avg=36,65, 90=67, 99=116, 99.9=181, 99.99=329] 
2024-09-17 18:34:16:247 32 sec: 952137 operations; 29123 current ops/sec; est completion in 53 seconds [READ: Count=14605, Max=244, Min=19, Avg=32,78, 90=59, 99=85, 99.9=152, 99.99=244] [UPDATE: Count=14517, Max=837, Min=18, Avg=34, 90=63, 99=101, 99.9=150, 99.99=240] 
2024-09-17 18:34:17:247 33 sec: 984817 operations; 32680 current ops/sec; est completion in 51 seconds [READ: Count=16412, Max=347, Min=18, Avg=29,53, 90=53, 99=91, 99.9=166, 99.99=232] [UPDATE: Count=16261, Max=405, Min=19, Avg=29,83, 90=56, 99=92, 99.9=166, 99.99=313] 
2024-09-17 18:34:18:247 34 sec: 1019126 operations; 34309 current ops/sec; est completion in 50 seconds [READ: Count=17227, Max=248, Min=19, Avg=28,06, 90=49, 99=74, 99.9=141, 99.99=209] [UPDATE: Count=17089, Max=251, Min=19, Avg=28,39, 90=51, 99=77, 99.9=147, 99.99=215] 
2024-09-17 18:34:19:247 35 sec: 1055618 operations; 36492 current ops/sec; est completion in 48 seconds [READ: Count=18256, Max=673, Min=19, Avg=26,46, 90=46, 99=73, 99.9=145, 99.99=233] [UPDATE: Count=18234, Max=229, Min=18, Avg=26,6, 90=43, 99=78, 99.9=146, 99.99=197] 
2024-09-17 18:34:20:247 36 sec: 1085785 operations; 30167 current ops/sec; est completion in 47 seconds [READ: Count=15033, Max=280, Min=19, Avg=31,86, 90=57, 99=100, 99.9=151, 99.99=237] [UPDATE: Count=15130, Max=384, Min=16, Avg=32,61, 90=59, 99=109, 99.9=165, 99.99=262] 
2024-09-17 18:34:21:247 37 sec: 1112944 operations; 27159 current ops/sec; est completion in 47 seconds [READ: Count=13578, Max=660, Min=16, Avg=35,34, 90=60, 99=103, 99.9=193, 99.99=465] [UPDATE: Count=13582, Max=864, Min=19, Avg=36,4, 90=63, 99=114, 99.9=192, 99.99=745] 
2024-09-17 18:34:22:247 38 sec: 1142998 operations; 30054 current ops/sec; est completion in 46 seconds [READ: Count=15029, Max=249, Min=19, Avg=32,22, 90=58, 99=108, 99.9=197, 99.99=247] [UPDATE: Count=15027, Max=342, Min=18, Avg=32,34, 90=60, 99=117, 99.9=217, 99.99=270] 
2024-09-17 18:34:23:247 39 sec: 1176763 operations; 33765 current ops/sec; est completion in 44 seconds [READ: Count=16778, Max=318, Min=18, Avg=28,57, 90=54, 99=72, 99.9=142, 99.99=240] [UPDATE: Count=16987, Max=273, Min=18, Avg=28,89, 90=57, 99=79, 99.9=151, 99.99=252] 
2024-09-17 18:34:24:247 40 sec: 1204858 operations; 28095 current ops/sec; est completion in 43 seconds [READ: Count=14175, Max=1270, Min=19, Avg=34,33, 90=62, 99=119, 99.9=201, 99.99=340] [UPDATE: Count=13921, Max=4247, Min=19, Avg=34,68, 90=64, 99=125, 99.9=205, 99.99=308] 
2024-09-17 18:34:25:247 41 sec: 1231564 operations; 26706 current ops/sec; est completion in 43 seconds [READ: Count=13441, Max=850, Min=18, Avg=36,36, 90=64, 99=132, 99.9=206, 99.99=780] [UPDATE: Count=13263, Max=1622, Min=18, Avg=36,61, 90=66, 99=131, 99.9=220, 99.99=292] 
2024-09-17 18:34:26:247 42 sec: 1256273 operations; 24709 current ops/sec; est completion in 42 seconds [READ: Count=12416, Max=339, Min=19, Avg=38,95, 90=67, 99=133, 99.9=202, 99.99=279] [UPDATE: Count=12292, Max=339, Min=18, Avg=39,97, 90=70, 99=142, 99.9=242, 99.99=296] 
2024-09-17 18:34:27:247 43 sec: 1293143 operations; 36870 current ops/sec; est completion in 41 seconds [READ: Count=18508, Max=631, Min=15, Avg=26,14, 90=32, 99=78, 99.9=150, 99.99=228] [UPDATE: Count=18362, Max=237, Min=18, Avg=26,26, 90=32, 99=82, 99.9=155, 99.99=201] 
2024-09-17 18:34:28:247 44 sec: 1319072 operations; 25929 current ops/sec; est completion in 40 seconds [READ: Count=12918, Max=402, Min=14, Avg=37,07, 90=64, 99=142, 99.9=229, 99.99=352] [UPDATE: Count=13009, Max=1199, Min=19, Avg=38,03, 90=67, 99=147, 99.9=244, 99.99=637] 
2024-09-17 18:34:29:247 45 sec: 1342809 operations; 23737 current ops/sec; est completion in 39 seconds [READ: Count=11999, Max=336, Min=19, Avg=40,35, 90=65, 99=130, 99.9=199, 99.99=312] [UPDATE: Count=11739, Max=318, Min=18, Avg=41,84, 90=68, 99=137, 99.9=216, 99.99=293] 
2024-09-17 18:34:30:247 46 sec: 1366380 operations; 23571 current ops/sec; est completion in 39 seconds [READ: Count=11795, Max=667, Min=19, Avg=40,85, 90=67, 99=124, 99.9=197, 99.99=277] [UPDATE: Count=11777, Max=1362, Min=18, Avg=41,96, 90=70, 99=133, 99.9=209, 99.99=360] 
2024-09-17 18:34:31:247 47 sec: 1393457 operations; 27077 current ops/sec; est completion in 38 seconds [READ: Count=13511, Max=326, Min=18, Avg=35,55, 90=66, 99=124, 99.9=189, 99.99=274] [UPDATE: Count=13566, Max=762, Min=18, Avg=36,38, 90=70, 99=130, 99.9=202, 99.99=259] 
2024-09-17 18:34:32:247 48 sec: 1425328 operations; 31871 current ops/sec; est completion in 37 seconds [READ: Count=15884, Max=2223, Min=18, Avg=30,39, 90=56, 99=89, 99.9=153, 99.99=234] [UPDATE: Count=16000, Max=375, Min=17, Avg=30,43, 90=58, 99=98, 99.9=164, 99.99=235] 
2024-09-17 18:34:33:247 49 sec: 1460654 operations; 35326 current ops/sec; est completion in 35 seconds [READ: Count=17731, Max=913, Min=18, Avg=27,44, 90=40, 99=77, 99.9=157, 99.99=343] [UPDATE: Count=17594, Max=496, Min=18, Avg=27,26, 90=38, 99=79, 99.9=163, 99.99=246] 
2024-09-17 18:34:34:247 50 sec: 1483333 operations; 22679 current ops/sec; est completion in 35 seconds [READ: Count=11359, Max=295, Min=19, Avg=43,01, 90=70, 99=134, 99.9=223, 99.99=288] [UPDATE: Count=11308, Max=425, Min=18, Avg=43,16, 90=72, 99=140, 99.9=228, 99.99=395] 
2024-09-17 18:34:35:247 51 sec: 1508916 operations; 25583 current ops/sec; est completion in 34 seconds [READ: Count=12918, Max=279, Min=19, Avg=37,62, 90=70, 99=119, 99.9=183, 99.99=269] [UPDATE: Count=12674, Max=333, Min=18, Avg=38,5, 90=73, 99=136, 99.9=213, 99.99=321] 
2024-09-17 18:34:36:247 52 sec: 1540590 operations; 31674 current ops/sec; est completion in 33 seconds [READ: Count=15885, Max=748, Min=19, Avg=30,43, 90=55, 99=82, 99.9=159, 99.99=281] [UPDATE: Count=15782, Max=569, Min=18, Avg=30,8, 90=57, 99=90, 99.9=159, 99.99=252] 
2024-09-17 18:34:37:247 53 sec: 1569895 operations; 29305 current ops/sec; est completion in 32 seconds [READ: Count=14505, Max=290, Min=19, Avg=33,02, 90=59, 99=90, 99.9=150, 99.99=262] [UPDATE: Count=14799, Max=285, Min=19, Avg=33,2, 90=61, 99=103, 99.9=167, 99.99=267] 
2024-09-17 18:34:38:247 54 sec: 1599943 operations; 30048 current ops/sec; est completion in 31 seconds [READ: Count=15197, Max=260, Min=18, Avg=32,12, 90=59, 99=105, 99.9=170, 99.99=233] [UPDATE: Count=14866, Max=256, Min=18, Avg=32,52, 90=61, 99=114, 99.9=191, 99.99=251] 
2024-09-17 18:34:39:247 55 sec: 1634880 operations; 34937 current ops/sec; est completion in 30 seconds [READ: Count=17400, Max=717, Min=18, Avg=27,66, 90=47, 99=79, 99.9=150, 99.99=248] [UPDATE: Count=17546, Max=326, Min=18, Avg=27,75, 90=50, 99=82, 99.9=156, 99.99=276] 
2024-09-17 18:34:40:247 56 sec: 1667976 operations; 33096 current ops/sec; est completion in 28 seconds [READ: Count=16411, Max=239, Min=14, Avg=29,23, 90=56, 99=76, 99.9=150, 99.99=219] [UPDATE: Count=16657, Max=296, Min=19, Avg=29,41, 90=58, 99=80, 99.9=162, 99.99=276] 
2024-09-17 18:34:41:247 57 sec: 1697703 operations; 29727 current ops/sec; est completion in 27 seconds [READ: Count=14911, Max=373, Min=19, Avg=32,34, 90=57, 99=109, 99.9=194, 99.99=307] [UPDATE: Count=14815, Max=1827, Min=19, Avg=32,82, 90=60, 99=110, 99.9=196, 99.99=969] 
2024-09-17 18:34:42:247 58 sec: 1731019 operations; 33316 current ops/sec; est completion in 26 seconds [READ: Count=16662, Max=273, Min=19, Avg=28,98, 90=53, 99=83, 99.9=154, 99.99=203] [UPDATE: Count=16666, Max=259, Min=18, Avg=29,22, 90=56, 99=94, 99.9=163, 99.99=211] 
2024-09-17 18:34:43:247 59 sec: 1767578 operations; 36559 current ops/sec; est completion in 25 seconds [READ: Count=18416, Max=271, Min=18, Avg=26,35, 90=29, 99=67, 99.9=144, 99.99=219] [UPDATE: Count=18137, Max=391, Min=18, Avg=26,45, 90=28, 99=73, 99.9=168, 99.99=321] 
2024-09-17 18:34:44:247 60 sec: 1796299 operations; 28721 current ops/sec; est completion in 24 seconds [READ: Count=14450, Max=284, Min=19, Avg=33,27, 90=60, 99=109, 99.9=163, 99.99=229] [UPDATE: Count=14283, Max=943, Min=18, Avg=34,44, 90=64, 99=118, 99.9=179, 99.99=370] 
2024-09-17 18:34:45:247 61 sec: 1813583 operations; 17284 current ops/sec; est completion in 24 seconds [READ: Count=8681, Max=2319, Min=20, Avg=55,69, 90=80, 99=153, 99.9=252, 99.99=350] [UPDATE: Count=8591, Max=583, Min=20, Avg=57,49, 90=84, 99=165, 99.9=270, 99.99=322] 
2024-09-17 18:34:46:247 62 sec: 1836668 operations; 23085 current ops/sec; est completion in 23 seconds [READ: Count=11531, Max=1466, Min=19, Avg=41,59, 90=69, 99=132, 99.9=212, 99.99=754] [UPDATE: Count=11548, Max=652, Min=19, Avg=42,8, 90=72, 99=147, 99.9=238, 99.99=378] 
2024-09-17 18:34:47:247 63 sec: 1864260 operations; 27592 current ops/sec; est completion in 22 seconds [READ: Count=14010, Max=492, Min=18, Avg=35,03, 90=60, 99=111, 99.9=162, 99.99=454] [UPDATE: Count=13586, Max=764, Min=18, Avg=35,48, 90=62, 99=116, 99.9=179, 99.99=605] 
2024-09-17 18:34:48:247 64 sec: 1893687 operations; 29427 current ops/sec; est completion in 21 seconds [READ: Count=14531, Max=334, Min=18, Avg=32,64, 90=59, 99=111, 99.9=188, 99.99=333] [UPDATE: Count=14893, Max=408, Min=18, Avg=33,38, 90=62, 99=119, 99.9=192, 99.99=265] 
2024-09-17 18:34:49:247 65 sec: 1927016 operations; 33329 current ops/sec; est completion in 20 seconds [READ: Count=16625, Max=484, Min=19, Avg=28,72, 90=53, 99=70, 99.9=142, 99.99=203] [UPDATE: Count=16710, Max=329, Min=18, Avg=29,39, 90=56, 99=77, 99.9=149, 99.99=247] 
2024-09-17 18:34:50:247 66 sec: 1958720 operations; 31704 current ops/sec; est completion in 19 seconds [READ: Count=15731, Max=519, Min=17, Avg=30,34, 90=56, 99=84, 99.9=163, 99.99=318] [UPDATE: Count=15970, Max=219, Min=18, Avg=30,89, 90=58, 99=88, 99.9=160, 99.99=216] 
2024-09-17 18:34:51:247 67 sec: 1989594 operations; 30874 current ops/sec; est completion in 18 seconds [READ: Count=15630, Max=363, Min=19, Avg=31,29, 90=58, 99=111, 99.9=249, 99.99=326] [UPDATE: Count=15242, Max=452, Min=18, Avg=31,62, 90=61, 99=113, 99.9=206, 99.99=307] 
2024-09-17 18:34:52:247 68 sec: 2020457 operations; 30863 current ops/sec; est completion in 17 seconds [READ: Count=15392, Max=386, Min=18, Avg=31,26, 90=58, 99=111, 99.9=193, 99.99=265] [UPDATE: Count=15475, Max=315, Min=18, Avg=31,61, 90=60, 99=122, 99.9=203, 99.99=272] 
2024-09-17 18:34:53:247 69 sec: 2047929 operations; 27472 current ops/sec; est completion in 16 seconds [READ: Count=13908, Max=614, Min=18, Avg=35,02, 90=60, 99=111, 99.9=196, 99.99=241] [UPDATE: Count=13559, Max=282, Min=18, Avg=35,81, 90=62, 99=114, 99.9=166, 99.99=240] 
2024-09-17 18:34:54:247 70 sec: 2071471 operations; 23542 current ops/sec; est completion in 15 seconds [READ: Count=11752, Max=311, Min=18, Avg=41, 90=68, 99=125, 99.9=184, 99.99=296] [UPDATE: Count=11792, Max=620, Min=19, Avg=41,72, 90=71, 99=129, 99.9=195, 99.99=345] 
2024-09-17 18:34:55:247 71 sec: 2096165 operations; 24694 current ops/sec; est completion in 14 seconds [READ: Count=12444, Max=553, Min=19, Avg=39,06, 90=66, 99=121, 99.9=348, 99.99=508] [UPDATE: Count=12249, Max=2107, Min=19, Avg=39,79, 90=69, 99=132, 99.9=308, 99.99=696] 
2024-09-17 18:34:56:247 72 sec: 2124767 operations; 28602 current ops/sec; est completion in 13 seconds [READ: Count=14363, Max=668, Min=18, Avg=33,88, 90=61, 99=110, 99.9=169, 99.99=333] [UPDATE: Count=14248, Max=330, Min=18, Avg=33,98, 90=64, 99=112, 99.9=182, 99.99=252] 
2024-09-17 18:34:57:247 73 sec: 2159182 operations; 34415 current ops/sec; est completion in 12 seconds [READ: Count=17127, Max=236, Min=19, Avg=28,17, 90=49, 99=74, 99.9=148, 99.99=180] [UPDATE: Count=17283, Max=242, Min=18, Avg=28,05, 90=51, 99=78, 99.9=155, 99.99=229] 
2024-09-17 18:34:58:247 74 sec: 2190934 operations; 31752 current ops/sec; est completion in 11 seconds [READ: Count=15741, Max=365, Min=18, Avg=30,47, 90=54, 99=103, 99.9=210, 99.99=301] [UPDATE: Count=16005, Max=370, Min=18, Avg=30,65, 90=57, 99=103, 99.9=203, 99.99=269] 
2024-09-17 18:34:59:247 75 sec: 2230802 operations; 39868 current ops/sec; est completion in 10 seconds [READ: Count=19948, Max=722, Min=19, Avg=24,09, 90=30, 99=65, 99.9=122, 99.99=172] [UPDATE: Count=19926, Max=269, Min=18, Avg=24,37, 90=30, 99=66, 99.9=135, 99.99=229] 
2024-09-17 18:35:00:247 76 sec: 2260588 operations; 29786 current ops/sec; est completion in 9 second [READ: Count=14737, Max=280, Min=18, Avg=32,53, 90=61, 99=115, 99.9=190, 99.99=279] [UPDATE: Count=15051, Max=315, Min=18, Avg=32,66, 90=63, 99=121, 99.9=208, 99.99=291] 
2024-09-17 18:35:01:247 77 sec: 2291816 operations; 31228 current ops/sec; est completion in 7 second [READ: Count=15651, Max=837, Min=18, Avg=30,94, 90=54, 99=99, 99.9=171, 99.99=239] [UPDATE: Count=15574, Max=855, Min=17, Avg=31,13, 90=56, 99=111, 99.9=166, 99.99=241] 
2024-09-17 18:35:02:247 78 sec: 2317361 operations; 25545 current ops/sec; est completion in 7 second [READ: Count=12539, Max=246, Min=19, Avg=37,78, 90=64, 99=110, 99.9=176, 99.99=232] [UPDATE: Count=13007, Max=432, Min=18, Avg=38,41, 90=68, 99=117, 99.9=188, 99.99=269] 
2024-09-17 18:35:03:247 79 sec: 2350430 operations; 33069 current ops/sec; est completion in 6 second [READ: Count=16568, Max=276, Min=19, Avg=29,11, 90=52, 99=88, 99.9=154, 99.99=223] [UPDATE: Count=16497, Max=288, Min=18, Avg=29,48, 90=55, 99=85, 99.9=162, 99.99=279] 
2024-09-17 18:35:04:247 80 sec: 2376394 operations; 25964 current ops/sec; est completion in 5 second [READ: Count=12935, Max=4155, Min=12, Avg=37, 90=62, 99=115, 99.9=200, 99.99=792] [UPDATE: Count=13040, Max=10671, Min=19, Avg=37,95, 90=64, 99=114, 99.9=179, 99.99=284] 
2024-09-17 18:35:05:247 81 sec: 2402780 operations; 26386 current ops/sec; est completion in 4 second [READ: Count=13283, Max=273, Min=19, Avg=36,63, 90=61, 99=106, 99.9=181, 99.99=246] [UPDATE: Count=13094, Max=262, Min=18, Avg=37,17, 90=64, 99=109, 99.9=188, 99.99=240] 
2024-09-17 18:35:06:247 82 sec: 2432257 operations; 29477 current ops/sec; est completion in 3 second [READ: Count=14703, Max=382, Min=19, Avg=32,87, 90=62, 99=118, 99.9=202, 99.99=291] [UPDATE: Count=14772, Max=287, Min=18, Avg=33, 90=64, 99=126, 99.9=194, 99.99=259] 
2024-09-17 18:35:07:247 83 sec: 2468323 operations; 36066 current ops/sec; est completion in 2 second [READ: Count=17978, Max=317, Min=12, Avg=26,24, 90=40, 99=67, 99.9=138, 99.99=214] [UPDATE: Count=18090, Max=10487, Min=18, Avg=27,38, 90=44, 99=71, 99.9=151, 99.99=792] 
2024-09-17 18:35:08:247 84 sec: 2497304 operations; 28981 current ops/sec; est completion in 1 second [READ: Count=14457, Max=10407, Min=18, Avg=33,6, 90=56, 99=81, 99.9=148, 99.99=333] [UPDATE: Count=14529, Max=4575, Min=18, Avg=33,36, 90=58, 99=90, 99.9=176, 99.99=432] 
2024-09-17 18:35:08:360 84 sec: 2500000 operations; 23858,41 current ops/sec; [READ: Count=1307, Max=258, Min=19, Avg=40,6, 90=65, 99=123, 99.9=216, 99.99=258] [CLEANUP: Count=1, Max=967, Min=967, Avg=967, 90=967, 99=967, 99.9=967, 99.99=967] [UPDATE: Count=1379, Max=298, Min=19, Avg=40,29, 90=69, 99=121, 99.9=226, 99.99=298] 
[OVERALL], RunTime(ms), 84114
[OVERALL], Throughput(ops/sec), 29721.568347718574
[TOTAL_GCS_G1_Young_Generation], Count, 31
[TOTAL_GC_TIME_G1_Young_Generation], Time(ms), 23
[TOTAL_GC_TIME_%_G1_Young_Generation], Time(%), 0.027343842879901086
[TOTAL_GCS_G1_Old_Generation], Count, 0
[TOTAL_GC_TIME_G1_Old_Generation], Time(ms), 0
[TOTAL_GC_TIME_%_G1_Old_Generation], Time(%), 0.0
[TOTAL_GCs], Count, 31
[TOTAL_GC_TIME], Time(ms), 23
[TOTAL_GC_TIME_%], Time(%), 0.027343842879901086
[READ], Operations, 1250162
[READ], AverageLatency(us), 32.413601597233
[READ], MinLatency(us), 12
[READ], MaxLatency(us), 10407
[READ], 95thPercentileLatency(us), 67
[READ], 99thPercentileLatency(us), 107
[READ], Return=OK, 1250162
[CLEANUP], Operations, 1
[CLEANUP], AverageLatency(us), 967.0
[CLEANUP], MinLatency(us), 967
[CLEANUP], MaxLatency(us), 967
[CLEANUP], 95thPercentileLatency(us), 967
[CLEANUP], 99thPercentileLatency(us), 967
[UPDATE], Operations, 1249838
[UPDATE], AverageLatency(us), 32.81486000585676
[UPDATE], MinLatency(us), 15
[UPDATE], MaxLatency(us), 10671
[UPDATE], 95thPercentileLatency(us), 70
[UPDATE], 99thPercentileLatency(us), 113
[UPDATE], Return=OK, 1249838
