/usr/bin/java  -classpath /home/sebastiaoamaro/phd/torefidevel/tests/redis/ycsb-0.17.0/conf:/home/sebastiaoamaro/phd/torefidevel/tests/redis/ycsb-0.17.0/lib/HdrHistogram-2.1.4.jar:/home/sebastiaoamaro/phd/torefidevel/tests/redis/ycsb-0.17.0/lib/core-0.17.0.jar:/home/sebastiaoamaro/phd/torefidevel/tests/redis/ycsb-0.17.0/lib/htrace-core4-4.1.0-incubating.jar:/home/sebastiaoamaro/phd/torefidevel/tests/redis/ycsb-0.17.0/lib/jackson-core-asl-1.9.4.jar:/home/sebastiaoamaro/phd/torefidevel/tests/redis/ycsb-0.17.0/lib/jackson-mapper-asl-1.9.4.jar:/home/sebastiaoamaro/phd/torefidevel/tests/redis/ycsb-0.17.0/redis-binding/lib/commons-pool2-2.4.2.jar:/home/sebastiaoamaro/phd/torefidevel/tests/redis/ycsb-0.17.0/redis-binding/lib/jedis-2.9.0.jar:/home/sebastiaoamaro/phd/torefidevel/tests/redis/ycsb-0.17.0/redis-binding/lib/redis-binding-0.17.0.jar site.ycsb.Client -t -db site.ycsb.db.RedisClient -P workloads/workloada -s -p status.interval=1 -p operationcount=2500000 -p redis.host=172.38.0.11 -p redis.port=6379 -p redis.cluster=true -s
Command line: -t -db site.ycsb.db.RedisClient -P workloads/workloada -s -p status.interval=1 -p operationcount=2500000 -p redis.host=172.38.0.11 -p redis.port=6379 -p redis.cluster=true -s
YCSB Client 0.17.0

Loading workload...
Starting test.
2024-10-23 13:21:26:512 0 sec: 0 operations; est completion in 0 second 
DBWrapper: report latency for each error is false and specific error codes to track for latency are: []
2024-10-23 13:21:27:486 1 sec: 7528 operations; 7528 current ops/sec; est completion in 5 minutes [READ: Count=3746, Max=8687, Min=24, Avg=107,82, 90=171, 99=353, 99.9=577, 99.99=8687] [UPDATE: Count=3802, Max=781, Min=26, Avg=117,45, 90=199, 99=376, 99.9=531, 99.99=781] 
2024-10-23 13:21:28:486 2 sec: 19776 operations; 12248 current ops/sec; est completion in 4 minutes [READ: Count=6108, Max=433, Min=23, Avg=76,63, 90=123, 99=238, 99.9=388, 99.99=427] [UPDATE: Count=6125, Max=1892, Min=24, Avg=81,19, 90=134, 99=258, 99.9=445, 99.99=638] 
2024-10-23 13:21:29:486 3 sec: 39044 operations; 19268 current ops/sec; est completion in 3 minutes [READ: Count=9669, Max=851, Min=23, Avg=49,48, 90=87, 99=176, 99.9=301, 99.99=487] [UPDATE: Count=9601, Max=455, Min=24, Avg=50,86, 90=91, 99=190, 99.9=299, 99.99=437] 
2024-10-23 13:21:30:486 4 sec: 51794 operations; 12750 current ops/sec; est completion in 3 minutes [READ: Count=6408, Max=835, Min=24, Avg=73,94, 90=130, 99=284, 99.9=592, 99.99=815] [UPDATE: Count=6352, Max=2169, Min=19, Avg=78,14, 90=139, 99=321, 99.9=650, 99.99=1422] 
2024-10-23 13:21:31:486 5 sec: 71315 operations; 19521 current ops/sec; est completion in 2 minutes [READ: Count=9855, Max=605, Min=24, Avg=49,38, 90=97, 99=204, 99.9=362, 99.99=522] [UPDATE: Count=9658, Max=467, Min=24, Avg=50,3, 90=99, 99=223, 99.9=319, 99.99=426] 
2024-10-23 13:21:32:486 6 sec: 87839 operations; 16524 current ops/sec; est completion in 2 minutes [READ: Count=8247, Max=666, Min=24, Avg=58,73, 90=113, 99=226, 99.9=402, 99.99=520] [UPDATE: Count=8295, Max=817, Min=24, Avg=59,51, 90=119, 99=234, 99.9=385, 99.99=535] 
2024-10-23 13:21:33:486 7 sec: 100585 operations; 12746 current ops/sec; est completion in 2 minutes [READ: Count=6304, Max=1316, Min=24, Avg=75,52, 90=127, 99=237, 99.9=385, 99.99=548] [UPDATE: Count=6439, Max=571, Min=24, Avg=78,21, 90=130, 99=257, 99.9=439, 99.99=533] 
2024-10-23 13:21:34:486 8 sec: 126735 operations; 26150 current ops/sec; est completion in 2 minutes [READ: Count=13048, Max=439, Min=23, Avg=36,52, 90=52, 99=131, 99.9=218, 99.99=424] [UPDATE: Count=13103, Max=416, Min=24, Avg=37,92, 90=51, 99=139, 99.9=219, 99.99=313] 
2024-10-23 13:21:35:486 9 sec: 142008 operations; 15273 current ops/sec; est completion in 2 minutes [READ: Count=7769, Max=492, Min=23, Avg=62,37, 90=116, 99=203, 99.9=393, 99.99=474] [UPDATE: Count=7504, Max=587, Min=24, Avg=66,37, 90=126, 99=225, 99.9=374, 99.99=549] 
2024-10-23 13:21:36:486 10 sec: 161278 operations; 19270 current ops/sec; est completion in 2 minutes [READ: Count=9619, Max=568, Min=23, Avg=49,28, 90=91, 99=167, 99.9=282, 99.99=485] [UPDATE: Count=9639, Max=529, Min=24, Avg=52,37, 90=98, 99=182, 99.9=317, 99.99=507] 
2024-10-23 13:21:37:486 11 sec: 177214 operations; 15936 current ops/sec; est completion in 2 minutes [READ: Count=8002, Max=518, Min=23, Avg=59,72, 90=104, 99=203, 99.9=347, 99.99=498] [UPDATE: Count=7933, Max=495, Min=24, Avg=63,34, 90=111, 99=220, 99.9=382, 99.99=467] 
2024-10-23 13:21:38:487 12 sec: 189986 operations; 12772 current ops/sec; est completion in 2 minutes [READ: Count=6346, Max=1132, Min=23, Avg=74,97, 90=131, 99=256, 99.9=729, 99.99=1006] [UPDATE: Count=6429, Max=1027, Min=13, Avg=79, 90=139, 99=272, 99.9=664, 99.99=802] 
2024-10-23 13:21:39:486 13 sec: 205019 operations; 15033 current ops/sec; est completion in 2 minutes [READ: Count=7482, Max=790, Min=23, Avg=62,88, 90=109, 99=214, 99.9=569, 99.99=782] [UPDATE: Count=7554, Max=864, Min=24, Avg=67,42, 90=120, 99=230, 99.9=481, 99.99=766] 
2024-10-23 13:21:40:486 14 sec: 223786 operations; 18767 current ops/sec; est completion in 2 minutes [READ: Count=9438, Max=759, Min=23, Avg=50,9, 90=102, 99=183, 99.9=302, 99.99=515] [UPDATE: Count=9330, Max=538, Min=24, Avg=53,6, 90=107, 99=197, 99.9=362, 99.99=489] 
2024-10-23 13:21:41:486 15 sec: 241649 operations; 17863 current ops/sec; est completion in 2 minutes [READ: Count=8894, Max=503, Min=23, Avg=53,06, 90=99, 99=192, 99.9=383, 99.99=441] [UPDATE: Count=8962, Max=586, Min=24, Avg=56,71, 90=109, 99=200, 99.9=342, 99.99=548] 
2024-10-23 13:21:42:486 16 sec: 255946 operations; 14297 current ops/sec; est completion in 2 minutes [READ: Count=7169, Max=904, Min=23, Avg=66,4, 90=110, 99=203, 99.9=743, 99.99=895] [UPDATE: Count=7123, Max=893, Min=24, Avg=71,08, 90=120, 99=218, 99.9=801, 99.99=858] 
2024-10-23 13:21:43:486 17 sec: 267570 operations; 11624 current ops/sec; est completion in 2 minutes [READ: Count=5994, Max=1155, Min=23, Avg=81,56, 90=144, 99=269, 99.9=812, 99.99=1129] [UPDATE: Count=5633, Max=1034, Min=24, Avg=87,63, 90=157, 99=301, 99.9=809, 99.99=966] 
2024-10-23 13:21:44:487 18 sec: 282803 operations; 15217,78 current ops/sec; est completion in 2 minutes [READ: Count=7612, Max=852, Min=23, Avg=62,6, 90=111, 99=232, 99.9=514, 99.99=811] [UPDATE: Count=7616, Max=764, Min=24, Avg=66,78, 90=122, 99=245, 99.9=478, 99.99=741] 
2024-10-23 13:21:45:486 19 sec: 292953 operations; 10160,16 current ops/sec; est completion in 2 minutes [READ: Count=5105, Max=2969, Min=24, Avg=93,48, 90=155, 99=425, 99.9=877, 99.99=1060] [UPDATE: Count=5051, Max=3677, Min=24, Avg=99,2, 90=166, 99=414, 99.9=847, 99.99=2561] 
2024-10-23 13:21:46:486 20 sec: 303062 operations; 10109 current ops/sec; est completion in 2 minutes [READ: Count=5049, Max=920, Min=16, Avg=93,57, 90=155, 99=438, 99.9=776, 99.99=854] [UPDATE: Count=5054, Max=1024, Min=25, Avg=100,9, 90=171, 99=482, 99.9=858, 99.99=969] 
2024-10-23 13:21:47:486 21 sec: 312083 operations; 9021 current ops/sec; est completion in 2 minutes [READ: Count=4512, Max=896, Min=24, Avg=103,32, 90=171, 99=344, 99.9=749, 99.99=896] [UPDATE: Count=4509, Max=1527, Min=25, Avg=114,81, 90=192, 99=398, 99.9=793, 99.99=1527] 
2024-10-23 13:21:48:486 22 sec: 322764 operations; 10681 current ops/sec; est completion in 2 minutes [READ: Count=5373, Max=998, Min=24, Avg=88,54, 90=160, 99=339, 99.9=572, 99.99=823] [UPDATE: Count=5311, Max=941, Min=24, Avg=95,36, 90=178, 99=374, 99.9=790, 99.99=891] 
2024-10-23 13:21:49:486 23 sec: 333033 operations; 10269 current ops/sec; est completion in 2 minutes [READ: Count=5175, Max=829, Min=24, Avg=92,96, 90=157, 99=280, 99.9=612, 99.99=801] [UPDATE: Count=5090, Max=895, Min=25, Avg=98,93, 90=170, 99=294, 99.9=652, 99.99=881] 
2024-10-23 13:21:50:486 24 sec: 346283 operations; 13250 current ops/sec; est completion in 2 minutes [READ: Count=6688, Max=900, Min=23, Avg=70,87, 90=130, 99=253, 99.9=453, 99.99=828] [UPDATE: Count=6565, Max=895, Min=24, Avg=77,44, 90=145, 99=303, 99.9=463, 99.99=876] 
2024-10-23 13:21:51:486 25 sec: 362497 operations; 16214 current ops/sec; est completion in 2 minutes [READ: Count=8100, Max=1008, Min=23, Avg=58,8, 90=103, 99=199, 99.9=365, 99.99=526] [UPDATE: Count=8112, Max=612, Min=24, Avg=62,32, 90=113, 99=203, 99.9=391, 99.99=559] 
2024-10-23 13:21:52:486 26 sec: 379028 operations; 16531 current ops/sec; est completion in 2 minutes [READ: Count=8338, Max=750, Min=23, Avg=57,34, 90=102, 99=189, 99.9=352, 99.99=639] [UPDATE: Count=8199, Max=779, Min=24, Avg=61,23, 90=110, 99=204, 99.9=368, 99.99=773] 
2024-10-23 13:21:53:486 27 sec: 391895 operations; 12867 current ops/sec; est completion in 2 minutes [READ: Count=6391, Max=1019, Min=23, Avg=74,09, 90=120, 99=261, 99.9=816, 99.99=979] [UPDATE: Count=6485, Max=2018, Min=25, Avg=78,45, 90=128, 99=285, 99.9=811, 99.99=1011] 
2024-10-23 13:21:54:486 28 sec: 402647 operations; 10752 current ops/sec; est completion in 2 minutes [READ: Count=5459, Max=907, Min=24, Avg=87,29, 90=152, 99=320, 99.9=772, 99.99=826] [UPDATE: Count=5277, Max=966, Min=25, Avg=95,96, 90=169, 99=386, 99.9=829, 99.99=936] 
2024-10-23 13:21:55:486 29 sec: 413204 operations; 10557 current ops/sec; est completion in 2 minutes [READ: Count=5267, Max=2195, Min=24, Avg=91,25, 90=134, 99=392, 99.9=888, 99.99=1726] [UPDATE: Count=5293, Max=1283, Min=25, Avg=94,56, 90=143, 99=370, 99.9=842, 99.99=1193] 
2024-10-23 13:21:56:486 30 sec: 424178 operations; 10974 current ops/sec; est completion in 2 minutes [READ: Count=5465, Max=899, Min=24, Avg=86,53, 90=135, 99=276, 99.9=786, 99.99=852] [UPDATE: Count=5510, Max=1190, Min=24, Avg=92,6, 90=148, 99=272, 99.9=778, 99.99=968] 
2024-10-23 13:21:57:486 31 sec: 436914 operations; 12736 current ops/sec; est completion in 2 minutes [READ: Count=6362, Max=1076, Min=23, Avg=74,7, 90=126, 99=325, 99.9=839, 99.99=1025] [UPDATE: Count=6368, Max=1716, Min=25, Avg=79,45, 90=136, 99=340, 99.9=852, 99.99=999] 
2024-10-23 13:21:58:486 32 sec: 447307 operations; 10393 current ops/sec; est completion in 2 minutes [READ: Count=5201, Max=1925, Min=25, Avg=91,1, 90=150, 99=358, 99.9=824, 99.99=1051] [UPDATE: Count=5195, Max=1057, Min=26, Avg=97,95, 90=161, 99=375, 99.9=855, 99.99=996] 
2024-10-23 13:21:59:486 33 sec: 460365 operations; 13058 current ops/sec; est completion in 2 minutes [READ: Count=6519, Max=976, Min=16, Avg=73,01, 90=130, 99=261, 99.9=649, 99.99=914] [UPDATE: Count=6545, Max=858, Min=23, Avg=77,6, 90=143, 99=294, 99.9=662, 99.99=822] 
2024-10-23 13:22:00:486 34 sec: 474254 operations; 13889 current ops/sec; est completion in 2 minutes [READ: Count=6959, Max=836, Min=23, Avg=68,32, 90=114, 99=226, 99.9=669, 99.99=788] [UPDATE: Count=6932, Max=937, Min=24, Avg=72,96, 90=123, 99=237, 99.9=560, 99.99=927] 
2024-10-23 13:22:01:486 35 sec: 494515 operations; 20261 current ops/sec; est completion in 2 minutes [READ: Count=10186, Max=890, Min=21, Avg=47,11, 90=87, 99=193, 99.9=618, 99.99=884] [UPDATE: Count=10069, Max=830, Min=24, Avg=49,7, 90=94, 99=208, 99.9=707, 99.99=814] 
2024-10-23 13:22:02:486 36 sec: 510533 operations; 16018 current ops/sec; est completion in 2 minutes [READ: Count=7923, Max=912, Min=23, Avg=58,75, 90=113, 99=237, 99.9=512, 99.99=861] [UPDATE: Count=8099, Max=915, Min=24, Avg=63,44, 90=121, 99=253, 99.9=769, 99.99=902] 
2024-10-23 13:22:03:486 37 sec: 527833 operations; 17300 current ops/sec; est completion in 2 minutes [READ: Count=8629, Max=950, Min=18, Avg=54,84, 90=97, 99=171, 99.9=388, 99.99=843] [UPDATE: Count=8665, Max=914, Min=18, Avg=58,46, 90=104, 99=185, 99.9=650, 99.99=851] 
2024-10-23 13:22:04:486 38 sec: 545144 operations; 17311 current ops/sec; est completion in 2 minutes [READ: Count=8595, Max=848, Min=17, Avg=54,9, 90=105, 99=211, 99.9=550, 99.99=828] [UPDATE: Count=8721, Max=902, Min=16, Avg=58,44, 90=115, 99=225, 99.9=447, 99.99=847] 
2024-10-23 13:22:05:486 39 sec: 563037 operations; 17893 current ops/sec; est completion in 2 minutes [READ: Count=9066, Max=855, Min=23, Avg=53,27, 90=99, 99=190, 99.9=471, 99.99=828] [UPDATE: Count=8826, Max=850, Min=24, Avg=56,05, 90=105, 99=211, 99.9=702, 99.99=813] 
2024-10-23 13:22:06:486 40 sec: 590381 operations; 27344 current ops/sec; est completion in 2 minutes [READ: Count=13620, Max=406, Min=22, Avg=34,89, 90=47, 99=104, 99.9=192, 99.99=393] [UPDATE: Count=13728, Max=353, Min=24, Avg=36,32, 90=49, 99=109, 99.9=183, 99.99=331] 
2024-10-23 13:22:07:486 41 sec: 616728 operations; 26347 current ops/sec; est completion in 2 minutes [READ: Count=13219, Max=491, Min=23, Avg=36,14, 90=56, 99=110, 99.9=204, 99.99=471] [UPDATE: Count=13132, Max=735, Min=23, Avg=37,79, 90=58, 99=114, 99.9=196, 99.99=421] 
2024-10-23 13:22:08:486 42 sec: 639099 operations; 22371 current ops/sec; est completion in 2 minutes [READ: Count=11231, Max=350, Min=18, Avg=42,29, 90=78, 99=134, 99.9=207, 99.99=303] [UPDATE: Count=11135, Max=411, Min=24, Avg=45,09, 90=82, 99=142, 99.9=286, 99.99=381] 
2024-10-23 13:22:09:486 43 sec: 662738 operations; 23639 current ops/sec; est completion in 2 minutes [READ: Count=11867, Max=526, Min=23, Avg=40,02, 90=77, 99=130, 99.9=226, 99.99=387] [UPDATE: Count=11766, Max=489, Min=24, Avg=42,69, 90=83, 99=155, 99.9=272, 99.99=464] 
2024-10-23 13:22:10:486 44 sec: 692789 operations; 30051 current ops/sec; est completion in 1 minute [READ: Count=14991, Max=1115, Min=23, Avg=31,65, 90=38, 99=96, 99.9=204, 99.99=414] [UPDATE: Count=15068, Max=685, Min=24, Avg=33,07, 90=39, 99=105, 99.9=196, 99.99=349] 
2024-10-23 13:22:11:486 45 sec: 718091 operations; 25302 current ops/sec; est completion in 1 minute [READ: Count=12534, Max=379, Min=21, Avg=37,6, 90=66, 99=113, 99.9=221, 99.99=335] [UPDATE: Count=12760, Max=356, Min=24, Avg=39,5, 90=72, 99=117, 99.9=230, 99.99=332] 
2024-10-23 13:22:12:486 46 sec: 742456 operations; 24365 current ops/sec; est completion in 1 minute [READ: Count=12312, Max=413, Min=22, Avg=39,2, 90=74, 99=130, 99.9=204, 99.99=365] [UPDATE: Count=12060, Max=426, Min=24, Avg=40,81, 90=77, 99=132, 99.9=208, 99.99=402] 
2024-10-23 13:22:13:486 47 sec: 773793 operations; 31337 current ops/sec; est completion in 1 minute [READ: Count=15624, Max=828, Min=22, Avg=30,22, 90=36, 99=85, 99.9=179, 99.99=268] [UPDATE: Count=15707, Max=352, Min=15, Avg=31,79, 90=38, 99=94, 99.9=180, 99.99=232] 
2024-10-23 13:22:14:486 48 sec: 803779 operations; 29986 current ops/sec; est completion in 1 minute [READ: Count=15108, Max=305, Min=23, Avg=31,61, 90=34, 99=83, 99.9=177, 99.99=247] [UPDATE: Count=14882, Max=324, Min=24, Avg=33,18, 90=37, 99=89, 99.9=175, 99.99=253] 
2024-10-23 13:22:15:486 49 sec: 834689 operations; 30910 current ops/sec; est completion in 1 minute [READ: Count=15557, Max=426, Min=12, Avg=30,76, 90=34, 99=98, 99.9=177, 99.99=265] [UPDATE: Count=15355, Max=404, Min=24, Avg=32,23, 90=36, 99=105, 99.9=191, 99.99=290] 
2024-10-23 13:22:16:486 50 sec: 849631 operations; 14942 current ops/sec; est completion in 1 minute [READ: Count=7513, Max=1555, Min=18, Avg=63,39, 90=129, 99=334, 99.9=741, 99.99=1186] [UPDATE: Count=7424, Max=1198, Min=15, Avg=68,14, 90=137, 99=366, 99.9=947, 99.99=1112] 
2024-10-23 13:22:17:486 51 sec: 859770 operations; 10139 current ops/sec; est completion in 1 minute [READ: Count=5043, Max=2285, Min=23, Avg=92,6, 90=175, 99=379, 99.9=802, 99.99=1070] [UPDATE: Count=5096, Max=1255, Min=25, Avg=101,06, 90=190, 99=441, 99.9=1016, 99.99=1187] 
2024-10-23 13:22:18:486 52 sec: 879076 operations; 19306 current ops/sec; est completion in 1 minute [READ: Count=9647, Max=917, Min=15, Avg=49,08, 90=93, 99=167, 99.9=364, 99.99=859] [UPDATE: Count=9663, Max=870, Min=14, Avg=52,4, 90=101, 99=189, 99.9=479, 99.99=840] 
2024-10-23 13:22:19:486 53 sec: 907570 operations; 28494 current ops/sec; est completion in 1 minute [READ: Count=14277, Max=783, Min=13, Avg=33,12, 90=48, 99=104, 99.9=227, 99.99=577] [UPDATE: Count=14217, Max=764, Min=22, Avg=35,25, 90=52, 99=118, 99.9=217, 99.99=743] 
2024-10-23 13:22:20:486 54 sec: 938044 operations; 30474 current ops/sec; est completion in 1 minute [READ: Count=15271, Max=744, Min=15, Avg=31,23, 90=38, 99=96, 99.9=176, 99.99=292] [UPDATE: Count=15206, Max=385, Min=24, Avg=32,53, 90=39, 99=101, 99.9=184, 99.99=316] 
2024-10-23 13:22:21:486 55 sec: 968283 operations; 30239 current ops/sec; est completion in 1 minute [READ: Count=14970, Max=205, Min=13, Avg=31,2, 90=37, 99=90, 99.9=170, 99.99=204] [UPDATE: Count=15269, Max=380, Min=24, Avg=33,04, 90=39, 99=99, 99.9=181, 99.99=243] 
2024-10-23 13:22:22:486 56 sec: 999352 operations; 31069 current ops/sec; est completion in 1 minute [READ: Count=15581, Max=373, Min=23, Avg=30,42, 90=35, 99=84, 99.9=172, 99.99=267] [UPDATE: Count=15485, Max=370, Min=24, Avg=32,16, 90=37, 99=93, 99.9=185, 99.99=247] 
2024-10-23 13:22:23:486 57 sec: 1030169 operations; 30817 current ops/sec; est completion in 1 minute [READ: Count=15448, Max=338, Min=23, Avg=30,81, 90=33, 99=84, 99.9=178, 99.99=274] [UPDATE: Count=15367, Max=466, Min=23, Avg=32,23, 90=35, 99=90, 99.9=189, 99.99=280] 
2024-10-23 13:22:24:486 58 sec: 1054472 operations; 24303 current ops/sec; est completion in 1 minute [READ: Count=12128, Max=416, Min=23, Avg=39,36, 90=77, 99=134, 99.9=238, 99.99=379] [UPDATE: Count=12167, Max=364, Min=24, Avg=41,12, 90=82, 99=139, 99.9=222, 99.99=353] 
2024-10-23 13:22:25:486 59 sec: 1081304 operations; 26832 current ops/sec; est completion in 1 minute [READ: Count=13546, Max=428, Min=20, Avg=35,28, 90=64, 99=123, 99.9=197, 99.99=389] [UPDATE: Count=13286, Max=376, Min=24, Avg=37,43, 90=68, 99=137, 99.9=227, 99.99=361] 
2024-10-23 13:22:26:486 60 sec: 1108900 operations; 27596 current ops/sec; est completion in 1 minute [READ: Count=13589, Max=729, Min=23, Avg=34,46, 90=41, 99=103, 99.9=185, 99.99=431] [UPDATE: Count=14015, Max=414, Min=24, Avg=36,08, 90=44, 99=108, 99.9=188, 99.99=384] 
2024-10-23 13:22:27:486 61 sec: 1137659 operations; 28759 current ops/sec; est completion in 1 minute [READ: Count=14276, Max=319, Min=23, Avg=32,86, 90=41, 99=86, 99.9=178, 99.99=274] [UPDATE: Count=14483, Max=377, Min=24, Avg=34,84, 90=44, 99=94, 99.9=169, 99.99=251] 
2024-10-23 13:22:28:486 62 sec: 1162539 operations; 24880 current ops/sec; est completion in 1 minute [READ: Count=12459, Max=438, Min=15, Avg=37,86, 90=67, 99=124, 99.9=231, 99.99=368] [UPDATE: Count=12418, Max=574, Min=24, Avg=40,49, 90=73, 99=151, 99.9=274, 99.99=455] 
2024-10-23 13:22:29:486 63 sec: 1191293 operations; 28754 current ops/sec; est completion in 1 minute [READ: Count=14497, Max=274, Min=23, Avg=33,18, 90=41, 99=105, 99.9=196, 99.99=243] [UPDATE: Count=14262, Max=303, Min=24, Avg=34,42, 90=42, 99=103, 99.9=201, 99.99=294] 
2024-10-23 13:22:30:486 64 sec: 1220682 operations; 29389 current ops/sec; est completion in 1 minute [READ: Count=14808, Max=820, Min=23, Avg=32,3, 90=43, 99=104, 99.9=179, 99.99=776] [UPDATE: Count=14575, Max=465, Min=24, Avg=34, 90=45, 99=109, 99.9=194, 99.99=443] 
2024-10-23 13:22:31:486 65 sec: 1251440 operations; 30758 current ops/sec; est completion in 1 minute [READ: Count=15530, Max=289, Min=23, Avg=30,81, 90=36, 99=89, 99.9=175, 99.99=257] [UPDATE: Count=15232, Max=483, Min=18, Avg=32,39, 90=37, 99=97, 99.9=197, 99.99=313] 
2024-10-23 13:22:32:486 66 sec: 1281593 operations; 30153 current ops/sec; est completion in 1 minute [READ: Count=15162, Max=729, Min=23, Avg=31,5, 90=33, 99=91, 99.9=183, 99.99=255] [UPDATE: Count=14990, Max=438, Min=23, Avg=32,98, 90=35, 99=98, 99.9=205, 99.99=414] 
2024-10-23 13:22:33:486 67 sec: 1310793 operations; 29200 current ops/sec; est completion in 1 minute [READ: Count=14542, Max=342, Min=23, Avg=32,47, 90=40, 99=99, 99.9=175, 99.99=329] [UPDATE: Count=14661, Max=350, Min=24, Avg=34,19, 90=43, 99=106, 99.9=184, 99.99=346] 
2024-10-23 13:22:34:486 68 sec: 1341121 operations; 30328 current ops/sec; est completion in 59 seconds [READ: Count=15211, Max=372, Min=23, Avg=31,16, 90=37, 99=100, 99.9=175, 99.99=268] [UPDATE: Count=15118, Max=415, Min=24, Avg=33,15, 90=39, 99=111, 99.9=181, 99.99=331] 
2024-10-23 13:22:35:486 69 sec: 1374007 operations; 32886 current ops/sec; est completion in 57 seconds [READ: Count=16307, Max=262, Min=23, Avg=28,77, 90=35, 99=82, 99.9=165, 99.99=190] [UPDATE: Count=16577, Max=644, Min=23, Avg=30,38, 90=37, 99=87, 99.9=174, 99.99=252] 
2024-10-23 13:22:36:486 70 sec: 1404483 operations; 30476 current ops/sec; est completion in 55 seconds [READ: Count=14995, Max=247, Min=18, Avg=31, 90=39, 99=98, 99.9=170, 99.99=236] [UPDATE: Count=15477, Max=449, Min=23, Avg=32,9, 90=41, 99=106, 99.9=184, 99.99=316] 
2024-10-23 13:22:37:486 71 sec: 1436788 operations; 32305 current ops/sec; est completion in 53 seconds [READ: Count=16072, Max=260, Min=23, Avg=29,32, 90=32, 99=78, 99.9=159, 99.99=232] [UPDATE: Count=16233, Max=427, Min=24, Avg=30,82, 90=33, 99=84, 99.9=181, 99.99=315] 
2024-10-23 13:22:38:486 72 sec: 1471481 operations; 34693 current ops/sec; est completion in 51 seconds [READ: Count=17428, Max=463, Min=17, Avg=27,32, 90=31, 99=42, 99.9=170, 99.99=219] [UPDATE: Count=17267, Max=654, Min=24, Avg=28,64, 90=33, 99=46, 99.9=163, 99.99=189] 
2024-10-23 13:22:39:486 73 sec: 1504920 operations; 33439 current ops/sec; est completion in 49 seconds [READ: Count=16747, Max=255, Min=23, Avg=28,44, 90=31, 99=60, 99.9=168, 99.99=205] [UPDATE: Count=16695, Max=260, Min=24, Avg=29,6, 90=33, 99=48, 99.9=164, 99.99=196] 
2024-10-23 13:22:40:487 74 sec: 1524486 operations; 19566 current ops/sec; est completion in 48 seconds [READ: Count=9773, Max=988, Min=19, Avg=48,41, 90=101, 99=224, 99.9=766, 99.99=863] [UPDATE: Count=9795, Max=997, Min=23, Avg=51,71, 90=109, 99=242, 99.9=764, 99.99=940] 
2024-10-23 13:22:41:487 75 sec: 1546573 operations; 22087 current ops/sec; est completion in 47 seconds [READ: Count=11034, Max=777, Min=14, Avg=43,02, 90=78, 99=143, 99.9=243, 99.99=502] [UPDATE: Count=11044, Max=454, Min=24, Avg=45,44, 90=83, 99=153, 99.9=273, 99.99=431] 
2024-10-23 13:22:42:486 76 sec: 1572209 operations; 25636 current ops/sec; est completion in 45 seconds [READ: Count=12743, Max=269, Min=23, Avg=36,98, 90=68, 99=113, 99.9=182, 99.99=254] [UPDATE: Count=12891, Max=492, Min=24, Avg=39,08, 90=74, 99=125, 99.9=222, 99.99=369] 
2024-10-23 13:22:43:486 77 sec: 1603148 operations; 30939 current ops/sec; est completion in 44 seconds [READ: Count=15522, Max=648, Min=23, Avg=30,67, 90=37, 99=88, 99.9=174, 99.99=420] [UPDATE: Count=15422, Max=275, Min=24, Avg=32,19, 90=39, 99=91, 99.9=176, 99.99=240] 
2024-10-23 13:22:44:486 78 sec: 1627713 operations; 24565 current ops/sec; est completion in 42 seconds [READ: Count=12154, Max=742, Min=23, Avg=38,81, 90=75, 99=116, 99.9=226, 99.99=501] [UPDATE: Count=12410, Max=369, Min=24, Avg=40,63, 90=80, 99=118, 99.9=195, 99.99=346] 
2024-10-23 13:22:45:486 79 sec: 1657828 operations; 30115 current ops/sec; est completion in 41 seconds [READ: Count=15100, Max=859, Min=23, Avg=31,45, 90=38, 99=109, 99.9=211, 99.99=292] [UPDATE: Count=15021, Max=1315, Min=24, Avg=33,06, 90=40, 99=119, 99.9=250, 99.99=360] 
2024-10-23 13:22:46:486 80 sec: 1675731 operations; 17903 current ops/sec; est completion in 40 seconds [READ: Count=9016, Max=523, Min=23, Avg=53,12, 90=89, 99=165, 99.9=323, 99.99=420] [UPDATE: Count=8878, Max=478, Min=24, Avg=56,41, 90=96, 99=173, 99.9=306, 99.99=402] 
2024-10-23 13:22:47:486 81 sec: 1688951 operations; 13220 current ops/sec; est completion in 39 seconds [READ: Count=6555, Max=1171, Min=23, Avg=71,53, 90=127, 99=296, 99.9=860, 99.99=1103] [UPDATE: Count=6664, Max=1098, Min=24, Avg=77,16, 90=137, 99=351, 99.9=708, 99.99=868] 
2024-10-23 13:22:48:486 82 sec: 1705965 operations; 17014 current ops/sec; est completion in 39 seconds [READ: Count=8495, Max=970, Min=23, Avg=55,49, 90=89, 99=218, 99.9=459, 99.99=816] [UPDATE: Count=8521, Max=1157, Min=24, Avg=59,58, 90=96, 99=234, 99.9=602, 99.99=852] 
2024-10-23 13:22:49:486 83 sec: 1727171 operations; 21206 current ops/sec; est completion in 38 seconds [READ: Count=10650, Max=959, Min=13, Avg=44,79, 90=83, 99=164, 99.9=442, 99.99=955] [UPDATE: Count=10555, Max=785, Min=24, Avg=47,46, 90=89, 99=187, 99.9=320, 99.99=500] 
2024-10-23 13:22:50:486 84 sec: 1748641 operations; 21470 current ops/sec; est completion in 37 seconds [READ: Count=10695, Max=845, Min=20, Avg=44,36, 90=81, 99=190, 99.9=385, 99.99=793] [UPDATE: Count=10780, Max=931, Min=24, Avg=46,53, 90=87, 99=197, 99.9=383, 99.99=908] 
2024-10-23 13:22:51:487 85 sec: 1775164 operations; 26523 current ops/sec; est completion in 35 seconds [READ: Count=13363, Max=785, Min=15, Avg=35,67, 90=52, 99=123, 99.9=246, 99.99=760] [UPDATE: Count=13156, Max=793, Min=24, Avg=37,83, 90=58, 99=136, 99.9=327, 99.99=787] 
2024-10-23 13:22:52:486 86 sec: 1802483 operations; 27319 current ops/sec; est completion in 34 seconds [READ: Count=13624, Max=467, Min=15, Avg=34,73, 90=65, 99=103, 99.9=189, 99.99=382] [UPDATE: Count=13697, Max=424, Min=15, Avg=36,69, 90=70, 99=109, 99.9=198, 99.99=332] 
2024-10-23 13:22:53:486 87 sec: 1831225 operations; 28742 current ops/sec; est completion in 32 seconds [READ: Count=14386, Max=536, Min=23, Avg=32,89, 90=46, 99=104, 99.9=179, 99.99=338] [UPDATE: Count=14355, Max=346, Min=23, Avg=34,93, 90=50, 99=113, 99.9=184, 99.99=344] 
2024-10-23 13:22:54:486 88 sec: 1865270 operations; 34045 current ops/sec; est completion in 30 seconds [READ: Count=17171, Max=696, Min=23, Avg=27,78, 90=30, 99=66, 99.9=121, 99.99=304] [UPDATE: Count=16877, Max=283, Min=23, Avg=29,26, 90=32, 99=75, 99.9=171, 99.99=200] 
2024-10-23 13:22:55:486 89 sec: 1896263 operations; 30993 current ops/sec; est completion in 29 seconds [READ: Count=15406, Max=267, Min=23, Avg=30,64, 90=37, 99=85, 99.9=169, 99.99=206] [UPDATE: Count=15582, Max=274, Min=24, Avg=32,12, 90=39, 99=90, 99.9=182, 99.99=250] 
2024-10-23 13:22:56:486 90 sec: 1926172 operations; 29909 current ops/sec; est completion in 27 seconds [READ: Count=15006, Max=404, Min=23, Avg=31,67, 90=39, 99=89, 99.9=193, 99.99=336] [UPDATE: Count=14904, Max=366, Min=24, Avg=33,41, 90=41, 99=97, 99.9=186, 99.99=349] 
2024-10-23 13:22:57:486 91 sec: 1956121 operations; 29949 current ops/sec; est completion in 26 seconds [READ: Count=15054, Max=1084, Min=23, Avg=31,58, 90=41, 99=94, 99.9=178, 99.99=333] [UPDATE: Count=14904, Max=400, Min=24, Avg=33,31, 90=43, 99=101, 99.9=179, 99.99=388] 
2024-10-23 13:22:58:486 92 sec: 1986963 operations; 30842 current ops/sec; est completion in 24 seconds [READ: Count=15278, Max=479, Min=23, Avg=30,67, 90=37, 99=89, 99.9=175, 99.99=266] [UPDATE: Count=15552, Max=337, Min=24, Avg=32,36, 90=38, 99=98, 99.9=193, 99.99=263] 
2024-10-23 13:22:59:486 93 sec: 2014740 operations; 27777 current ops/sec; est completion in 23 seconds [READ: Count=13919, Max=567, Min=23, Avg=34,18, 90=51, 99=105, 99.9=201, 99.99=397] [UPDATE: Count=13862, Max=323, Min=24, Avg=35,96, 90=54, 99=120, 99.9=222, 99.99=315] 
2024-10-23 13:23:00:486 94 sec: 2046238 operations; 31498 current ops/sec; est completion in 21 seconds [READ: Count=15663, Max=250, Min=23, Avg=30,12, 90=35, 99=85, 99.9=172, 99.99=214] [UPDATE: Count=15839, Max=595, Min=24, Avg=31,58, 90=36, 99=90, 99.9=161, 99.99=184] 
2024-10-23 13:23:01:486 95 sec: 2068784 operations; 22546 current ops/sec; est completion in 20 seconds [READ: Count=11269, Max=443, Min=23, Avg=41,93, 90=81, 99=151, 99.9=268, 99.99=407] [UPDATE: Count=11275, Max=462, Min=24, Avg=44,78, 90=88, 99=162, 99.9=330, 99.99=449] 
2024-10-23 13:23:02:486 96 sec: 2094695 operations; 25911 current ops/sec; est completion in 19 seconds [READ: Count=13035, Max=350, Min=23, Avg=36,64, 90=65, 99=122, 99.9=199, 99.99=347] [UPDATE: Count=12877, Max=994, Min=24, Avg=38,62, 90=69, 99=134, 99.9=224, 99.99=387] 
2024-10-23 13:23:03:486 97 sec: 2120003 operations; 25308 current ops/sec; est completion in 18 seconds [READ: Count=12802, Max=960, Min=23, Avg=37,49, 90=64, 99=119, 99.9=210, 99.99=434] [UPDATE: Count=12507, Max=347, Min=24, Avg=39,52, 90=68, 99=143, 99.9=217, 99.99=344] 
2024-10-23 13:23:04:486 98 sec: 2152902 operations; 32899 current ops/sec; est completion in 16 seconds [READ: Count=16535, Max=249, Min=23, Avg=28,75, 90=34, 99=88, 99.9=174, 99.99=225] [UPDATE: Count=16366, Max=339, Min=23, Avg=30,26, 90=35, 99=92, 99.9=175, 99.99=257] 
2024-10-23 13:23:05:486 99 sec: 2186625 operations; 33723 current ops/sec; est completion in 15 seconds [READ: Count=16966, Max=402, Min=23, Avg=28, 90=31, 99=81, 99.9=159, 99.99=215] [UPDATE: Count=16753, Max=998, Min=24, Avg=29,66, 90=32, 99=87, 99.9=179, 99.99=306] 
2024-10-23 13:23:06:486 100 sec: 2219593 operations; 32968 current ops/sec; est completion in 13 seconds [READ: Count=16459, Max=361, Min=23, Avg=28,77, 90=34, 99=80, 99.9=167, 99.99=230] [UPDATE: Count=16510, Max=1054, Min=23, Avg=30,17, 90=36, 99=85, 99.9=181, 99.99=368] 
2024-10-23 13:23:07:486 101 sec: 2251744 operations; 32151 current ops/sec; est completion in 12 seconds [READ: Count=16051, Max=433, Min=23, Avg=29,56, 90=35, 99=82, 99.9=173, 99.99=335] [UPDATE: Count=16099, Max=341, Min=24, Avg=30,91, 90=36, 99=88, 99.9=179, 99.99=279] 
2024-10-23 13:23:08:486 102 sec: 2280453 operations; 28709 current ops/sec; est completion in 10 seconds [READ: Count=14292, Max=1236, Min=23, Avg=33,04, 90=44, 99=97, 99.9=195, 99.99=359] [UPDATE: Count=14418, Max=421, Min=24, Avg=34,75, 90=46, 99=107, 99.9=232, 99.99=404] 
2024-10-23 13:23:09:486 103 sec: 2306690 operations; 26237 current ops/sec; est completion in 9 second [READ: Count=13151, Max=815, Min=23, Avg=36,14, 90=69, 99=130, 99.9=222, 99.99=396] [UPDATE: Count=13087, Max=935, Min=24, Avg=38,32, 90=73, 99=140, 99.9=272, 99.99=547] 
2024-10-23 13:23:10:486 104 sec: 2337015 operations; 30325 current ops/sec; est completion in 8 second [READ: Count=15205, Max=352, Min=23, Avg=31,31, 90=37, 99=91, 99.9=188, 99.99=267] [UPDATE: Count=15119, Max=656, Min=24, Avg=32,81, 90=38, 99=97, 99.9=181, 99.99=411] 
2024-10-23 13:23:11:486 105 sec: 2367799 operations; 30784 current ops/sec; est completion in 6 second [READ: Count=15411, Max=1351, Min=23, Avg=30,54, 90=36, 99=108, 99.9=192, 99.99=273] [UPDATE: Count=15370, Max=11399, Min=16, Avg=32,79, 90=37, 99=113, 99.9=203, 99.99=449] 
2024-10-23 13:23:12:486 106 sec: 2398129 operations; 30330 current ops/sec; est completion in 5 second [READ: Count=15207, Max=4955, Min=23, Avg=31,45, 90=38, 99=104, 99.9=212, 99.99=378] [UPDATE: Count=15130, Max=441, Min=24, Avg=32,74, 90=39, 99=107, 99.9=225, 99.99=298] 
2024-10-23 13:23:13:486 107 sec: 2427538 operations; 29409 current ops/sec; est completion in 4 second [READ: Count=14439, Max=382, Min=23, Avg=32,05, 90=40, 99=92, 99.9=181, 99.99=357] [UPDATE: Count=14964, Max=346, Min=24, Avg=34,07, 90=42, 99=103, 99.9=197, 99.99=339] 
2024-10-23 13:23:14:486 108 sec: 2458304 operations; 30766 current ops/sec; est completion in 2 second [READ: Count=15502, Max=4383, Min=23, Avg=30,81, 90=37, 99=87, 99.9=185, 99.99=430] [UPDATE: Count=15265, Max=3459, Min=24, Avg=32,25, 90=39, 99=91, 99.9=177, 99.99=311] 
2024-10-23 13:23:15:486 109 sec: 2483746 operations; 25442 current ops/sec; est completion in 1 second [READ: Count=12752, Max=536, Min=18, Avg=36,9, 90=64, 99=118, 99.9=194, 99.99=338] [UPDATE: Count=12687, Max=5903, Min=24, Avg=39,59, 90=67, 99=129, 99.9=264, 99.99=2053] 
2024-10-23 13:23:16:101 109 sec: 2500000 operations; 26429,27 current ops/sec; [READ: Count=8227, Max=359, Min=23, Avg=36,03, 90=68, 99=124, 99.9=212, 99.99=330] [CLEANUP: Count=1, Max=732, Min=732, Avg=732, 90=732, 99=732, 99.9=732, 99.99=732] [UPDATE: Count=8022, Max=408, Min=24, Avg=37,71, 90=70, 99=133, 99.9=204, 99.99=301] 
[OVERALL], RunTime(ms), 109615
[OVERALL], Throughput(ops/sec), 22807.097568763398
[TOTAL_GCS_G1_Young_Generation], Count, 31
[TOTAL_GC_TIME_G1_Young_Generation], Time(ms), 25
[TOTAL_GC_TIME_%_G1_Young_Generation], Time(%), 0.0228070975687634
[TOTAL_GCS_G1_Old_Generation], Count, 0
[TOTAL_GC_TIME_G1_Old_Generation], Time(ms), 0
[TOTAL_GC_TIME_%_G1_Old_Generation], Time(%), 0.0
[TOTAL_GCs], Count, 31
[TOTAL_GC_TIME], Time(ms), 25
[TOTAL_GC_TIME_%], Time(%), 0.0228070975687634
[READ], Operations, 1251092
[READ], AverageLatency(us), 41.553792207127856
[READ], MinLatency(us), 12
[READ], MaxLatency(us), 8687
[READ], 95thPercentileLatency(us), 101
[READ], 99thPercentileLatency(us), 172
[READ], Return=OK, 1251092
[CLEANUP], Operations, 1
[CLEANUP], AverageLatency(us), 732.0
[CLEANUP], MinLatency(us), 732
[CLEANUP], MaxLatency(us), 732
[CLEANUP], 95thPercentileLatency(us), 732
[CLEANUP], 99thPercentileLatency(us), 732
[UPDATE], Operations, 1248908
[UPDATE], AverageLatency(us), 43.94952070128464
[UPDATE], MinLatency(us), 13
[UPDATE], MaxLatency(us), 11399
[UPDATE], 95thPercentileLatency(us), 108
[UPDATE], 99thPercentileLatency(us), 186
[UPDATE], Return=OK, 1248908
