/usr/bin/java  -classpath /home/sebastiaoamaro/phd/torefidevel/tests/redis/ycsb-0.17.0/conf:/home/sebastiaoamaro/phd/torefidevel/tests/redis/ycsb-0.17.0/lib/HdrHistogram-2.1.4.jar:/home/sebastiaoamaro/phd/torefidevel/tests/redis/ycsb-0.17.0/lib/core-0.17.0.jar:/home/sebastiaoamaro/phd/torefidevel/tests/redis/ycsb-0.17.0/lib/htrace-core4-4.1.0-incubating.jar:/home/sebastiaoamaro/phd/torefidevel/tests/redis/ycsb-0.17.0/lib/jackson-core-asl-1.9.4.jar:/home/sebastiaoamaro/phd/torefidevel/tests/redis/ycsb-0.17.0/lib/jackson-mapper-asl-1.9.4.jar:/home/sebastiaoamaro/phd/torefidevel/tests/redis/ycsb-0.17.0/redis-binding/lib/commons-pool2-2.4.2.jar:/home/sebastiaoamaro/phd/torefidevel/tests/redis/ycsb-0.17.0/redis-binding/lib/jedis-2.9.0.jar:/home/sebastiaoamaro/phd/torefidevel/tests/redis/ycsb-0.17.0/redis-binding/lib/redis-binding-0.17.0.jar site.ycsb.Client -t -db site.ycsb.db.RedisClient -P workloads/workloada -s -p status.interval=1 -p operationcount=1000000 -p redis.host=172.38.0.11 -p redis.port=6379 -p redis.cluster=true -s
Command line: -t -db site.ycsb.db.RedisClient -P workloads/workloada -s -p status.interval=1 -p operationcount=1000000 -p redis.host=172.38.0.11 -p redis.port=6379 -p redis.cluster=true -s
YCSB Client 0.17.0

Loading workload...
Starting test.
2024-07-22 12:08:20:015 0 sec: 0 operations; est completion in 0 second 
DBWrapper: report latency for each error is false and specific error codes to track for latency are: []
2024-07-22 12:08:20:991 1 sec: 17741 operations; 17741 current ops/sec; est completion in 56 seconds [READ: Count=8869, Max=3369, Min=14, Avg=44,84, 90=66, 99=139, 99.9=280, 99.99=2133] [UPDATE: Count=8941, Max=3705, Min=14, Avg=50,34, 90=78, 99=166, 99.9=318, 99.99=2937] 
2024-07-22 12:08:21:990 2 sec: 39451 operations; 21710 current ops/sec; est completion in 49 seconds [READ: Count=10843, Max=681, Min=13, Avg=42,27, 90=70, 99=154, 99.9=262, 99.99=527] [UPDATE: Count=10814, Max=1240, Min=13, Avg=45,43, 90=74, 99=183, 99.9=344, 99.99=1071] 
2024-07-22 12:08:22:990 3 sec: 61301 operations; 21850 current ops/sec; est completion in 46 seconds [READ: Count=10985, Max=898, Min=14, Avg=43,03, 90=62, 99=140, 99.9=274, 99.99=608] [UPDATE: Count=10860, Max=827, Min=13, Avg=43,98, 90=64, 99=139, 99.9=273, 99.99=491] 
2024-07-22 12:08:23:991 4 sec: 79313 operations; 18012 current ops/sec; est completion in 47 seconds [READ: Count=9006, Max=1847, Min=14, Avg=52,81, 90=89, 99=274, 99.9=604, 99.99=1196] [UPDATE: Count=9006, Max=782, Min=13, Avg=54,42, 90=96, 99=278, 99.9=438, 99.99=743] 
2024-07-22 12:08:24:991 5 sec: 101176 operations; 21863 current ops/sec; est completion in 45 seconds [READ: Count=11023, Max=2875, Min=14, Avg=42,99, 90=69, 99=160, 99.9=260, 99.99=1097] [UPDATE: Count=10859, Max=4515, Min=13, Avg=45,13, 90=74, 99=181, 99.9=332, 99.99=1270] 
2024-07-22 12:08:25:991 6 sec: 122696 operations; 21520 current ops/sec; est completion in 43 seconds [READ: Count=10740, Max=962, Min=13, Avg=42,82, 90=65, 99=172, 99.9=388, 99.99=840] [UPDATE: Count=10762, Max=1840, Min=13, Avg=47,33, 90=74, 99=194, 99.9=434, 99.99=734] 
2024-07-22 12:08:26:990 7 sec: 146667 operations; 23971 current ops/sec; est completion in 41 seconds [READ: Count=12055, Max=735, Min=13, Avg=38,95, 90=61, 99=141, 99.9=261, 99.99=733] [UPDATE: Count=11919, Max=583, Min=13, Avg=41,86, 90=67, 99=157, 99.9=278, 99.99=525] 
2024-07-22 12:08:27:990 8 sec: 171398 operations; 24731 current ops/sec; est completion in 39 seconds [READ: Count=12443, Max=777, Min=13, Avg=37,94, 90=57, 99=133, 99.9=239, 99.99=609] [UPDATE: Count=12285, Max=505, Min=13, Avg=40,39, 90=62, 99=142, 99.9=272, 99.99=413] 
2024-07-22 12:08:28:990 9 sec: 192551 operations; 21153 current ops/sec; est completion in 38 seconds [READ: Count=10554, Max=1916, Min=13, Avg=44,02, 90=71, 99=204, 99.9=427, 99.99=1362] [UPDATE: Count=10600, Max=830, Min=13, Avg=47,75, 90=78, 99=257, 99.9=405, 99.99=712] 
2024-07-22 12:08:29:990 10 sec: 219878 operations; 27327 current ops/sec; est completion in 36 seconds [READ: Count=13679, Max=1444, Min=13, Avg=34,45, 90=51, 99=114, 99.9=184, 99.99=1354] [UPDATE: Count=13646, Max=348, Min=12, Avg=36,42, 90=55, 99=121, 99.9=206, 99.99=332] 
2024-07-22 12:08:30:990 11 sec: 242929 operations; 23051 current ops/sec; est completion in 35 seconds [READ: Count=11568, Max=1831, Min=13, Avg=40,53, 90=62, 99=138, 99.9=277, 99.99=715] [UPDATE: Count=11483, Max=362, Min=13, Avg=43,55, 90=69, 99=147, 99.9=247, 99.99=325] 
2024-07-22 12:08:31:991 12 sec: 264810 operations; 21881 current ops/sec; est completion in 34 seconds [READ: Count=10947, Max=1525, Min=13, Avg=42,75, 90=66, 99=199, 99.9=326, 99.99=433] [UPDATE: Count=10950, Max=579, Min=13, Avg=45,94, 90=74, 99=205, 99.9=380, 99.99=454] 
2024-07-22 12:08:32:991 13 sec: 289156 operations; 24346 current ops/sec; est completion in 32 seconds [READ: Count=12116, Max=518, Min=13, Avg=38,44, 90=58, 99=126, 99.9=260, 99.99=488] [UPDATE: Count=12222, Max=884, Min=13, Avg=41,24, 90=63, 99=138, 99.9=213, 99.99=330] 
2024-07-22 12:08:33:991 14 sec: 313893 operations; 24737 current ops/sec; est completion in 31 seconds [READ: Count=12311, Max=6267, Min=13, Avg=37,72, 90=51, 99=125, 99.9=284, 99.99=1348] [UPDATE: Count=12436, Max=1599, Min=13, Avg=40,61, 90=58, 99=138, 99.9=363, 99.99=907] 
2024-07-22 12:08:34:991 15 sec: 338262 operations; 24369 current ops/sec; est completion in 30 seconds [READ: Count=12261, Max=1841, Min=13, Avg=37,91, 90=54, 99=128, 99.9=274, 99.99=777] [UPDATE: Count=12102, Max=2639, Min=13, Avg=41,57, 90=60, 99=142, 99.9=317, 99.99=1679] 
2024-07-22 12:08:35:991 16 sec: 361942 operations; 23680 current ops/sec; est completion in 29 seconds [READ: Count=12053, Max=5091, Min=13, Avg=39,29, 90=58, 99=122, 99.9=273, 99.99=954] [UPDATE: Count=11619, Max=1660, Min=13, Avg=42,51, 90=64, 99=132, 99.9=336, 99.99=864] 
2024-07-22 12:08:36:990 17 sec: 384575 operations; 22633 current ops/sec; est completion in 28 seconds [READ: Count=11337, Max=1268, Min=13, Avg=41,06, 90=59, 99=155, 99.9=425, 99.99=1267] [UPDATE: Count=11294, Max=1029, Min=13, Avg=44,52, 90=67, 99=178, 99.9=434, 99.99=713] 
2024-07-22 12:08:37:991 18 sec: 408216 operations; 23641 current ops/sec; est completion in 27 seconds [READ: Count=11828, Max=707, Min=13, Avg=39,41, 90=61, 99=135, 99.9=236, 99.99=675] [UPDATE: Count=11812, Max=699, Min=13, Avg=42,55, 90=68, 99=146, 99.9=261, 99.99=622] 
2024-07-22 12:08:38:991 19 sec: 430437 operations; 22221 current ops/sec; est completion in 26 seconds [READ: Count=11139, Max=2661, Min=14, Avg=41,52, 90=60, 99=142, 99.9=311, 99.99=675] [UPDATE: Count=11087, Max=639, Min=13, Avg=45,58, 90=68, 99=163, 99.9=366, 99.99=580] 
2024-07-22 12:08:39:990 20 sec: 455518 operations; 25081 current ops/sec; est completion in 24 seconds [READ: Count=12571, Max=6179, Min=13, Avg=37,22, 90=49, 99=100, 99.9=156, 99.99=3375] [UPDATE: Count=12503, Max=1427, Min=14, Avg=39,91, 90=55, 99=110, 99.9=203, 99.99=1135] 
2024-07-22 12:08:40:991 21 sec: 483876 operations; 28358 current ops/sec; est completion in 23 seconds [READ: Count=14136, Max=335, Min=13, Avg=32,81, 90=47, 99=98, 99.9=155, 99.99=334] [UPDATE: Count=14230, Max=306, Min=13, Avg=35,5, 90=51, 99=115, 99.9=182, 99.99=248] 
2024-07-22 12:08:41:991 22 sec: 512684 operations; 28808 current ops/sec; est completion in 21 seconds [READ: Count=14467, Max=1736, Min=13, Avg=32,8, 90=46, 99=102, 99.9=157, 99.99=728] [UPDATE: Count=14334, Max=193, Min=13, Avg=34,4, 90=49, 99=108, 99.9=159, 99.99=187] 
2024-07-22 12:08:42:991 23 sec: 539869 operations; 27185 current ops/sec; est completion in 20 seconds [READ: Count=13571, Max=243, Min=13, Avg=34,46, 90=50, 99=107, 99.9=169, 99.99=242] [UPDATE: Count=13609, Max=573, Min=13, Avg=36,78, 90=54, 99=118, 99.9=172, 99.99=324] 
2024-07-22 12:08:43:991 24 sec: 567933 operations; 28064 current ops/sec; est completion in 19 seconds [READ: Count=13934, Max=2309, Min=13, Avg=33,58, 90=48, 99=122, 99.9=245, 99.99=1431] [UPDATE: Count=14146, Max=595, Min=13, Avg=35,22, 90=52, 99=130, 99.9=275, 99.99=506] 
2024-07-22 12:08:44:991 25 sec: 594985 operations; 27052 current ops/sec; est completion in 18 seconds [READ: Count=13494, Max=245, Min=13, Avg=34,74, 90=48, 99=107, 99.9=174, 99.99=235] [UPDATE: Count=13551, Max=2397, Min=13, Avg=36,82, 90=52, 99=113, 99.9=171, 99.99=250] 
2024-07-22 12:08:45:990 26 sec: 622349 operations; 27364 current ops/sec; est completion in 16 seconds [READ: Count=13637, Max=1153, Min=13, Avg=34,29, 90=47, 99=113, 99.9=152, 99.99=195] [UPDATE: Count=13726, Max=291, Min=13, Avg=36,51, 90=51, 99=116, 99.9=166, 99.99=264] 
2024-07-22 12:08:46:991 27 sec: 649600 operations; 27251 current ops/sec; est completion in 15 seconds [READ: Count=13626, Max=373, Min=13, Avg=34,62, 90=48, 99=109, 99.9=184, 99.99=362] [UPDATE: Count=13631, Max=278, Min=13, Avg=36,43, 90=51, 99=116, 99.9=177, 99.99=247] 
2024-07-22 12:08:47:991 28 sec: 675122 operations; 25522 current ops/sec; est completion in 14 seconds [READ: Count=12836, Max=292, Min=13, Avg=37,03, 90=52, 99=116, 99.9=162, 99.99=210] [UPDATE: Count=12689, Max=359, Min=13, Avg=38,93, 90=56, 99=123, 99.9=185, 99.99=264] 
2024-07-22 12:08:48:991 29 sec: 702679 operations; 27557 current ops/sec; est completion in 13 seconds [READ: Count=13599, Max=2021, Min=13, Avg=34,43, 90=46, 99=110, 99.9=169, 99.99=1050] [UPDATE: Count=13949, Max=241, Min=12, Avg=35,88, 90=49, 99=113, 99.9=159, 99.99=228] 
2024-07-22 12:08:49:991 30 sec: 732022 operations; 29343 current ops/sec; est completion in 11 seconds [READ: Count=14703, Max=725, Min=13, Avg=32, 90=49, 99=104, 99.9=164, 99.99=547] [UPDATE: Count=14631, Max=910, Min=13, Avg=34,01, 90=53, 99=110, 99.9=191, 99.99=635] 
2024-07-22 12:08:50:990 31 sec: 759404 operations; 27382 current ops/sec; est completion in 10 seconds [READ: Count=13749, Max=874, Min=13, Avg=34,42, 90=50, 99=114, 99.9=187, 99.99=490] [UPDATE: Count=13637, Max=375, Min=12, Avg=36,33, 90=55, 99=120, 99.9=205, 99.99=300] 
2024-07-22 12:08:51:990 32 sec: 790238 operations; 30834 current ops/sec; est completion in 9 second [READ: Count=15418, Max=2515, Min=13, Avg=30,46, 90=47, 99=108, 99.9=189, 99.99=809] [UPDATE: Count=15417, Max=339, Min=13, Avg=32,28, 90=51, 99=115, 99.9=178, 99.99=287] 
2024-07-22 12:08:52:991 33 sec: 818318 operations; 28080 current ops/sec; est completion in 8 second [READ: Count=14014, Max=384, Min=13, Avg=33,52, 90=49, 99=115, 99.9=198, 99.99=303] [UPDATE: Count=14062, Max=472, Min=12, Avg=35,41, 90=52, 99=120, 99.9=215, 99.99=424] 
2024-07-22 12:08:53:990 34 sec: 840814 operations; 22496 current ops/sec; est completion in 7 second [READ: Count=11201, Max=7275, Min=13, Avg=41,97, 90=61, 99=136, 99.9=270, 99.99=4187] [UPDATE: Count=11305, Max=2583, Min=13, Avg=43,99, 90=67, 99=150, 99.9=265, 99.99=2473] 
2024-07-22 12:08:54:991 35 sec: 863721 operations; 22907 current ops/sec; est completion in 6 second [READ: Count=11430, Max=2257, Min=13, Avg=41,05, 90=62, 99=130, 99.9=212, 99.99=2143] [UPDATE: Count=11470, Max=560, Min=13, Avg=43,74, 90=68, 99=148, 99.9=282, 99.99=518] 
2024-07-22 12:08:55:990 36 sec: 888708 operations; 24987 current ops/sec; est completion in 5 second [READ: Count=12614, Max=3911, Min=13, Avg=37,48, 90=55, 99=120, 99.9=209, 99.99=438] [UPDATE: Count=12371, Max=560, Min=13, Avg=39,98, 90=60, 99=131, 99.9=215, 99.99=530] 
2024-07-22 12:08:56:991 37 sec: 908691 operations; 19983 current ops/sec; est completion in 4 second [READ: Count=10106, Max=786, Min=13, Avg=46,81, 90=71, 99=159, 99.9=312, 99.99=780] [UPDATE: Count=9879, Max=950, Min=13, Avg=50,53, 90=76, 99=177, 99.9=369, 99.99=712] 
2024-07-22 12:08:57:990 38 sec: 934415 operations; 25724 current ops/sec; est completion in 3 second [READ: Count=12954, Max=3035, Min=13, Avg=36,51, 90=55, 99=124, 99.9=212, 99.99=464] [UPDATE: Count=12773, Max=1014, Min=13, Avg=38,62, 90=60, 99=134, 99.9=225, 99.99=759] 
2024-07-22 12:08:58:991 39 sec: 959319 operations; 24904 current ops/sec; est completion in 2 second [READ: Count=12588, Max=859, Min=13, Avg=37,49, 90=58, 99=126, 99.9=199, 99.99=359] [UPDATE: Count=12319, Max=765, Min=13, Avg=40,39, 90=63, 99=132, 99.9=230, 99.99=300] 
2024-07-22 12:08:59:991 40 sec: 980166 operations; 20847 current ops/sec; est completion in 1 second [READ: Count=10471, Max=1715, Min=13, Avg=44,81, 90=66, 99=143, 99.9=261, 99.99=1180] [UPDATE: Count=10371, Max=1815, Min=13, Avg=48,36, 90=73, 99=159, 99.9=289, 99.99=993] 
2024-07-22 12:09:00:854 40 sec: 1000000 operations; 22956,02 current ops/sec; [READ: Count=9934, Max=944, Min=13, Avg=40,95, 90=62, 99=134, 99.9=220, 99.99=335] [CLEANUP: Count=1, Max=1002, Min=1002, Avg=1002, 90=1002, 99=1002, 99.9=1002, 99.99=1002] [UPDATE: Count=9890, Max=371, Min=13, Avg=43,4, 90=68, 99=143, 99.9=217, 99.99=324] 
[OVERALL], RunTime(ms), 40864
[OVERALL], Throughput(ops/sec), 24471.41738449491
[TOTAL_GCS_G1_Young_Generation], Count, 13
[TOTAL_GC_TIME_G1_Young_Generation], Time(ms), 26
[TOTAL_GC_TIME_%_G1_Young_Generation], Time(%), 0.06362568519968677
[TOTAL_GCS_G1_Old_Generation], Count, 0
[TOTAL_GC_TIME_G1_Old_Generation], Time(ms), 0
[TOTAL_GC_TIME_%_G1_Old_Generation], Time(%), 0.0
[TOTAL_GCs], Count, 13
[TOTAL_GC_TIME], Time(ms), 26
[TOTAL_GC_TIME_%], Time(%), 0.06362568519968677
[READ], Operations, 500810
[READ], AverageLatency(us), 38.133343982747945
[READ], MinLatency(us), 13
[READ], MaxLatency(us), 7275
[READ], 95thPercentileLatency(us), 73
[READ], 99thPercentileLatency(us), 131
[READ], Return=OK, 500810
[CLEANUP], Operations, 1
[CLEANUP], AverageLatency(us), 1002.0
[CLEANUP], MinLatency(us), 1002
[CLEANUP], MaxLatency(us), 1002
[CLEANUP], 95thPercentileLatency(us), 1002
[CLEANUP], 99thPercentileLatency(us), 1002
[UPDATE], Operations, 499190
[UPDATE], AverageLatency(us), 40.69951521464773
[UPDATE], MinLatency(us), 12
[UPDATE], MaxLatency(us), 4515
[UPDATE], 95thPercentileLatency(us), 80
[UPDATE], 99thPercentileLatency(us), 143
[UPDATE], Return=OK, 499190
