/usr/bin/java  -classpath /home/sebastiaoamaro/phd/torefidevel/tests/redis/ycsb-0.17.0/conf:/home/sebastiaoamaro/phd/torefidevel/tests/redis/ycsb-0.17.0/lib/HdrHistogram-2.1.4.jar:/home/sebastiaoamaro/phd/torefidevel/tests/redis/ycsb-0.17.0/lib/core-0.17.0.jar:/home/sebastiaoamaro/phd/torefidevel/tests/redis/ycsb-0.17.0/lib/htrace-core4-4.1.0-incubating.jar:/home/sebastiaoamaro/phd/torefidevel/tests/redis/ycsb-0.17.0/lib/jackson-core-asl-1.9.4.jar:/home/sebastiaoamaro/phd/torefidevel/tests/redis/ycsb-0.17.0/lib/jackson-mapper-asl-1.9.4.jar:/home/sebastiaoamaro/phd/torefidevel/tests/redis/ycsb-0.17.0/redis-binding/lib/commons-pool2-2.4.2.jar:/home/sebastiaoamaro/phd/torefidevel/tests/redis/ycsb-0.17.0/redis-binding/lib/jedis-2.9.0.jar:/home/sebastiaoamaro/phd/torefidevel/tests/redis/ycsb-0.17.0/redis-binding/lib/redis-binding-0.17.0.jar site.ycsb.Client -t -db site.ycsb.db.RedisClient -P workloads/workloada -s -p status.interval=1 -p operationcount=2500000 -p redis.host=172.38.0.11 -p redis.port=6379 -p redis.cluster=true -s
Command line: -t -db site.ycsb.db.RedisClient -P workloads/workloada -s -p status.interval=1 -p operationcount=2500000 -p redis.host=172.38.0.11 -p redis.port=6379 -p redis.cluster=true -s
YCSB Client 0.17.0

Loading workload...
Starting test.
2024-09-20 18:35:11:622 0 sec: 0 operations; est completion in 0 second 
DBWrapper: report latency for each error is false and specific error codes to track for latency are: []
2024-09-20 18:35:12:601 1 sec: 13938 operations; 13924,08 current ops/sec; est completion in 2 minutes [READ: Count=6938, Max=4791, Min=20, Avg=59,23, 90=95, 99=176, 99.9=269, 99.99=428] [UPDATE: Count=7037, Max=941, Min=20, Avg=63,56, 90=106, 99=204, 99.9=337, 99.99=476] 
2024-09-20 18:35:13:601 2 sec: 43338 operations; 29429,43 current ops/sec; est completion in 1 minute [READ: Count=14724, Max=289, Min=19, Avg=32,78, 90=63, 99=108, 99.9=167, 99.99=244] [UPDATE: Count=14659, Max=2207, Min=19, Avg=32,52, 90=65, 99=104, 99.9=169, 99.99=1075] 
2024-09-20 18:35:14:601 3 sec: 81372 operations; 37996 current ops/sec; est completion in 1 minute [READ: Count=18910, Max=648, Min=20, Avg=25,87, 90=28, 99=65, 99.9=140, 99.99=234] [UPDATE: Count=19137, Max=1468, Min=19, Avg=24,78, 90=26, 99=65, 99.9=131, 99.99=237] 
2024-09-20 18:35:15:601 4 sec: 114947 operations; 33608,61 current ops/sec; est completion in 1 minute [READ: Count=16875, Max=652, Min=19, Avg=29,01, 90=50, 99=89, 99.9=169, 99.99=236] [UPDATE: Count=16708, Max=414, Min=19, Avg=28,58, 90=52, 99=90, 99.9=180, 99.99=281] 
2024-09-20 18:35:16:601 5 sec: 149406 operations; 34459 current ops/sec; est completion in 1 minute [READ: Count=17319, Max=271, Min=19, Avg=27,96, 90=43, 99=87, 99.9=168, 99.99=252] [UPDATE: Count=17105, Max=334, Min=19, Avg=28,32, 90=44, 99=93, 99.9=189, 99.99=316] 
2024-09-20 18:35:17:601 6 sec: 185239 operations; 35797,2 current ops/sec; est completion in 1 minute [READ: Count=17986, Max=319, Min=18, Avg=26,85, 90=39, 99=93, 99.9=179, 99.99=243] [UPDATE: Count=17871, Max=685, Min=18, Avg=27,17, 90=38, 99=96, 99.9=190, 99.99=265] 
2024-09-20 18:35:18:601 7 sec: 224422 operations; 39222,22 current ops/sec; est completion in 1 minute [READ: Count=19581, Max=340, Min=19, Avg=24,56, 90=29, 99=68, 99.9=148, 99.99=214] [UPDATE: Count=19590, Max=252, Min=19, Avg=24,79, 90=28, 99=71, 99.9=147, 99.99=237] 
2024-09-20 18:35:19:601 8 sec: 259187 operations; 34730,27 current ops/sec; est completion in 1 minute [READ: Count=17514, Max=237, Min=17, Avg=27,55, 90=41, 99=78, 99.9=160, 99.99=224] [UPDATE: Count=17267, Max=723, Min=19, Avg=28,11, 90=42, 99=88, 99.9=181, 99.99=287] 
2024-09-20 18:35:20:601 9 sec: 292249 operations; 33062 current ops/sec; est completion in 1 minute [READ: Count=16647, Max=312, Min=13, Avg=29,18, 90=52, 99=105, 99.9=164, 99.99=250] [UPDATE: Count=16412, Max=681, Min=19, Avg=29,36, 90=55, 99=98, 99.9=174, 99.99=307] 
2024-09-20 18:35:21:601 10 sec: 328436 operations; 36223,22 current ops/sec; est completion in 1 minute [READ: Count=17938, Max=241, Min=17, Avg=26,59, 90=37, 99=66, 99.9=135, 99.99=222] [UPDATE: Count=18234, Max=246, Min=19, Avg=26,87, 90=38, 99=71, 99.9=152, 99.99=236] 
2024-09-20 18:35:22:601 11 sec: 369057 operations; 40621 current ops/sec; est completion in 1 minute [READ: Count=20287, Max=248, Min=18, Avg=23,64, 90=25, 99=61, 99.9=115, 99.99=238] [UPDATE: Count=20336, Max=760, Min=19, Avg=24, 90=25, 99=64, 99.9=126, 99.99=227] 
2024-09-20 18:35:23:601 12 sec: 401861 operations; 32804 current ops/sec; est completion in 1 minute [READ: Count=16394, Max=262, Min=19, Avg=29,42, 90=53, 99=88, 99.9=152, 99.99=232] [UPDATE: Count=16399, Max=260, Min=19, Avg=29,74, 90=56, 99=92, 99.9=168, 99.99=241] 
2024-09-20 18:35:24:601 13 sec: 438177 operations; 36279,72 current ops/sec; est completion in 1 minute [READ: Count=18186, Max=615, Min=19, Avg=26,37, 90=37, 99=69, 99.9=148, 99.99=224] [UPDATE: Count=18160, Max=2042, Min=19, Avg=26,91, 90=38, 99=71, 99.9=148, 99.99=287] 
2024-09-20 18:35:25:601 14 sec: 469520 operations; 31374,37 current ops/sec; est completion in 1 minute [READ: Count=15648, Max=251, Min=19, Avg=30,71, 90=57, 99=97, 99.9=184, 99.99=232] [UPDATE: Count=15678, Max=269, Min=19, Avg=31,25, 90=60, 99=95, 99.9=184, 99.99=260] 
2024-09-20 18:35:26:601 15 sec: 492212 operations; 22692 current ops/sec; est completion in 1 minute [READ: Count=11227, Max=397, Min=19, Avg=42,58, 90=73, 99=145, 99.9=249, 99.99=365] [UPDATE: Count=11453, Max=416, Min=20, Avg=43,53, 90=75, 99=142, 99.9=233, 99.99=348] 
2024-09-20 18:35:27:601 16 sec: 508434 operations; 16222 current ops/sec; est completion in 1 minute [READ: Count=8045, Max=1016, Min=19, Avg=59,14, 90=96, 99=194, 99.9=330, 99.99=731] [UPDATE: Count=8185, Max=712, Min=19, Avg=61,57, 90=102, 99=201, 99.9=342, 99.99=425] 
2024-09-20 18:35:28:601 17 sec: 523320 operations; 14886 current ops/sec; est completion in 1 minute [READ: Count=7430, Max=771, Min=20, Avg=63,76, 90=102, 99=179, 99.9=283, 99.99=763] [UPDATE: Count=7448, Max=4195, Min=20, Avg=67,84, 90=110, 99=198, 99.9=283, 99.99=415] 
2024-09-20 18:35:29:601 18 sec: 546638 operations; 23318 current ops/sec; est completion in 1 minute [READ: Count=11797, Max=389, Min=20, Avg=41,27, 90=71, 99=150, 99.9=246, 99.99=318] [UPDATE: Count=11525, Max=489, Min=18, Avg=42,25, 90=73, 99=162, 99.9=256, 99.99=401] 
2024-09-20 18:35:30:601 19 sec: 574628 operations; 27990 current ops/sec; est completion in 1 minute [READ: Count=13957, Max=298, Min=19, Avg=34,43, 90=59, 99=113, 99.9=176, 99.99=258] [UPDATE: Count=14027, Max=678, Min=19, Avg=34,87, 90=61, 99=119, 99.9=187, 99.99=368] 
2024-09-20 18:35:31:601 20 sec: 612002 operations; 37374 current ops/sec; est completion in 1 minute [READ: Count=18738, Max=700, Min=19, Avg=25,8, 90=31, 99=66, 99.9=148, 99.99=256] [UPDATE: Count=18641, Max=364, Min=19, Avg=25,85, 90=31, 99=69, 99.9=137, 99.99=246] 
2024-09-20 18:35:32:601 21 sec: 646933 operations; 34931 current ops/sec; est completion in 1 minute [READ: Count=17255, Max=293, Min=19, Avg=27,49, 90=45, 99=77, 99.9=156, 99.99=260] [UPDATE: Count=17670, Max=313, Min=19, Avg=27,99, 90=49, 99=83, 99.9=155, 99.99=214] 
2024-09-20 18:35:33:601 22 sec: 681853 operations; 34920 current ops/sec; est completion in 59 seconds [READ: Count=17532, Max=294, Min=19, Avg=27,73, 90=34, 99=90, 99.9=156, 99.99=270] [UPDATE: Count=17386, Max=240, Min=19, Avg=27,64, 90=33, 99=86, 99.9=176, 99.99=218] 
2024-09-20 18:35:34:601 23 sec: 714215 operations; 32329,67 current ops/sec; est completion in 58 seconds [READ: Count=16211, Max=647, Min=13, Avg=30,03, 90=51, 99=87, 99.9=179, 99.99=243] [UPDATE: Count=16171, Max=244, Min=19, Avg=29,87, 90=54, 99=85, 99.9=152, 99.99=178] 
2024-09-20 18:35:35:601 24 sec: 745931 operations; 31747,75 current ops/sec; est completion in 57 seconds [READ: Count=16028, Max=307, Min=19, Avg=30,43, 90=58, 99=82, 99.9=158, 99.99=225] [UPDATE: Count=15673, Max=243, Min=19, Avg=30,8, 90=61, 99=84, 99.9=157, 99.99=230] 
2024-09-20 18:35:36:601 25 sec: 782807 operations; 36876 current ops/sec; est completion in 55 seconds [READ: Count=18446, Max=556, Min=13, Avg=26,21, 90=33, 99=76, 99.9=151, 99.99=244] [UPDATE: Count=18432, Max=245, Min=18, Avg=26,31, 90=32, 99=78, 99.9=159, 99.99=231] 
2024-09-20 18:35:37:601 26 sec: 813588 operations; 30781 current ops/sec; est completion in 54 seconds [READ: Count=15239, Max=246, Min=19, Avg=31,56, 90=57, 99=109, 99.9=187, 99.99=227] [UPDATE: Count=15539, Max=262, Min=18, Avg=31,48, 90=59, 99=111, 99.9=193, 99.99=241] 
2024-09-20 18:35:38:601 27 sec: 831412 operations; 17824 current ops/sec; est completion in 55 seconds [READ: Count=8959, Max=1430, Min=19, Avg=54,28, 90=90, 99=208, 99.9=407, 99.99=730] [UPDATE: Count=8863, Max=2543, Min=19, Avg=55,3, 90=93, 99=194, 99.9=337, 99.99=1239] 
2024-09-20 18:35:39:601 28 sec: 855981 operations; 24569 current ops/sec; est completion in 54 seconds [READ: Count=12479, Max=317, Min=19, Avg=39,29, 90=71, 99=131, 99.9=221, 99.99=303] [UPDATE: Count=12093, Max=374, Min=19, Avg=39,97, 90=74, 99=139, 99.9=228, 99.99=360] 
2024-09-20 18:35:40:601 29 sec: 883471 operations; 27490 current ops/sec; est completion in 54 seconds [READ: Count=13795, Max=1120, Min=19, Avg=34,97, 90=62, 99=117, 99.9=201, 99.99=301] [UPDATE: Count=13691, Max=3077, Min=19, Avg=35,76, 90=65, 99=125, 99.9=204, 99.99=259] 
2024-09-20 18:35:41:601 30 sec: 920287 operations; 36816 current ops/sec; est completion in 52 seconds [READ: Count=18402, Max=386, Min=19, Avg=26,2, 90=36, 99=78, 99.9=153, 99.99=270] [UPDATE: Count=18411, Max=295, Min=19, Avg=26,36, 90=35, 99=81, 99.9=166, 99.99=244] 
2024-09-20 18:35:42:601 31 sec: 950353 operations; 30066 current ops/sec; est completion in 51 seconds [READ: Count=15118, Max=250, Min=19, Avg=32,04, 90=60, 99=99, 99.9=191, 99.99=226] [UPDATE: Count=14953, Max=1152, Min=19, Avg=32,76, 90=64, 99=105, 99.9=173, 99.99=253] 
2024-09-20 18:35:43:601 32 sec: 978868 operations; 28515 current ops/sec; est completion in 50 seconds [READ: Count=14175, Max=271, Min=19, Avg=33,83, 90=63, 99=114, 99.9=198, 99.99=263] [UPDATE: Count=14337, Max=348, Min=19, Avg=34,44, 90=65, 99=122, 99.9=219, 99.99=273] 
2024-09-20 18:35:44:601 33 sec: 1003675 operations; 24807 current ops/sec; est completion in 50 seconds [READ: Count=12453, Max=268, Min=19, Avg=38,63, 90=71, 99=145, 99.9=232, 99.99=264] [UPDATE: Count=12357, Max=1332, Min=19, Avg=40,01, 90=76, 99=153, 99.9=257, 99.99=349] 
2024-09-20 18:35:45:601 34 sec: 1031556 operations; 27881 current ops/sec; est completion in 49 seconds [READ: Count=13936, Max=690, Min=19, Avg=34,61, 90=62, 99=122, 99.9=211, 99.99=477] [UPDATE: Count=13947, Max=323, Min=19, Avg=35,24, 90=65, 99=131, 99.9=212, 99.99=262] 
2024-09-20 18:35:46:601 35 sec: 1070720 operations; 39124,88 current ops/sec; est completion in 47 seconds [READ: Count=19549, Max=310, Min=19, Avg=24,47, 90=27, 99=56, 99.9=103, 99.99=192] [UPDATE: Count=19618, Max=241, Min=19, Avg=24,68, 90=27, 99=60, 99.9=129, 99.99=207] 
2024-09-20 18:35:47:601 36 sec: 1100895 operations; 30205,21 current ops/sec; est completion in 46 seconds [READ: Count=15152, Max=1220, Min=19, Avg=31,88, 90=59, 99=128, 99.9=215, 99.99=307] [UPDATE: Count=15018, Max=354, Min=19, Avg=32,46, 90=62, 99=134, 99.9=226, 99.99=345] 
2024-09-20 18:35:48:601 37 sec: 1134749 operations; 33854 current ops/sec; est completion in 45 seconds [READ: Count=16971, Max=1477, Min=19, Avg=28,47, 90=48, 99=87, 99.9=159, 99.99=577] [UPDATE: Count=16887, Max=244, Min=19, Avg=28,73, 90=50, 99=94, 99.9=157, 99.99=210] 
2024-09-20 18:35:49:601 38 sec: 1160831 operations; 26082 current ops/sec; est completion in 44 seconds [READ: Count=12991, Max=406, Min=20, Avg=36,85, 90=65, 99=128, 99.9=237, 99.99=405] [UPDATE: Count=13091, Max=439, Min=19, Avg=37,88, 90=69, 99=140, 99.9=244, 99.99=367] 
2024-09-20 18:35:50:601 39 sec: 1192635 operations; 31804 current ops/sec; est completion in 43 seconds [READ: Count=15887, Max=636, Min=17, Avg=30,28, 90=56, 99=80, 99.9=253, 99.99=363] [UPDATE: Count=15913, Max=2517, Min=19, Avg=30,78, 90=59, 99=82, 99.9=226, 99.99=458] 
2024-09-20 18:35:51:601 40 sec: 1226660 operations; 34025 current ops/sec; est completion in 42 seconds [READ: Count=16869, Max=355, Min=19, Avg=28,31, 90=50, 99=79, 99.9=160, 99.99=243] [UPDATE: Count=17161, Max=405, Min=19, Avg=28,65, 90=52, 99=81, 99.9=190, 99.99=287] 
2024-09-20 18:35:52:601 41 sec: 1266905 operations; 40245 current ops/sec; est completion in 40 seconds [READ: Count=19987, Max=258, Min=19, Avg=23,84, 90=26, 99=61, 99.9=128, 99.99=235] [UPDATE: Count=20256, Max=267, Min=17, Avg=24,17, 90=26, 99=65, 99.9=129, 99.99=245] 
2024-09-20 18:35:53:601 42 sec: 1304021 operations; 37116 current ops/sec; est completion in 39 seconds [READ: Count=18560, Max=568, Min=18, Avg=25,96, 90=36, 99=72, 99.9=126, 99.99=178] [UPDATE: Count=18549, Max=232, Min=19, Avg=26,21, 90=36, 99=73, 99.9=140, 99.99=208] 
2024-09-20 18:35:54:601 43 sec: 1338109 operations; 34088 current ops/sec; est completion in 38 seconds [READ: Count=16955, Max=604, Min=20, Avg=28,28, 90=37, 99=76, 99.9=144, 99.99=244] [UPDATE: Count=17136, Max=285, Min=15, Avg=28,45, 90=37, 99=79, 99.9=159, 99.99=228] 
2024-09-20 18:35:55:601 44 sec: 1366561 operations; 28452 current ops/sec; est completion in 37 seconds [READ: Count=14323, Max=816, Min=17, Avg=33,72, 90=63, 99=118, 99.9=207, 99.99=327] [UPDATE: Count=14129, Max=323, Min=19, Avg=34,78, 90=66, 99=127, 99.9=201, 99.99=244] 
2024-09-20 18:35:56:601 45 sec: 1394159 operations; 27598 current ops/sec; est completion in 36 seconds [READ: Count=13742, Max=492, Min=19, Avg=35, 90=69, 99=144, 99.9=235, 99.99=372] [UPDATE: Count=13855, Max=392, Min=19, Avg=35,39, 90=71, 99=150, 99.9=252, 99.99=388] 
2024-09-20 18:35:57:601 46 sec: 1420322 operations; 26163 current ops/sec; est completion in 35 seconds [READ: Count=13076, Max=929, Min=20, Avg=36,86, 90=68, 99=132, 99.9=237, 99.99=383] [UPDATE: Count=13085, Max=315, Min=19, Avg=37,53, 90=71, 99=141, 99.9=236, 99.99=304] 
2024-09-20 18:35:58:601 47 sec: 1451238 operations; 30916 current ops/sec; est completion in 34 seconds [READ: Count=15422, Max=296, Min=19, Avg=31,15, 90=59, 99=104, 99.9=176, 99.99=238] [UPDATE: Count=15499, Max=680, Min=19, Avg=31,66, 90=62, 99=108, 99.9=210, 99.99=333] 
2024-09-20 18:35:59:601 48 sec: 1468856 operations; 17618 current ops/sec; est completion in 34 seconds [READ: Count=8797, Max=2879, Min=20, Avg=54,66, 90=86, 99=168, 99.9=410, 99.99=1251] [UPDATE: Count=8820, Max=1205, Min=20, Avg=56,45, 90=91, 99=179, 99.9=257, 99.99=494] 
2024-09-20 18:36:00:601 49 sec: 1500894 operations; 32038 current ops/sec; est completion in 33 seconds [READ: Count=15914, Max=380, Min=19, Avg=29,97, 90=56, 99=100, 99.9=169, 99.99=212] [UPDATE: Count=16123, Max=293, Min=19, Avg=30,48, 90=58, 99=115, 99.9=185, 99.99=245] 
2024-09-20 18:36:01:601 50 sec: 1529617 operations; 28723 current ops/sec; est completion in 32 seconds [READ: Count=14196, Max=680, Min=16, Avg=33,63, 90=62, 99=110, 99.9=185, 99.99=325] [UPDATE: Count=14526, Max=383, Min=19, Avg=33,97, 90=65, 99=111, 99.9=176, 99.99=347] 
2024-09-20 18:36:02:601 51 sec: 1546730 operations; 17113 current ops/sec; est completion in 32 seconds [READ: Count=8525, Max=729, Min=20, Avg=56,42, 90=88, 99=166, 99.9=243, 99.99=644] [UPDATE: Count=8588, Max=1183, Min=19, Avg=57,88, 90=91, 99=172, 99.9=240, 99.99=541] 
2024-09-20 18:36:03:601 52 sec: 1574629 operations; 27899 current ops/sec; est completion in 31 seconds [READ: Count=13979, Max=364, Min=19, Avg=34,35, 90=66, 99=131, 99.9=214, 99.99=301] [UPDATE: Count=13919, Max=370, Min=19, Avg=35,39, 90=70, 99=135, 99.9=251, 99.99=364] 
2024-09-20 18:36:04:601 53 sec: 1589541 operations; 14912 current ops/sec; est completion in 31 seconds [READ: Count=7582, Max=1557, Min=19, Avg=64,6, 90=111, 99=236, 99.9=421, 99.99=1130] [UPDATE: Count=7335, Max=882, Min=20, Avg=66,79, 90=120, 99=247, 99.9=457, 99.99=749] 
2024-09-20 18:36:05:601 54 sec: 1603098 operations; 13557 current ops/sec; est completion in 31 seconds [READ: Count=6781, Max=917, Min=21, Avg=71, 90=114, 99=214, 99.9=341, 99.99=427] [UPDATE: Count=6774, Max=457, Min=20, Avg=73,68, 90=117, 99=224, 99.9=325, 99.99=439] 
2024-09-20 18:36:06:601 55 sec: 1618110 operations; 15012 current ops/sec; est completion in 30 seconds [READ: Count=7519, Max=849, Min=19, Avg=63,85, 90=117, 99=223, 99.9=329, 99.99=560] [UPDATE: Count=7490, Max=1182, Min=19, Avg=66,68, 90=125, 99=243, 99.9=414, 99.99=740] 
2024-09-20 18:36:07:601 56 sec: 1636905 operations; 18795 current ops/sec; est completion in 30 seconds [READ: Count=9475, Max=373, Min=15, Avg=51,02, 90=87, 99=161, 99.9=248, 99.99=342] [UPDATE: Count=9323, Max=520, Min=20, Avg=52,98, 90=92, 99=170, 99.9=272, 99.99=328] 
2024-09-20 18:36:08:601 57 sec: 1663279 operations; 26374 current ops/sec; est completion in 29 seconds [READ: Count=13168, Max=1102, Min=19, Avg=36,72, 90=66, 99=125, 99.9=198, 99.99=906] [UPDATE: Count=13209, Max=303, Min=19, Avg=37,12, 90=69, 99=126, 99.9=223, 99.99=284] 
2024-09-20 18:36:09:601 58 sec: 1689026 operations; 25747 current ops/sec; est completion in 28 seconds [READ: Count=12761, Max=1345, Min=19, Avg=37,52, 90=67, 99=143, 99.9=229, 99.99=1000] [UPDATE: Count=12982, Max=3091, Min=19, Avg=38,19, 90=71, 99=147, 99.9=226, 99.99=1474] 
2024-09-20 18:36:10:601 59 sec: 1708431 operations; 19405 current ops/sec; est completion in 28 seconds [READ: Count=9645, Max=780, Min=19, Avg=49,42, 90=80, 99=152, 99.9=235, 99.99=430] [UPDATE: Count=9759, Max=297, Min=19, Avg=51,21, 90=85, 99=164, 99.9=233, 99.99=295] 
2024-09-20 18:36:11:601 60 sec: 1726198 operations; 17767 current ops/sec; est completion in 27 seconds [READ: Count=8874, Max=732, Min=20, Avg=54,03, 90=88, 99=182, 99.9=287, 99.99=444] [UPDATE: Count=8893, Max=421, Min=19, Avg=56, 90=94, 99=189, 99.9=304, 99.99=400] 
2024-09-20 18:36:12:601 61 sec: 1741929 operations; 15731 current ops/sec; est completion in 27 seconds [READ: Count=7791, Max=555, Min=19, Avg=61,03, 90=96, 99=203, 99.9=307, 99.99=438] [UPDATE: Count=7939, Max=1988, Min=19, Avg=63,54, 90=104, 99=216, 99.9=282, 99.99=494] 
2024-09-20 18:36:13:601 62 sec: 1763989 operations; 22060 current ops/sec; est completion in 26 seconds [READ: Count=10970, Max=360, Min=20, Avg=43,45, 90=72, 99=161, 99.9=288, 99.99=353] [UPDATE: Count=11094, Max=1044, Min=19, Avg=44,89, 90=76, 99=173, 99.9=295, 99.99=366] 
2024-09-20 18:36:14:601 63 sec: 1789462 operations; 25473 current ops/sec; est completion in 26 seconds [READ: Count=12784, Max=707, Min=19, Avg=38,01, 90=64, 99=116, 99.9=224, 99.99=684] [UPDATE: Count=12684, Max=378, Min=19, Avg=38,41, 90=67, 99=120, 99.9=209, 99.99=359] 
2024-09-20 18:36:15:601 64 sec: 1809272 operations; 19810 current ops/sec; est completion in 25 seconds [READ: Count=9937, Max=551, Min=20, Avg=48,34, 90=86, 99=153, 99.9=226, 99.99=311] [UPDATE: Count=9878, Max=432, Min=19, Avg=50,32, 90=91, 99=160, 99.9=269, 99.99=431] 
2024-09-20 18:36:16:601 65 sec: 1844854 operations; 35582 current ops/sec; est completion in 24 seconds [READ: Count=17943, Max=341, Min=19, Avg=27,05, 90=35, 99=87, 99.9=153, 99.99=255] [UPDATE: Count=17636, Max=418, Min=18, Avg=27,35, 90=35, 99=90, 99.9=163, 99.99=242] 
2024-09-20 18:36:17:601 66 sec: 1874004 operations; 29150 current ops/sec; est completion in 23 seconds [READ: Count=14591, Max=339, Min=19, Avg=32,92, 90=63, 99=118, 99.9=207, 99.99=264] [UPDATE: Count=14556, Max=844, Min=19, Avg=33,76, 90=66, 99=117, 99.9=230, 99.99=398] 
2024-09-20 18:36:18:601 67 sec: 1895079 operations; 21075 current ops/sec; est completion in 22 seconds [READ: Count=10456, Max=292, Min=19, Avg=45,6, 90=74, 99=147, 99.9=220, 99.99=292] [UPDATE: Count=10625, Max=347, Min=18, Avg=47,08, 90=78, 99=157, 99.9=277, 99.99=343] 
2024-09-20 18:36:19:601 68 sec: 1916839 operations; 21760 current ops/sec; est completion in 21 seconds [READ: Count=10804, Max=610, Min=19, Avg=44,03, 90=81, 99=149, 99.9=243, 99.99=328] [UPDATE: Count=10953, Max=956, Min=19, Avg=45,6, 90=85, 99=166, 99.9=260, 99.99=695] 
2024-09-20 18:36:20:601 69 sec: 1937111 operations; 20272 current ops/sec; est completion in 21 seconds [READ: Count=10222, Max=358, Min=19, Avg=47,43, 90=82, 99=159, 99.9=240, 99.99=287] [UPDATE: Count=10049, Max=346, Min=19, Avg=48,99, 90=86, 99=173, 99.9=259, 99.99=341] 
2024-09-20 18:36:21:601 70 sec: 1965485 operations; 28374 current ops/sec; est completion in 20 seconds [READ: Count=14028, Max=642, Min=18, Avg=33,9, 90=62, 99=110, 99.9=179, 99.99=324] [UPDATE: Count=14353, Max=365, Min=18, Avg=34,4, 90=65, 99=116, 99.9=194, 99.99=306] 
2024-09-20 18:36:22:601 71 sec: 1990180 operations; 24670,33 current ops/sec; est completion in 19 seconds [READ: Count=12381, Max=981, Min=17, Avg=39,29, 90=69, 99=130, 99.9=234, 99.99=340] [UPDATE: Count=12313, Max=400, Min=17, Avg=39,42, 90=70, 99=137, 99.9=222, 99.99=353] 
2024-09-20 18:36:23:601 72 sec: 2020732 operations; 30582,58 current ops/sec; est completion in 18 seconds [READ: Count=15236, Max=278, Min=15, Avg=31,46, 90=56, 99=110, 99.9=191, 99.99=223] [UPDATE: Count=15312, Max=399, Min=15, Avg=31,99, 90=59, 99=111, 99.9=200, 99.99=234] 
2024-09-20 18:36:24:601 73 sec: 2039712 operations; 18980 current ops/sec; est completion in 17 seconds [READ: Count=9522, Max=2601, Min=13, Avg=50,33, 90=87, 99=174, 99.9=323, 99.99=834] [UPDATE: Count=9456, Max=1972, Min=13, Avg=52,5, 90=92, 99=185, 99.9=342, 99.99=969] 
2024-09-20 18:36:25:601 74 sec: 2058601 operations; 18889 current ops/sec; est completion in 16 seconds [READ: Count=9418, Max=435, Min=13, Avg=49,77, 90=91, 99=169, 99.9=285, 99.99=413] [UPDATE: Count=9472, Max=387, Min=13, Avg=53,55, 90=100, 99=194, 99.9=326, 99.99=372] 
2024-09-20 18:36:26:601 75 sec: 2080172 operations; 21571 current ops/sec; est completion in 16 seconds [READ: Count=10728, Max=386, Min=13, Avg=44,29, 90=77, 99=146, 99.9=231, 99.99=344] [UPDATE: Count=10846, Max=472, Min=13, Avg=46,06, 90=82, 99=158, 99.9=253, 99.99=324] 
2024-09-20 18:36:27:601 76 sec: 2114077 operations; 33905 current ops/sec; est completion in 14 seconds [READ: Count=17030, Max=288, Min=13, Avg=28,06, 90=52, 99=100, 99.9=187, 99.99=214] [UPDATE: Count=16879, Max=373, Min=12, Avg=28,96, 90=56, 99=104, 99.9=198, 99.99=253] 
2024-09-20 18:36:28:601 77 sec: 2148491 operations; 34414 current ops/sec; est completion in 13 seconds [READ: Count=17201, Max=5355, Min=13, Avg=27,99, 90=51, 99=96, 99.9=179, 99.99=264] [UPDATE: Count=17208, Max=1211, Min=13, Avg=28,1, 90=54, 99=106, 99.9=176, 99.99=659] 
2024-09-20 18:36:29:601 78 sec: 2184252 operations; 35761 current ops/sec; est completion in 12 seconds [READ: Count=17905, Max=368, Min=13, Avg=26,56, 90=48, 99=94, 99.9=159, 99.99=246] [UPDATE: Count=17856, Max=567, Min=13, Avg=27,37, 90=50, 99=98, 99.9=161, 99.99=214] 
2024-09-20 18:36:30:601 79 sec: 2222771 operations; 38519 current ops/sec; est completion in 10 seconds [READ: Count=19423, Max=996, Min=12, Avg=24,37, 90=41, 99=73, 99.9=133, 99.99=198] [UPDATE: Count=19096, Max=3783, Min=13, Avg=25,64, 90=43, 99=79, 99.9=142, 99.99=271] 
2024-09-20 18:36:31:601 80 sec: 2272324 operations; 49553 current ops/sec; est completion in 9 second [READ: Count=24753, Max=205, Min=13, Avg=19,02, 90=27, 99=57, 99.9=109, 99.99=197] [UPDATE: Count=24805, Max=235, Min=12, Avg=19,57, 90=29, 99=62, 99.9=122, 99.99=198] 
2024-09-20 18:36:32:601 81 sec: 2320301 operations; 47977 current ops/sec; est completion in 7 second [READ: Count=23858, Max=951, Min=12, Avg=19,53, 90=29, 99=64, 99.9=148, 99.99=381] [UPDATE: Count=24110, Max=1172, Min=12, Avg=20,37, 90=32, 99=73, 99.9=159, 99.99=547] 
2024-09-20 18:36:33:601 82 sec: 2364167 operations; 43866 current ops/sec; est completion in 5 second [READ: Count=21952, Max=1075, Min=12, Avg=21,47, 90=35, 99=79, 99.9=182, 99.99=822] [UPDATE: Count=21915, Max=347, Min=12, Avg=22,22, 90=37, 99=88, 99.9=198, 99.99=277] 
2024-09-20 18:36:34:601 83 sec: 2402803 operations; 38636 current ops/sec; est completion in 4 second [READ: Count=19464, Max=10399, Min=12, Avg=24,81, 90=39, 99=80, 99.9=150, 99.99=755] [UPDATE: Count=19179, Max=335, Min=12, Avg=24,99, 90=41, 99=85, 99.9=157, 99.99=221] 
2024-09-20 18:36:35:601 84 sec: 2447109 operations; 44306 current ops/sec; est completion in 2 second [READ: Count=21999, Max=291, Min=12, Avg=21,28, 90=37, 99=64, 99.9=126, 99.99=179] [UPDATE: Count=22303, Max=266, Min=11, Avg=21,99, 90=40, 99=67, 99.9=132, 99.99=240] 
2024-09-20 18:36:36:601 85 sec: 2496909 operations; 49800 current ops/sec; est completion in 1 second [READ: Count=25048, Max=2601, Min=12, Avg=18,61, 90=27, 99=44, 99.9=119, 99.99=468] [UPDATE: Count=24754, Max=10711, Min=12, Avg=19,72, 90=30, 99=49, 99.9=127, 99.99=2913] 
2024-09-20 18:36:36:676 85 sec: 2500000 operations; 40671,05 current ops/sec; [READ: Count=1502, Max=66, Min=12, Avg=22,56, 90=28, 99=41, 99.9=58, 99.99=66] [CLEANUP: Count=1, Max=690, Min=690, Avg=690, 90=690, 99=690, 99.9=690, 99.99=690] [UPDATE: Count=1581, Max=122, Min=12, Avg=23,66, 90=30, 99=39, 99.9=97, 99.99=122] 
[OVERALL], RunTime(ms), 85076
[OVERALL], Throughput(ops/sec), 29385.490620151395
[TOTAL_GCS_G1_Young_Generation], Count, 31
[TOTAL_GC_TIME_G1_Young_Generation], Time(ms), 22
[TOTAL_GC_TIME_%_G1_Young_Generation], Time(%), 0.025859231745733225
[TOTAL_GCS_G1_Old_Generation], Count, 0
[TOTAL_GC_TIME_G1_Old_Generation], Time(ms), 0
[TOTAL_GC_TIME_%_G1_Old_Generation], Time(%), 0.0
[TOTAL_GCs], Count, 31
[TOTAL_GC_TIME], Time(ms), 22
[TOTAL_GC_TIME_%], Time(%), 0.025859231745733225
[READ], Operations, 1249815
[READ], AverageLatency(us), 32.631207818757176
[READ], MinLatency(us), 12
[READ], MaxLatency(us), 10399
[READ], 95thPercentileLatency(us), 75
[READ], 99thPercentileLatency(us), 123
[READ], Return=OK, 1249815
[CLEANUP], Operations, 1
[CLEANUP], AverageLatency(us), 690.0
[CLEANUP], MinLatency(us), 690
[CLEANUP], MaxLatency(us), 690
[CLEANUP], 95thPercentileLatency(us), 690
[CLEANUP], 99thPercentileLatency(us), 690
[UPDATE], Operations, 1250185
[UPDATE], AverageLatency(us), 33.335124001647756
[UPDATE], MinLatency(us), 11
[UPDATE], MaxLatency(us), 10711
[UPDATE], 95thPercentileLatency(us), 79
[UPDATE], 99thPercentileLatency(us), 131
[UPDATE], Return=OK, 1250185
