/usr/bin/java  -classpath /home/sebastiaoamaro/phd/torefidevel/tests/redis/ycsb-0.17.0/conf:/home/sebastiaoamaro/phd/torefidevel/tests/redis/ycsb-0.17.0/lib/HdrHistogram-2.1.4.jar:/home/sebastiaoamaro/phd/torefidevel/tests/redis/ycsb-0.17.0/lib/core-0.17.0.jar:/home/sebastiaoamaro/phd/torefidevel/tests/redis/ycsb-0.17.0/lib/htrace-core4-4.1.0-incubating.jar:/home/sebastiaoamaro/phd/torefidevel/tests/redis/ycsb-0.17.0/lib/jackson-core-asl-1.9.4.jar:/home/sebastiaoamaro/phd/torefidevel/tests/redis/ycsb-0.17.0/lib/jackson-mapper-asl-1.9.4.jar:/home/sebastiaoamaro/phd/torefidevel/tests/redis/ycsb-0.17.0/redis-binding/lib/commons-pool2-2.4.2.jar:/home/sebastiaoamaro/phd/torefidevel/tests/redis/ycsb-0.17.0/redis-binding/lib/jedis-2.9.0.jar:/home/sebastiaoamaro/phd/torefidevel/tests/redis/ycsb-0.17.0/redis-binding/lib/redis-binding-0.17.0.jar site.ycsb.Client -t -db site.ycsb.db.RedisClient -P workloads/workloada -s -p status.interval=1 -p operationcount=1000000 -p redis.host=172.38.0.11 -p redis.port=6379 -p redis.cluster=true -s
Command line: -t -db site.ycsb.db.RedisClient -P workloads/workloada -s -p status.interval=1 -p operationcount=1000000 -p redis.host=172.38.0.11 -p redis.port=6379 -p redis.cluster=true -s
YCSB Client 0.17.0

Loading workload...
Starting test.
2024-07-18 22:53:35:885 0 sec: 0 operations; est completion in 0 second 
DBWrapper: report latency for each error is false and specific error codes to track for latency are: []
2024-07-18 22:53:36:864 1 sec: 14272 operations; 14272 current ops/sec; est completion in 1 minute [READ: Count=7096, Max=2711, Min=15, Avg=54,4, 90=86, 99=204, 99.9=379, 99.99=2599] [UPDATE: Count=7250, Max=2625, Min=15, Avg=61,67, 90=102, 99=224, 99.9=404, 99.99=2016] 
2024-07-18 22:53:37:864 2 sec: 28375 operations; 14103 current ops/sec; est completion in 1 minute [READ: Count=7095, Max=982, Min=15, Avg=64,16, 90=109, 99=230, 99.9=455, 99.99=656] [UPDATE: Count=6958, Max=853, Min=14, Avg=71,25, 90=124, 99=271, 99.9=454, 99.99=847] 
2024-07-18 22:53:38:865 3 sec: 38898 operations; 10523 current ops/sec; est completion in 1 minute [READ: Count=5263, Max=560, Min=15, Avg=88,62, 90=158, 99=313, 99.9=455, 99.99=499] [UPDATE: Count=5241, Max=1841, Min=16, Avg=93,29, 90=174, 99=329, 99.9=442, 99.99=560] 
2024-07-18 22:53:39:865 4 sec: 49954 operations; 11056 current ops/sec; est completion in 1 minute [READ: Count=5635, Max=615, Min=17, Avg=84,19, 90=147, 99=296, 99.9=421, 99.99=537] [UPDATE: Count=5427, Max=1883, Min=17, Avg=89,13, 90=159, 99=312, 99.9=472, 99.99=1043] 
2024-07-18 22:53:40:865 5 sec: 62298 operations; 12344 current ops/sec; est completion in 1 minute [READ: Count=6211, Max=1251, Min=16, Avg=75,05, 90=142, 99=343, 99.9=668, 99.99=893] [UPDATE: Count=6138, Max=831, Min=14, Avg=79,94, 90=154, 99=374, 99.9=575, 99.99=809] 
2024-07-18 22:53:41:864 6 sec: 73015 operations; 10717 current ops/sec; est completion in 1 minute [READ: Count=5286, Max=1062, Min=15, Avg=88,71, 90=186, 99=404, 99.9=638, 99.99=923] [UPDATE: Count=5438, Max=1113, Min=14, Avg=91,83, 90=193, 99=417, 99.9=733, 99.99=1081] 
2024-07-18 22:53:42:865 7 sec: 81891 operations; 8876 current ops/sec; est completion in 1 minute [READ: Count=4369, Max=917, Min=16, Avg=105,1, 90=196, 99=384, 99.9=566, 99.99=917] [UPDATE: Count=4498, Max=1042, Min=16, Avg=113,12, 90=216, 99=427, 99.9=685, 99.99=1042] 
2024-07-18 22:53:43:865 8 sec: 93469 operations; 11578 current ops/sec; est completion in 1 minute [READ: Count=5797, Max=468, Min=16, Avg=80,62, 90=141, 99=283, 99.9=390, 99.99=455] [UPDATE: Count=5780, Max=499, Min=15, Avg=86,46, 90=154, 99=303, 99.9=420, 99.99=455] 
2024-07-18 22:53:44:864 9 sec: 104017 operations; 10548 current ops/sec; est completion in 1 minute [READ: Count=5247, Max=1998, Min=15, Avg=87,84, 90=187, 99=401, 99.9=849, 99.99=1879] [UPDATE: Count=5307, Max=2565, Min=15, Avg=93,6, 90=195, 99=439, 99.9=856, 99.99=1126] 
2024-07-18 22:53:45:864 10 sec: 118977 operations; 14960 current ops/sec; est completion in 1 minute [READ: Count=7410, Max=910, Min=15, Avg=61,03, 90=108, 99=297, 99.9=618, 99.99=889] [UPDATE: Count=7536, Max=971, Min=14, Avg=69,04, 90=125, 99=358, 99.9=555, 99.99=727] 
2024-07-18 22:53:46:864 11 sec: 133445 operations; 14468 current ops/sec; est completion in 1 minute [READ: Count=7263, Max=1314, Min=14, Avg=63,77, 90=113, 99=265, 99.9=439, 99.99=710] [UPDATE: Count=7216, Max=852, Min=14, Avg=70,5, 90=130, 99=295, 99.9=494, 99.99=795] 
2024-07-18 22:53:47:864 12 sec: 152286 operations; 18841 current ops/sec; est completion in 1 minute [READ: Count=9445, Max=1893, Min=13, Avg=48,63, 90=85, 99=253, 99.9=614, 99.99=1679] [UPDATE: Count=9398, Max=1681, Min=14, Avg=54,22, 90=99, 99=316, 99.9=622, 99.99=1033] 
2024-07-18 22:53:48:865 13 sec: 169509 operations; 17223 current ops/sec; est completion in 1 minute [READ: Count=8548, Max=1880, Min=14, Avg=53,43, 90=91, 99=248, 99.9=539, 99.99=943] [UPDATE: Count=8672, Max=1077, Min=13, Avg=59,29, 90=104, 99=275, 99.9=503, 99.99=897] 
2024-07-18 22:53:49:865 14 sec: 185859 operations; 16350 current ops/sec; est completion in 1 minute [READ: Count=8181, Max=1896, Min=14, Avg=55,12, 90=95, 99=278, 99.9=709, 99.99=1315] [UPDATE: Count=8161, Max=2595, Min=14, Avg=63,75, 90=115, 99=336, 99.9=762, 99.99=1648] 
2024-07-18 22:53:50:864 15 sec: 202977 operations; 17118 current ops/sec; est completion in 59 seconds [READ: Count=8432, Max=2181, Min=14, Avg=52,84, 90=90, 99=216, 99.9=563, 99.99=1653] [UPDATE: Count=8697, Max=1453, Min=14, Avg=59,65, 90=104, 99=260, 99.9=572, 99.99=859] 
2024-07-18 22:53:51:864 16 sec: 220604 operations; 17627 current ops/sec; est completion in 57 seconds [READ: Count=8859, Max=1337, Min=14, Avg=51,89, 90=88, 99=238, 99.9=473, 99.99=1330] [UPDATE: Count=8758, Max=837, Min=14, Avg=58,04, 90=101, 99=269, 99.9=482, 99.99=818] 
2024-07-18 22:53:52:865 17 sec: 229058 operations; 8454 current ops/sec; est completion in 58 seconds [READ: Count=4235, Max=1316, Min=17, Avg=108,62, 90=221, 99=424, 99.9=648, 99.99=1316] [UPDATE: Count=4215, Max=731, Min=16, Avg=122,12, 90=264, 99=464, 99.9=627, 99.99=731] 
2024-07-18 22:53:53:865 18 sec: 247703 operations; 18645 current ops/sec; est completion in 55 seconds [READ: Count=9367, Max=729, Min=14, Avg=48,81, 90=78, 99=245, 99.9=470, 99.99=667] [UPDATE: Count=9280, Max=1387, Min=14, Avg=55,13, 90=91, 99=289, 99.9=551, 99.99=916] 
2024-07-18 22:53:54:864 19 sec: 264328 operations; 16625 current ops/sec; est completion in 53 seconds [READ: Count=8298, Max=1166, Min=14, Avg=54,89, 90=94, 99=237, 99.9=558, 99.99=957] [UPDATE: Count=8335, Max=2511, Min=14, Avg=61,38, 90=111, 99=264, 99.9=464, 99.99=1297] 
2024-07-18 22:53:55:864 20 sec: 278544 operations; 14216 current ops/sec; est completion in 52 seconds [READ: Count=6978, Max=1727, Min=15, Avg=63,77, 90=118, 99=260, 99.9=450, 99.99=918] [UPDATE: Count=7254, Max=787, Min=15, Avg=72,71, 90=138, 99=305, 99.9=556, 99.99=608] 
2024-07-18 22:53:56:864 21 sec: 292533 operations; 13989 current ops/sec; est completion in 51 seconds [READ: Count=6968, Max=511, Min=16, Avg=66,41, 90=103, 99=209, 99.9=328, 99.99=399] [UPDATE: Count=7005, Max=662, Min=16, Avg=73,08, 90=118, 99=243, 99.9=375, 99.99=408] 
2024-07-18 22:53:57:865 22 sec: 302139 operations; 9606 current ops/sec; est completion in 51 seconds [READ: Count=4755, Max=1133, Min=18, Avg=95,88, 90=201, 99=406, 99.9=724, 99.99=1133] [UPDATE: Count=4843, Max=878, Min=17, Avg=107,22, 90=232, 99=457, 99.9=748, 99.99=878] 
2024-07-18 22:53:58:865 23 sec: 313608 operations; 11469 current ops/sec; est completion in 51 seconds [READ: Count=5815, Max=1152, Min=14, Avg=78,23, 90=152, 99=335, 99.9=463, 99.99=964] [UPDATE: Count=5659, Max=2643, Min=14, Avg=90,96, 90=185, 99=395, 99.9=742, 99.99=1400] 
2024-07-18 22:53:59:865 24 sec: 329519 operations; 15911 current ops/sec; est completion in 49 seconds [READ: Count=7953, Max=1168, Min=13, Avg=58,37, 90=118, 99=326, 99.9=709, 99.99=1078] [UPDATE: Count=7955, Max=1014, Min=14, Avg=63,61, 90=126, 99=389, 99.9=730, 99.99=980] 
2024-07-18 22:54:00:865 25 sec: 343930 operations; 14411 current ops/sec; est completion in 48 seconds [READ: Count=7245, Max=1137, Min=14, Avg=63,51, 90=123, 99=322, 99.9=601, 99.99=982] [UPDATE: Count=7165, Max=1841, Min=14, Avg=71,27, 90=140, 99=381, 99.9=804, 99.99=1500] 
2024-07-18 22:54:01:864 26 sec: 353287 operations; 9357 current ops/sec; est completion in 48 seconds [READ: Count=4640, Max=4271, Min=14, Avg=98,32, 90=197, 99=338, 99.9=543, 99.99=4271] [UPDATE: Count=4725, Max=995, Min=14, Avg=108,88, 90=219, 99=411, 99.9=703, 99.99=995] 
2024-07-18 22:54:02:864 27 sec: 366115 operations; 12828 current ops/sec; est completion in 47 seconds [READ: Count=6444, Max=2257, Min=21, Avg=72,63, 90=120, 99=264, 99.9=507, 99.99=603] [UPDATE: Count=6381, Max=889, Min=23, Avg=78,83, 90=133, 99=302, 99.9=587, 99.99=785] 
2024-07-18 22:54:03:864 28 sec: 378612 operations; 12497 current ops/sec; est completion in 46 seconds [READ: Count=6191, Max=1724, Min=13, Avg=74,24, 90=149, 99=374, 99.9=690, 99.99=929] [UPDATE: Count=6306, Max=1058, Min=14, Avg=81,32, 90=169, 99=403, 99.9=725, 99.99=1036] 
2024-07-18 22:54:04:864 29 sec: 393999 operations; 15387 current ops/sec; est completion in 45 seconds [READ: Count=7761, Max=1758, Min=15, Avg=59,24, 90=99, 99=238, 99.9=582, 99.99=971] [UPDATE: Count=7617, Max=1220, Min=14, Avg=66,85, 90=116, 99=279, 99.9=572, 99.99=906] 
2024-07-18 22:54:05:864 30 sec: 414255 operations; 20256 current ops/sec; est completion in 43 seconds [READ: Count=10019, Max=501, Min=14, Avg=45,38, 90=72, 99=175, 99.9=313, 99.99=492] [UPDATE: Count=10240, Max=754, Min=14, Avg=50,04, 90=82, 99=199, 99.9=359, 99.99=583] 
2024-07-18 22:54:06:864 31 sec: 427429 operations; 13174 current ops/sec; est completion in 42 seconds [READ: Count=6576, Max=1038, Min=14, Avg=70,43, 90=134, 99=316, 99.9=522, 99.99=933] [UPDATE: Count=6601, Max=878, Min=14, Avg=76,99, 90=152, 99=344, 99.9=637, 99.99=860] 
2024-07-18 22:54:07:864 32 sec: 446952 operations; 19523 current ops/sec; est completion in 40 seconds [READ: Count=9725, Max=1397, Min=14, Avg=46,72, 90=73, 99=178, 99.9=322, 99.99=723] [UPDATE: Count=9797, Max=1564, Min=14, Avg=52,54, 90=84, 99=207, 99.9=435, 99.99=1127] 
2024-07-18 22:54:08:864 33 sec: 460903 operations; 13951 current ops/sec; est completion in 39 seconds [READ: Count=6960, Max=772, Min=14, Avg=64,71, 90=132, 99=310, 99.9=497, 99.99=641] [UPDATE: Count=6990, Max=1365, Min=14, Avg=74,63, 90=157, 99=355, 99.9=551, 99.99=1289] 
2024-07-18 22:54:09:864 34 sec: 473377 operations; 12474 current ops/sec; est completion in 38 seconds [READ: Count=6057, Max=1276, Min=14, Avg=72,77, 90=144, 99=348, 99.9=616, 99.99=810] [UPDATE: Count=6417, Max=1397, Min=14, Avg=82,74, 90=171, 99=388, 99.9=693, 99.99=808] 
2024-07-18 22:54:10:864 35 sec: 491587 operations; 18210 current ops/sec; est completion in 37 seconds [READ: Count=9116, Max=910, Min=14, Avg=49,95, 90=83, 99=218, 99.9=440, 99.99=697] [UPDATE: Count=9092, Max=1623, Min=14, Avg=56,45, 90=96, 99=261, 99.9=491, 99.99=717] 
2024-07-18 22:54:11:864 36 sec: 503568 operations; 11981 current ops/sec; est completion in 36 seconds [READ: Count=5960, Max=3287, Min=14, Avg=74,6, 90=149, 99=345, 99.9=681, 99.99=1583] [UPDATE: Count=6027, Max=2913, Min=14, Avg=86,86, 90=181, 99=419, 99.9=976, 99.99=2211] 
2024-07-18 22:54:12:864 37 sec: 520092 operations; 16524 current ops/sec; est completion in 35 seconds [READ: Count=8279, Max=2325, Min=14, Avg=55,67, 90=101, 99=264, 99.9=473, 99.99=860] [UPDATE: Count=8252, Max=1209, Min=14, Avg=61,59, 90=115, 99=295, 99.9=503, 99.99=828] 
2024-07-18 22:54:13:864 38 sec: 531599 operations; 11507 current ops/sec; est completion in 34 seconds [READ: Count=5661, Max=1063, Min=14, Avg=79,5, 90=155, 99=335, 99.9=551, 99.99=677] [UPDATE: Count=5831, Max=807, Min=13, Avg=89,49, 90=182, 99=385, 99.9=535, 99.99=694] 
2024-07-18 22:54:14:864 39 sec: 545890 operations; 14291 current ops/sec; est completion in 33 seconds [READ: Count=7145, Max=554, Min=14, Avg=65,22, 90=107, 99=228, 99.9=365, 99.99=500] [UPDATE: Count=7149, Max=511, Min=14, Avg=70,95, 90=120, 99=247, 99.9=425, 99.99=470] 
2024-07-18 22:54:15:864 40 sec: 556493 operations; 10603 current ops/sec; est completion in 32 seconds [READ: Count=5264, Max=898, Min=14, Avg=85,28, 90=161, 99=335, 99.9=665, 99.99=859] [UPDATE: Count=5337, Max=916, Min=14, Avg=98,13, 90=190, 99=429, 99.9=661, 99.99=851] 
2024-07-18 22:54:16:864 41 sec: 570877 operations; 14384 current ops/sec; est completion in 31 seconds [READ: Count=7204, Max=899, Min=14, Avg=63,97, 90=119, 99=334, 99.9=588, 99.99=715] [UPDATE: Count=7182, Max=1149, Min=14, Avg=71, 90=132, 99=388, 99.9=747, 99.99=1053] 
2024-07-18 22:54:17:865 42 sec: 583102 operations; 12225 current ops/sec; est completion in 31 seconds [READ: Count=6122, Max=853, Min=14, Avg=74,56, 90=132, 99=285, 99.9=502, 99.99=793] [UPDATE: Count=6100, Max=878, Min=14, Avg=84,8, 90=156, 99=347, 99.9=539, 99.99=812] 
2024-07-18 22:54:18:864 43 sec: 594956 operations; 11854 current ops/sec; est completion in 30 seconds [READ: Count=5995, Max=5471, Min=14, Avg=78,98, 90=159, 99=367, 99.9=681, 99.99=1315] [UPDATE: Count=5866, Max=1381, Min=14, Avg=85,87, 90=173, 99=412, 99.9=714, 99.99=846] 
2024-07-18 22:54:19:864 44 sec: 605434 operations; 10478 current ops/sec; est completion in 29 seconds [READ: Count=5198, Max=1888, Min=14, Avg=86,79, 90=176, 99=369, 99.9=711, 99.99=890] [UPDATE: Count=5280, Max=1352, Min=14, Avg=97,47, 90=210, 99=419, 99.9=634, 99.99=749] 
2024-07-18 22:54:20:864 45 sec: 621901 operations; 16467 current ops/sec; est completion in 28 seconds [READ: Count=8074, Max=469, Min=14, Avg=56,35, 90=95, 99=199, 99.9=329, 99.99=437] [UPDATE: Count=8387, Max=634, Min=14, Avg=61,58, 90=108, 99=225, 99.9=380, 99.99=555] 
2024-07-18 22:54:21:864 46 sec: 630529 operations; 8628 current ops/sec; est completion in 27 seconds [READ: Count=4263, Max=837, Min=27, Avg=105,78, 90=192, 99=361, 99.9=495, 99.99=837] [UPDATE: Count=4373, Max=881, Min=26, Avg=119,79, 90=220, 99=400, 99.9=689, 99.99=881] 
2024-07-18 22:54:22:864 47 sec: 640330 operations; 9801 current ops/sec; est completion in 27 seconds [READ: Count=4960, Max=731, Min=15, Avg=94,21, 90=167, 99=316, 99.9=494, 99.99=731] [UPDATE: Count=4841, Max=726, Min=15, Avg=104,65, 90=193, 99=389, 99.9=533, 99.99=726] 
2024-07-18 22:54:23:865 48 sec: 650806 operations; 10476 current ops/sec; est completion in 26 seconds [READ: Count=5200, Max=849, Min=14, Avg=87,7, 90=164, 99=345, 99.9=522, 99.99=646] [UPDATE: Count=5268, Max=780, Min=14, Avg=98,26, 90=191, 99=384, 99.9=582, 99.99=667] 
2024-07-18 22:54:24:864 49 sec: 660080 operations; 9274 current ops/sec; est completion in 26 seconds [READ: Count=4611, Max=2065, Min=19, Avg=99,52, 90=195, 99=425, 99.9=791, 99.99=2065] [UPDATE: Count=4674, Max=928, Min=20, Avg=109,53, 90=215, 99=476, 99.9=815, 99.99=928] 
2024-07-18 22:54:25:864 50 sec: 670883 operations; 10803 current ops/sec; est completion in 25 seconds [READ: Count=5367, Max=6991, Min=15, Avg=85,33, 90=183, 99=506, 99.9=1629, 99.99=4327] [UPDATE: Count=5437, Max=5835, Min=15, Avg=94,08, 90=204, 99=520, 99.9=2373, 99.99=5523] 
2024-07-18 22:54:26:864 51 sec: 689440 operations; 18557 current ops/sec; est completion in 23 seconds [READ: Count=9171, Max=1335, Min=14, Avg=49,91, 90=85, 99=227, 99.9=462, 99.99=819] [UPDATE: Count=9376, Max=828, Min=14, Avg=54,26, 90=96, 99=240, 99.9=440, 99.99=709] 
2024-07-18 22:54:27:864 52 sec: 703288 operations; 13848 current ops/sec; est completion in 22 seconds [READ: Count=7031, Max=943, Min=14, Avg=65,94, 90=123, 99=246, 99.9=460, 99.99=730] [UPDATE: Count=6839, Max=1443, Min=14, Avg=74,1, 90=143, 99=295, 99.9=498, 99.99=679] 
2024-07-18 22:54:28:865 53 sec: 714341 operations; 11053 current ops/sec; est completion in 22 seconds [READ: Count=5540, Max=734, Min=15, Avg=83,11, 90=150, 99=294, 99.9=404, 99.99=704] [UPDATE: Count=5494, Max=1194, Min=16, Avg=93,25, 90=167, 99=359, 99.9=593, 99.99=725] 
2024-07-18 22:54:29:865 54 sec: 727167 operations; 12826 current ops/sec; est completion in 21 seconds [READ: Count=6422, Max=818, Min=14, Avg=70,57, 90=128, 99=290, 99.9=548, 99.99=748] [UPDATE: Count=6400, Max=965, Min=15, Avg=81,32, 90=152, 99=357, 99.9=713, 99.99=946] 
2024-07-18 22:54:30:864 55 sec: 740102 operations; 12935 current ops/sec; est completion in 20 seconds [READ: Count=6527, Max=1184, Min=14, Avg=70,9, 90=122, 99=258, 99.9=499, 99.99=884] [UPDATE: Count=6410, Max=2018, Min=14, Avg=79,44, 90=143, 99=319, 99.9=520, 99.99=799] 
2024-07-18 22:54:31:864 56 sec: 750577 operations; 10475 current ops/sec; est completion in 19 seconds [READ: Count=5279, Max=713, Min=15, Avg=88,25, 90=166, 99=363, 99.9=590, 99.99=660] [UPDATE: Count=5196, Max=966, Min=15, Avg=97,97, 90=191, 99=412, 99.9=687, 99.99=889] 
2024-07-18 22:54:32:864 57 sec: 765513 operations; 14936 current ops/sec; est completion in 18 seconds [READ: Count=7374, Max=8519, Min=14, Avg=62,47, 90=122, 99=308, 99.9=569, 99.99=1119] [UPDATE: Count=7575, Max=1315, Min=14, Avg=66,99, 90=131, 99=349, 99.9=673, 99.99=1064] 
2024-07-18 22:54:33:864 58 sec: 778035 operations; 12522 current ops/sec; est completion in 17 seconds [READ: Count=6267, Max=772, Min=15, Avg=74,61, 90=127, 99=254, 99.9=393, 99.99=561] [UPDATE: Count=6242, Max=559, Min=14, Avg=80,91, 90=144, 99=284, 99.9=404, 99.99=553] 
2024-07-18 22:54:34:864 59 sec: 790884 operations; 12849 current ops/sec; est completion in 16 seconds [READ: Count=6447, Max=1515, Min=15, Avg=71,46, 90=134, 99=350, 99.9=682, 99.99=972] [UPDATE: Count=6402, Max=2183, Min=15, Avg=79,78, 90=158, 99=395, 99.9=606, 99.99=995] 
2024-07-18 22:54:35:865 60 sec: 802490 operations; 11606 current ops/sec; est completion in 15 seconds [READ: Count=5860, Max=824, Min=19, Avg=78,62, 90=134, 99=343, 99.9=597, 99.99=758] [UPDATE: Count=5746, Max=1139, Min=19, Avg=89,35, 90=155, 99=410, 99.9=589, 99.99=1068] 
2024-07-18 22:54:36:864 61 sec: 815003 operations; 12513 current ops/sec; est completion in 14 seconds [READ: Count=6313, Max=2583, Min=14, Avg=72,34, 90=147, 99=383, 99.9=736, 99.99=1292] [UPDATE: Count=6199, Max=2853, Min=14, Avg=82,69, 90=166, 99=467, 99.9=1186, 99.99=2059] 
2024-07-18 22:54:37:864 62 sec: 826516 operations; 11513 current ops/sec; est completion in 14 seconds [READ: Count=5862, Max=916, Min=14, Avg=79,89, 90=142, 99=275, 99.9=408, 99.99=722] [UPDATE: Count=5650, Max=895, Min=15, Avg=89,3, 90=164, 99=314, 99.9=479, 99.99=888] 
2024-07-18 22:54:38:864 63 sec: 837478 operations; 10962 current ops/sec; est completion in 13 seconds [READ: Count=5395, Max=1337, Min=15, Avg=83,61, 90=184, 99=403, 99.9=764, 99.99=1079] [UPDATE: Count=5567, Max=1224, Min=14, Avg=93,79, 90=221, 99=458, 99.9=784, 99.99=1167] 
2024-07-18 22:54:39:864 64 sec: 851572 operations; 14094 current ops/sec; est completion in 12 seconds [READ: Count=7070, Max=993, Min=13, Avg=64,88, 90=126, 99=276, 99.9=479, 99.99=876] [UPDATE: Count=7026, Max=4255, Min=14, Avg=72,81, 90=143, 99=325, 99.9=523, 99.99=1646] 
2024-07-18 22:54:40:864 65 sec: 862803 operations; 11231 current ops/sec; est completion in 11 seconds [READ: Count=5634, Max=861, Min=16, Avg=81,55, 90=152, 99=301, 99.9=487, 99.99=776] [UPDATE: Count=5593, Max=840, Min=15, Avg=91,94, 90=178, 99=361, 99.9=637, 99.99=757] 
2024-07-18 22:54:41:864 66 sec: 874879 operations; 12076 current ops/sec; est completion in 10 seconds [READ: Count=6005, Max=566, Min=14, Avg=76,19, 90=154, 99=305, 99.9=457, 99.99=549] [UPDATE: Count=6075, Max=742, Min=14, Avg=85,13, 90=179, 99=351, 99.9=546, 99.99=700] 
2024-07-18 22:54:42:865 67 sec: 885197 operations; 10318 current ops/sec; est completion in 9 second [READ: Count=5226, Max=636, Min=15, Avg=88,62, 90=164, 99=311, 99.9=447, 99.99=502] [UPDATE: Count=5093, Max=670, Min=15, Avg=100,26, 90=189, 99=360, 99.9=575, 99.99=664] 
2024-07-18 22:54:43:864 68 sec: 896907 operations; 11710 current ops/sec; est completion in 8 second [READ: Count=5938, Max=751, Min=15, Avg=79,01, 90=145, 99=283, 99.9=419, 99.99=494] [UPDATE: Count=5770, Max=1286, Min=15, Avg=87,36, 90=163, 99=314, 99.9=579, 99.99=1111] 
2024-07-18 22:54:44:864 69 sec: 909329 operations; 12422 current ops/sec; est completion in 7 second [READ: Count=6253, Max=904, Min=14, Avg=74,22, 90=138, 99=272, 99.9=402, 99.99=550] [UPDATE: Count=6170, Max=543, Min=15, Avg=82,35, 90=156, 99=309, 99.9=465, 99.99=521] 
2024-07-18 22:54:45:864 70 sec: 931183 operations; 21854 current ops/sec; est completion in 6 second [READ: Count=10843, Max=1977, Min=14, Avg=42,27, 90=65, 99=185, 99.9=439, 99.99=1893] [UPDATE: Count=11008, Max=1695, Min=14, Avg=46,33, 90=74, 99=209, 99.9=424, 99.99=1445] 
2024-07-18 22:54:46:864 71 sec: 950913 operations; 19730 current ops/sec; est completion in 4 second [READ: Count=9887, Max=2793, Min=13, Avg=47,35, 90=77, 99=203, 99.9=565, 99.99=1289] [UPDATE: Count=9847, Max=1780, Min=13, Avg=50,96, 90=84, 99=214, 99.9=612, 99.99=1476] 
2024-07-18 22:54:47:864 72 sec: 966154 operations; 15241 current ops/sec; est completion in 3 second [READ: Count=7613, Max=639, Min=14, Avg=60,84, 90=119, 99=268, 99.9=406, 99.99=634] [UPDATE: Count=7631, Max=670, Min=14, Avg=66,51, 90=129, 99=306, 99.9=508, 99.99=659] 
2024-07-18 22:54:48:864 73 sec: 981402 operations; 15248 current ops/sec; est completion in 2 second [READ: Count=7624, Max=2931, Min=14, Avg=61,03, 90=102, 99=260, 99.9=619, 99.99=1548] [UPDATE: Count=7625, Max=1602, Min=14, Avg=66,35, 90=118, 99=273, 99.9=506, 99.99=1235] 
2024-07-18 22:54:49:864 74 sec: 992867 operations; 11465 current ops/sec; est completion in 1 second [READ: Count=5736, Max=626, Min=17, Avg=80,29, 90=131, 99=245, 99.9=380, 99.99=615] [UPDATE: Count=5721, Max=549, Min=17, Avg=89,62, 90=155, 99=304, 99.9=448, 99.99=535] 
2024-07-18 22:54:50:501 74 sec: 1000000 operations; 11197,8 current ops/sec; [READ: Count=3555, Max=720, Min=14, Avg=82,58, 90=152, 99=275, 99.9=448, 99.99=720] [CLEANUP: Count=1, Max=1529, Min=1529, Avg=1529, 90=1529, 99=1529, 99.9=1529, 99.99=1529] [UPDATE: Count=3574, Max=771, Min=14, Avg=90,82, 90=167, 99=332, 99.9=486, 99.99=771] 
[OVERALL], RunTime(ms), 74637
[OVERALL], Throughput(ops/sec), 13398.180527084422
[TOTAL_GCS_G1_Young_Generation], Count, 13
[TOTAL_GC_TIME_G1_Young_Generation], Time(ms), 41
[TOTAL_GC_TIME_%_G1_Young_Generation], Time(%), 0.05493254016104613
[TOTAL_GCS_G1_Old_Generation], Count, 0
[TOTAL_GC_TIME_G1_Old_Generation], Time(ms), 0
[TOTAL_GC_TIME_%_G1_Old_Generation], Time(%), 0.0
[TOTAL_GCs], Count, 13
[TOTAL_GC_TIME], Time(ms), 41
[TOTAL_GC_TIME_%], Time(%), 0.05493254016104613
[READ], Operations, 499415
[READ], AverageLatency(us), 68.47787110919776
[READ], MinLatency(us), 13
[READ], MaxLatency(us), 8519
[READ], 95thPercentileLatency(us), 179
[READ], 99thPercentileLatency(us), 306
[READ], Return=OK, 499415
[CLEANUP], Operations, 1
[CLEANUP], AverageLatency(us), 1529.0
[CLEANUP], MinLatency(us), 1529
[CLEANUP], MaxLatency(us), 1529
[CLEANUP], 95thPercentileLatency(us), 1529
[CLEANUP], 99thPercentileLatency(us), 1529
[UPDATE], Operations, 500585
[UPDATE], AverageLatency(us), 76.04807375370817
[UPDATE], MinLatency(us), 13
[UPDATE], MaxLatency(us), 5835
[UPDATE], 95thPercentileLatency(us), 205
[UPDATE], 99thPercentileLatency(us), 351
[UPDATE], Return=OK, 500585
