/usr/bin/java  -classpath /home/sebastiaoamaro/phd/torefidevel/tests/redis/ycsb-0.17.0/conf:/home/sebastiaoamaro/phd/torefidevel/tests/redis/ycsb-0.17.0/lib/HdrHistogram-2.1.4.jar:/home/sebastiaoamaro/phd/torefidevel/tests/redis/ycsb-0.17.0/lib/core-0.17.0.jar:/home/sebastiaoamaro/phd/torefidevel/tests/redis/ycsb-0.17.0/lib/htrace-core4-4.1.0-incubating.jar:/home/sebastiaoamaro/phd/torefidevel/tests/redis/ycsb-0.17.0/lib/jackson-core-asl-1.9.4.jar:/home/sebastiaoamaro/phd/torefidevel/tests/redis/ycsb-0.17.0/lib/jackson-mapper-asl-1.9.4.jar:/home/sebastiaoamaro/phd/torefidevel/tests/redis/ycsb-0.17.0/redis-binding/lib/commons-pool2-2.4.2.jar:/home/sebastiaoamaro/phd/torefidevel/tests/redis/ycsb-0.17.0/redis-binding/lib/jedis-2.9.0.jar:/home/sebastiaoamaro/phd/torefidevel/tests/redis/ycsb-0.17.0/redis-binding/lib/redis-binding-0.17.0.jar site.ycsb.Client -t -db site.ycsb.db.RedisClient -P workloads/workloada -s -p status.interval=1 -p operationcount=2500000 -p redis.host=172.38.0.11 -p redis.port=6379 -p redis.cluster=true -s
Command line: -t -db site.ycsb.db.RedisClient -P workloads/workloada -s -p status.interval=1 -p operationcount=2500000 -p redis.host=172.38.0.11 -p redis.port=6379 -p redis.cluster=true -s
YCSB Client 0.17.0

Loading workload...
Starting test.
2024-09-17 18:28:29:182 0 sec: 0 operations; est completion in 0 second 
DBWrapper: report latency for each error is false and specific error codes to track for latency are: []
2024-09-17 18:28:30:155 1 sec: 10109 operations; 10109 current ops/sec; est completion in 4 minutes [READ: Count=5065, Max=4727, Min=20, Avg=80,58, 90=122, 99=316, 99.9=813, 99.99=888] [UPDATE: Count=5075, Max=1277, Min=20, Avg=88,81, 90=141, 99=349, 99.9=859, 99.99=914] 
2024-09-17 18:28:31:155 2 sec: 22115 operations; 12006 current ops/sec; est completion in 3 minutes [READ: Count=6083, Max=1157, Min=20, Avg=78,51, 90=132, 99=252, 99.9=880, 99.99=988] [UPDATE: Count=5902, Max=3497, Min=20, Avg=82,42, 90=139, 99=285, 99.9=887, 99.99=1033] 
2024-09-17 18:28:32:155 3 sec: 40578 operations; 18463 current ops/sec; est completion in 3 minutes [READ: Count=9269, Max=510, Min=20, Avg=52,48, 90=79, 99=166, 99.9=344, 99.99=405] [UPDATE: Count=9201, Max=1097, Min=19, Avg=52,11, 90=81, 99=166, 99.9=313, 99.99=844] 
2024-09-17 18:28:33:155 4 sec: 61547 operations; 20969 current ops/sec; est completion in 2 minutes [READ: Count=10547, Max=898, Min=20, Avg=46,07, 90=72, 99=129, 99.9=183, 99.99=238] [UPDATE: Count=10419, Max=840, Min=19, Avg=45,73, 90=72, 99=134, 99.9=268, 99.99=769] 
2024-09-17 18:28:34:155 5 sec: 78721 operations; 17174 current ops/sec; est completion in 2 minutes [READ: Count=8644, Max=916, Min=20, Avg=56,53, 90=95, 99=195, 99.9=342, 99.99=839] [UPDATE: Count=8532, Max=866, Min=16, Avg=56,91, 90=97, 99=209, 99.9=393, 99.99=826] 
2024-09-17 18:28:35:155 6 sec: 96426 operations; 17705 current ops/sec; est completion in 2 minutes [READ: Count=8903, Max=1712, Min=20, Avg=54,73, 90=98, 99=236, 99.9=810, 99.99=1083] [UPDATE: Count=8794, Max=1094, Min=18, Avg=55,38, 90=103, 99=239, 99.9=733, 99.99=1081] 
2024-09-17 18:28:36:155 7 sec: 129351 operations; 32925 current ops/sec; est completion in 2 minutes [READ: Count=16432, Max=927, Min=18, Avg=29,17, 90=51, 99=100, 99.9=189, 99.99=771] [UPDATE: Count=16511, Max=885, Min=18, Avg=29,6, 90=54, 99=105, 99.9=218, 99.99=845] 
2024-09-17 18:28:37:155 8 sec: 160479 operations; 31128 current ops/sec; est completion in 1 minute [READ: Count=15527, Max=1052, Min=14, Avg=31,27, 90=53, 99=149, 99.9=323, 99.99=810] [UPDATE: Count=15589, Max=839, Min=19, Avg=31,01, 90=54, 99=161, 99.9=311, 99.99=687] 
2024-09-17 18:28:38:155 9 sec: 178009 operations; 17530 current ops/sec; est completion in 1 minute [READ: Count=8743, Max=989, Min=18, Avg=55,16, 90=95, 99=218, 99.9=882, 99.99=980] [UPDATE: Count=8789, Max=1066, Min=17, Avg=56,22, 90=100, 99=228, 99.9=845, 99.99=928] 
2024-09-17 18:28:39:155 10 sec: 197245 operations; 19236 current ops/sec; est completion in 1 minute [READ: Count=9562, Max=3059, Min=19, Avg=49,78, 90=91, 99=215, 99.9=459, 99.99=989] [UPDATE: Count=9672, Max=1980, Min=18, Avg=51,62, 90=99, 99=230, 99.9=463, 99.99=1214] 
2024-09-17 18:28:40:155 11 sec: 214265 operations; 17020 current ops/sec; est completion in 1 minute [READ: Count=8663, Max=1662, Min=19, Avg=56,24, 90=94, 99=184, 99.9=678, 99.99=959] [UPDATE: Count=8368, Max=898, Min=19, Avg=58,48, 90=100, 99=192, 99.9=757, 99.99=835] 
2024-09-17 18:28:41:155 12 sec: 231955 operations; 17690 current ops/sec; est completion in 1 minute [READ: Count=8819, Max=945, Min=19, Avg=54,48, 90=93, 99=197, 99.9=404, 99.99=902] [UPDATE: Count=8851, Max=1795, Min=19, Avg=56,19, 90=98, 99=205, 99.9=462, 99.99=904] 
2024-09-17 18:28:42:155 13 sec: 247918 operations; 15963 current ops/sec; est completion in 1 minute [READ: Count=8041, Max=945, Min=19, Avg=59,87, 90=94, 99=178, 99.9=755, 99.99=876] [UPDATE: Count=7924, Max=1452, Min=19, Avg=62,62, 90=99, 99=191, 99.9=565, 99.99=1034] 
2024-09-17 18:28:43:155 14 sec: 274791 operations; 26873 current ops/sec; est completion in 1 minute [READ: Count=13347, Max=1009, Min=17, Avg=35,96, 90=63, 99=107, 99.9=156, 99.99=368] [UPDATE: Count=13532, Max=369, Min=18, Avg=36,41, 90=66, 99=113, 99.9=182, 99.99=290] 
2024-09-17 18:28:44:155 15 sec: 299282 operations; 24491 current ops/sec; est completion in 1 minute [READ: Count=12271, Max=860, Min=19, Avg=38,99, 90=67, 99=136, 99.9=247, 99.99=792] [UPDATE: Count=12222, Max=919, Min=19, Avg=40,6, 90=72, 99=148, 99.9=321, 99.99=862] 
2024-09-17 18:28:45:155 16 sec: 324123 operations; 24841 current ops/sec; est completion in 1 minute [READ: Count=12333, Max=383, Min=19, Avg=38,67, 90=72, 99=141, 99.9=218, 99.99=273] [UPDATE: Count=12500, Max=965, Min=18, Avg=39,8, 90=75, 99=151, 99.9=290, 99.99=901] 
2024-09-17 18:28:46:155 17 sec: 356985 operations; 32862 current ops/sec; est completion in 1 minute [READ: Count=16473, Max=839, Min=18, Avg=29,37, 90=53, 99=113, 99.9=232, 99.99=800] [UPDATE: Count=16399, Max=1491, Min=18, Avg=29,59, 90=56, 99=115, 99.9=214, 99.99=779] 
2024-09-17 18:28:47:155 18 sec: 388318 operations; 31333 current ops/sec; est completion in 1 minute [READ: Count=15553, Max=331, Min=19, Avg=30,93, 90=54, 99=122, 99.9=207, 99.99=293] [UPDATE: Count=15770, Max=280, Min=18, Avg=31,08, 90=57, 99=125, 99.9=208, 99.99=257] 
2024-09-17 18:28:48:155 19 sec: 425098 operations; 36780 current ops/sec; est completion in 1 minute [READ: Count=18269, Max=924, Min=14, Avg=26,13, 90=37, 99=84, 99.9=153, 99.99=291] [UPDATE: Count=18532, Max=423, Min=18, Avg=26,31, 90=38, 99=91, 99.9=169, 99.99=245] 
2024-09-17 18:28:49:155 20 sec: 461475 operations; 36377 current ops/sec; est completion in 1 minute [READ: Count=18210, Max=620, Min=19, Avg=26,46, 90=45, 99=81, 99.9=144, 99.99=227] [UPDATE: Count=18159, Max=303, Min=18, Avg=26,72, 90=44, 99=83, 99.9=161, 99.99=267] 
2024-09-17 18:28:50:155 21 sec: 496318 operations; 34843 current ops/sec; est completion in 1 minute [READ: Count=17471, Max=353, Min=19, Avg=27,77, 90=48, 99=76, 99.9=148, 99.99=216] [UPDATE: Count=17373, Max=315, Min=18, Avg=27,81, 90=50, 99=80, 99.9=159, 99.99=231] 
2024-09-17 18:28:51:155 22 sec: 526554 operations; 30236 current ops/sec; est completion in 1 minute [READ: Count=15192, Max=340, Min=19, Avg=31,92, 90=58, 99=96, 99.9=180, 99.99=278] [UPDATE: Count=15040, Max=835, Min=18, Avg=32,31, 90=61, 99=105, 99.9=164, 99.99=278] 
2024-09-17 18:28:52:155 23 sec: 564179 operations; 37625 current ops/sec; est completion in 1 minute [READ: Count=18923, Max=238, Min=18, Avg=25,5, 90=46, 99=69, 99.9=145, 99.99=217] [UPDATE: Count=18713, Max=287, Min=17, Avg=25,91, 90=50, 99=74, 99.9=155, 99.99=241] 
2024-09-17 18:28:53:155 24 sec: 604843 operations; 40664 current ops/sec; est completion in 1 minute [READ: Count=20143, Max=714, Min=12, Avg=23,72, 90=29, 99=65, 99.9=142, 99.99=238] [UPDATE: Count=20514, Max=280, Min=18, Avg=23,76, 90=29, 99=66, 99.9=149, 99.99=193] 
2024-09-17 18:28:54:155 25 sec: 643620 operations; 38777 current ops/sec; est completion in 1 minute [READ: Count=19464, Max=388, Min=17, Avg=24,95, 90=30, 99=63, 99.9=137, 99.99=319] [UPDATE: Count=19312, Max=343, Min=18, Avg=24,85, 90=29, 99=65, 99.9=147, 99.99=228] 
2024-09-17 18:28:55:155 26 sec: 682789 operations; 39169 current ops/sec; est completion in 1 minute [READ: Count=19351, Max=282, Min=18, Avg=24,64, 90=31, 99=71, 99.9=151, 99.99=253] [UPDATE: Count=19817, Max=351, Min=18, Avg=24,65, 90=31, 99=72, 99.9=142, 99.99=236] 
2024-09-17 18:28:56:155 27 sec: 714571 operations; 31782 current ops/sec; est completion in 1 minute [READ: Count=15874, Max=461, Min=18, Avg=30,38, 90=54, 99=107, 99.9=198, 99.99=389] [UPDATE: Count=15921, Max=884, Min=18, Avg=30,55, 90=55, 99=109, 99.9=179, 99.99=377] 
2024-09-17 18:28:57:155 28 sec: 751754 operations; 37183 current ops/sec; est completion in 1 minute [READ: Count=18507, Max=340, Min=18, Avg=25,87, 90=32, 99=67, 99.9=161, 99.99=329] [UPDATE: Count=18654, Max=774, Min=18, Avg=26,06, 90=33, 99=71, 99.9=150, 99.99=282] 
2024-09-17 18:28:58:155 29 sec: 781400 operations; 29646 current ops/sec; est completion in 1 minute [READ: Count=14834, Max=722, Min=19, Avg=32,53, 90=55, 99=86, 99.9=156, 99.99=217] [UPDATE: Count=14810, Max=285, Min=19, Avg=32,84, 90=58, 99=90, 99.9=170, 99.99=257] 
2024-09-17 18:28:59:155 30 sec: 818411 operations; 37011 current ops/sec; est completion in 1 minute [READ: Count=18665, Max=261, Min=18, Avg=26, 90=38, 99=78, 99.9=164, 99.99=244] [UPDATE: Count=18349, Max=292, Min=18, Avg=26,21, 90=38, 99=83, 99.9=158, 99.99=262] 
2024-09-17 18:29:00:155 31 sec: 852174 operations; 33763 current ops/sec; est completion in 1 minute [READ: Count=17002, Max=455, Min=17, Avg=28,64, 90=51, 99=89, 99.9=166, 99.99=232] [UPDATE: Count=16762, Max=402, Min=18, Avg=28,71, 90=52, 99=92, 99.9=165, 99.99=260] 
2024-09-17 18:29:01:155 32 sec: 888077 operations; 35903 current ops/sec; est completion in 59 seconds [READ: Count=18040, Max=787, Min=17, Avg=26,72, 90=37, 99=67, 99.9=137, 99.99=176] [UPDATE: Count=17860, Max=398, Min=18, Avg=27,07, 90=38, 99=72, 99.9=145, 99.99=255] 
2024-09-17 18:29:02:155 33 sec: 922190 operations; 34113 current ops/sec; est completion in 57 seconds [READ: Count=17113, Max=222, Min=18, Avg=28,08, 90=53, 99=68, 99.9=139, 99.99=200] [UPDATE: Count=17007, Max=2089, Min=18, Avg=28,76, 90=57, 99=74, 99.9=148, 99.99=226] 
2024-09-17 18:29:03:155 34 sec: 960020 operations; 37830 current ops/sec; est completion in 55 seconds [READ: Count=19048, Max=621, Min=16, Avg=25,46, 90=29, 99=65, 99.9=135, 99.99=223] [UPDATE: Count=18778, Max=344, Min=18, Avg=25,52, 90=30, 99=68, 99.9=135, 99.99=233] 
2024-09-17 18:29:04:155 35 sec: 993657 operations; 33637 current ops/sec; est completion in 54 seconds [READ: Count=16935, Max=385, Min=13, Avg=28,63, 90=53, 99=84, 99.9=147, 99.99=269] [UPDATE: Count=16698, Max=272, Min=18, Avg=28,96, 90=56, 99=88, 99.9=164, 99.99=233] 
2024-09-17 18:29:05:155 36 sec: 1019232 operations; 25575 current ops/sec; est completion in 53 seconds [READ: Count=12812, Max=238, Min=19, Avg=37,56, 90=63, 99=112, 99.9=165, 99.99=213] [UPDATE: Count=12762, Max=224, Min=19, Avg=38,6, 90=65, 99=120, 99.9=186, 99.99=223] 
2024-09-17 18:29:06:155 37 sec: 1055485 operations; 36253 current ops/sec; est completion in 51 seconds [READ: Count=18185, Max=622, Min=18, Avg=26,68, 90=47, 99=69, 99.9=151, 99.99=334] [UPDATE: Count=18066, Max=338, Min=16, Avg=26,7, 90=50, 99=72, 99.9=145, 99.99=221] 
2024-09-17 18:29:07:155 38 sec: 1090262 operations; 34777 current ops/sec; est completion in 50 seconds [READ: Count=17348, Max=444, Min=18, Avg=27,77, 90=52, 99=77, 99.9=145, 99.99=237] [UPDATE: Count=17429, Max=229, Min=18, Avg=27,94, 90=55, 99=80, 99.9=143, 99.99=200] 
2024-09-17 18:29:08:155 39 sec: 1119681 operations; 29419 current ops/sec; est completion in 49 seconds [READ: Count=14606, Max=765, Min=19, Avg=32,66, 90=59, 99=96, 99.9=168, 99.99=238] [UPDATE: Count=14812, Max=610, Min=18, Avg=33,37, 90=62, 99=111, 99.9=167, 99.99=271] 
2024-09-17 18:29:09:155 40 sec: 1155045 operations; 35364 current ops/sec; est completion in 47 seconds [READ: Count=17742, Max=719, Min=18, Avg=27,27, 90=41, 99=76, 99.9=153, 99.99=389] [UPDATE: Count=17638, Max=1924, Min=18, Avg=27,4, 90=43, 99=78, 99.9=153, 99.99=230] 
2024-09-17 18:29:10:155 41 sec: 1194794 operations; 39749 current ops/sec; est completion in 45 seconds [READ: Count=19733, Max=615, Min=17, Avg=24,18, 90=30, 99=70, 99.9=133, 99.99=392] [UPDATE: Count=20016, Max=276, Min=18, Avg=24,34, 90=30, 99=75, 99.9=145, 99.99=233] 
2024-09-17 18:29:11:155 42 sec: 1235044 operations; 40250 current ops/sec; est completion in 44 seconds [READ: Count=20182, Max=486, Min=18, Avg=23,88, 90=29, 99=65, 99.9=140, 99.99=222] [UPDATE: Count=20053, Max=331, Min=15, Avg=24,16, 90=29, 99=68, 99.9=163, 99.99=249] 
2024-09-17 18:29:12:155 43 sec: 1270349 operations; 35305 current ops/sec; est completion in 42 seconds [READ: Count=17729, Max=218, Min=18, Avg=27,18, 90=47, 99=89, 99.9=155, 99.99=205] [UPDATE: Count=17574, Max=393, Min=18, Avg=27,66, 90=50, 99=94, 99.9=171, 99.99=242] 
2024-09-17 18:29:13:155 44 sec: 1309752 operations; 39403 current ops/sec; est completion in 40 seconds [READ: Count=19692, Max=1971, Min=19, Avg=24,47, 90=31, 99=66, 99.9=136, 99.99=299] [UPDATE: Count=19725, Max=235, Min=18, Avg=24,54, 90=30, 99=70, 99.9=136, 99.99=220] 
2024-09-17 18:29:14:155 45 sec: 1350800 operations; 41048 current ops/sec; est completion in 39 seconds [READ: Count=20542, Max=293, Min=19, Avg=23,5, 90=30, 99=62, 99.9=128, 99.99=229] [UPDATE: Count=20504, Max=308, Min=17, Avg=23,44, 90=29, 99=63, 99.9=129, 99.99=231] 
2024-09-17 18:29:15:155 46 sec: 1392520 operations; 41720 current ops/sec; est completion in 37 seconds [READ: Count=20904, Max=721, Min=18, Avg=23,07, 90=28, 99=59, 99.9=130, 99.99=250] [UPDATE: Count=20811, Max=280, Min=18, Avg=23,15, 90=28, 99=61, 99.9=135, 99.99=189] 
2024-09-17 18:29:16:155 47 sec: 1427674 operations; 35154 current ops/sec; est completion in 36 seconds [READ: Count=17590, Max=371, Min=18, Avg=27,42, 90=45, 99=84, 99.9=165, 99.99=269] [UPDATE: Count=17562, Max=492, Min=18, Avg=27,64, 90=46, 99=91, 99.9=168, 99.99=259] 
2024-09-17 18:29:17:155 48 sec: 1460844 operations; 33170 current ops/sec; est completion in 35 seconds [READ: Count=16567, Max=269, Min=19, Avg=29,05, 90=52, 99=87, 99.9=164, 99.99=222] [UPDATE: Count=16609, Max=366, Min=18, Avg=29,34, 90=55, 99=87, 99.9=169, 99.99=253] 
2024-09-17 18:29:18:155 49 sec: 1496112 operations; 35268 current ops/sec; est completion in 33 seconds [READ: Count=17822, Max=306, Min=17, Avg=27,26, 90=50, 99=75, 99.9=145, 99.99=251] [UPDATE: Count=17449, Max=264, Min=17, Avg=27,7, 90=53, 99=77, 99.9=145, 99.99=228] 
2024-09-17 18:29:19:155 50 sec: 1529905 operations; 33793 current ops/sec; est completion in 32 seconds [READ: Count=16933, Max=1246, Min=18, Avg=28,55, 90=51, 99=78, 99.9=145, 99.99=283] [UPDATE: Count=16847, Max=1791, Min=18, Avg=28,82, 90=53, 99=85, 99.9=151, 99.99=283] 
2024-09-17 18:29:20:155 51 sec: 1567438 operations; 37533 current ops/sec; est completion in 31 seconds [READ: Count=18827, Max=939, Min=15, Avg=25,69, 90=45, 99=72, 99.9=155, 99.99=378] [UPDATE: Count=18710, Max=259, Min=18, Avg=25,86, 90=44, 99=74, 99.9=167, 99.99=227] 
2024-09-17 18:29:21:155 52 sec: 1607612 operations; 40174 current ops/sec; est completion in 29 seconds [READ: Count=20101, Max=238, Min=17, Avg=23,91, 90=28, 99=71, 99.9=144, 99.99=195] [UPDATE: Count=20068, Max=277, Min=18, Avg=24,01, 90=28, 99=75, 99.9=139, 99.99=237] 
2024-09-17 18:29:22:155 53 sec: 1645067 operations; 37455 current ops/sec; est completion in 28 seconds [READ: Count=18688, Max=602, Min=18, Avg=25,67, 90=34, 99=71, 99.9=140, 99.99=243] [UPDATE: Count=18774, Max=430, Min=14, Avg=25,97, 90=35, 99=74, 99.9=160, 99.99=266] 
2024-09-17 18:29:23:155 54 sec: 1685920 operations; 40853 current ops/sec; est completion in 27 seconds [READ: Count=20369, Max=230, Min=18, Avg=23,53, 90=28, 99=63, 99.9=139, 99.99=219] [UPDATE: Count=20476, Max=260, Min=18, Avg=23,66, 90=27, 99=67, 99.9=144, 99.99=237] 
2024-09-17 18:29:24:155 55 sec: 1717630 operations; 31710 current ops/sec; est completion in 26 seconds [READ: Count=15871, Max=943, Min=19, Avg=30,43, 90=56, 99=96, 99.9=160, 99.99=259] [UPDATE: Count=15843, Max=657, Min=18, Avg=30,71, 90=58, 99=99, 99.9=173, 99.99=268] 
2024-09-17 18:29:25:155 56 sec: 1755213 operations; 37583 current ops/sec; est completion in 24 seconds [READ: Count=18730, Max=326, Min=18, Avg=25,72, 90=39, 99=72, 99.9=164, 99.99=312] [UPDATE: Count=18857, Max=447, Min=18, Avg=25,66, 90=38, 99=75, 99.9=161, 99.99=258] 
2024-09-17 18:29:26:155 57 sec: 1794593 operations; 39380 current ops/sec; est completion in 23 seconds [READ: Count=19756, Max=641, Min=18, Avg=24,46, 90=29, 99=75, 99.9=147, 99.99=275] [UPDATE: Count=19629, Max=390, Min=17, Avg=24,58, 90=29, 99=80, 99.9=160, 99.99=274] 
2024-09-17 18:29:27:155 58 sec: 1828194 operations; 33601 current ops/sec; est completion in 22 seconds [READ: Count=16689, Max=370, Min=19, Avg=28,67, 90=48, 99=77, 99.9=148, 99.99=235] [UPDATE: Count=16908, Max=296, Min=18, Avg=28,86, 90=51, 99=77, 99.9=167, 99.99=253] 
2024-09-17 18:29:28:155 59 sec: 1861039 operations; 32845 current ops/sec; est completion in 21 seconds [READ: Count=16597, Max=328, Min=18, Avg=29,34, 90=53, 99=100, 99.9=193, 99.99=292] [UPDATE: Count=16248, Max=400, Min=18, Avg=29,66, 90=57, 99=100, 99.9=177, 99.99=327] 
2024-09-17 18:29:29:155 60 sec: 1895828 operations; 34789 current ops/sec; est completion in 20 seconds [READ: Count=17508, Max=334, Min=18, Avg=27,68, 90=48, 99=80, 99.9=145, 99.99=260] [UPDATE: Count=17284, Max=733, Min=18, Avg=27,96, 90=50, 99=83, 99.9=153, 99.99=244] 
2024-09-17 18:29:30:155 61 sec: 1921709 operations; 25881 current ops/sec; est completion in 19 seconds [READ: Count=12952, Max=370, Min=13, Avg=37,37, 90=64, 99=123, 99.9=211, 99.99=329] [UPDATE: Count=12922, Max=310, Min=18, Avg=37,93, 90=66, 99=130, 99.9=203, 99.99=280] 
2024-09-17 18:29:31:155 62 sec: 1951273 operations; 29564 current ops/sec; est completion in 18 seconds [READ: Count=14920, Max=608, Min=18, Avg=32,63, 90=58, 99=79, 99.9=147, 99.99=354] [UPDATE: Count=14651, Max=295, Min=18, Avg=33,2, 90=60, 99=85, 99.9=150, 99.99=220] 
2024-09-17 18:29:32:155 63 sec: 1983482 operations; 32209 current ops/sec; est completion in 17 seconds [READ: Count=16077, Max=400, Min=18, Avg=29,82, 90=53, 99=75, 99.9=151, 99.99=217] [UPDATE: Count=16129, Max=544, Min=19, Avg=30,34, 90=56, 99=82, 99.9=162, 99.99=235] 
2024-09-17 18:29:33:155 64 sec: 2011474 operations; 27992 current ops/sec; est completion in 16 seconds [READ: Count=14098, Max=216, Min=18, Avg=34,38, 90=61, 99=100, 99.9=156, 99.99=216] [UPDATE: Count=13889, Max=589, Min=18, Avg=35,18, 90=64, 99=111, 99.9=177, 99.99=279] 
2024-09-17 18:29:34:155 65 sec: 2033558 operations; 22084 current ops/sec; est completion in 15 seconds [READ: Count=11114, Max=790, Min=19, Avg=43,72, 90=68, 99=126, 99.9=230, 99.99=465] [UPDATE: Count=10978, Max=323, Min=19, Avg=44,65, 90=71, 99=128, 99.9=184, 99.99=276] 
2024-09-17 18:29:35:155 66 sec: 2057089 operations; 23531 current ops/sec; est completion in 15 seconds [READ: Count=11769, Max=450, Min=19, Avg=40,76, 90=67, 99=121, 99.9=193, 99.99=384] [UPDATE: Count=11756, Max=274, Min=18, Avg=42,13, 90=70, 99=133, 99.9=205, 99.99=264] 
2024-09-17 18:29:36:155 67 sec: 2086071 operations; 28982 current ops/sec; est completion in 14 seconds [READ: Count=14616, Max=251, Min=18, Avg=33,12, 90=59, 99=104, 99.9=162, 99.99=236] [UPDATE: Count=14366, Max=573, Min=18, Avg=33,93, 90=62, 99=113, 99.9=160, 99.99=274] 
2024-09-17 18:29:37:155 68 sec: 2111574 operations; 25503 current ops/sec; est completion in 13 seconds [READ: Count=12836, Max=683, Min=19, Avg=37,75, 90=64, 99=128, 99.9=194, 99.99=279] [UPDATE: Count=12670, Max=388, Min=18, Avg=38,56, 90=67, 99=136, 99.9=210, 99.99=269] 
2024-09-17 18:29:38:155 69 sec: 2147462 operations; 35888 current ops/sec; est completion in 12 seconds [READ: Count=17896, Max=1476, Min=14, Avg=26,88, 90=50, 99=77, 99.9=168, 99.99=231] [UPDATE: Count=17998, Max=1234, Min=19, Avg=27,06, 90=52, 99=80, 99.9=191, 99.99=284] 
2024-09-17 18:29:39:155 70 sec: 2186004 operations; 38542 current ops/sec; est completion in 11 seconds [READ: Count=19162, Max=262, Min=18, Avg=24,97, 90=30, 99=65, 99.9=137, 99.99=215] [UPDATE: Count=19372, Max=269, Min=17, Avg=25,19, 90=31, 99=68, 99.9=130, 99.99=222] 
2024-09-17 18:29:40:155 71 sec: 2216199 operations; 30195 current ops/sec; est completion in 10 seconds [READ: Count=15062, Max=353, Min=19, Avg=31,88, 90=55, 99=105, 99.9=170, 99.99=253] [UPDATE: Count=15129, Max=325, Min=18, Avg=32,21, 90=57, 99=109, 99.9=177, 99.99=251] 
2024-09-17 18:29:41:155 72 sec: 2248060 operations; 31861 current ops/sec; est completion in 9 second [READ: Count=15773, Max=397, Min=18, Avg=30,18, 90=54, 99=82, 99.9=160, 99.99=218] [UPDATE: Count=16090, Max=281, Min=18, Avg=30,69, 90=57, 99=97, 99.9=169, 99.99=228] 
2024-09-17 18:29:42:155 73 sec: 2282737 operations; 34677 current ops/sec; est completion in 7 second [READ: Count=17422, Max=1099, Min=18, Avg=27,85, 90=43, 99=87, 99.9=212, 99.99=256] [UPDATE: Count=17252, Max=335, Min=18, Avg=27,9, 90=44, 99=88, 99.9=185, 99.99=280] 
2024-09-17 18:29:43:155 74 sec: 2313812 operations; 31075 current ops/sec; est completion in 6 second [READ: Count=15548, Max=220, Min=18, Avg=31,02, 90=58, 99=85, 99.9=148, 99.99=194] [UPDATE: Count=15531, Max=257, Min=18, Avg=31,52, 90=60, 99=84, 99.9=156, 99.99=233] 
2024-09-17 18:29:44:155 75 sec: 2339863 operations; 26051 current ops/sec; est completion in 6 second [READ: Count=12983, Max=371, Min=19, Avg=36,87, 90=64, 99=116, 99.9=188, 99.99=274] [UPDATE: Count=13068, Max=316, Min=18, Avg=37,95, 90=67, 99=123, 99.9=217, 99.99=290] 
2024-09-17 18:29:45:155 76 sec: 2366795 operations; 26932 current ops/sec; est completion in 5 second [READ: Count=13489, Max=3667, Min=19, Avg=35,32, 90=62, 99=119, 99.9=195, 99.99=476] [UPDATE: Count=13440, Max=10543, Min=18, Avg=36,73, 90=65, 99=127, 99.9=240, 99.99=942] 
2024-09-17 18:29:46:155 77 sec: 2397920 operations; 31125 current ops/sec; est completion in 4 second [READ: Count=15451, Max=352, Min=18, Avg=31,04, 90=57, 99=112, 99.9=179, 99.99=238] [UPDATE: Count=15681, Max=396, Min=18, Avg=31,25, 90=59, 99=116, 99.9=189, 99.99=250] 
2024-09-17 18:29:47:155 78 sec: 2418587 operations; 20667 current ops/sec; est completion in 3 second [READ: Count=10220, Max=271, Min=18, Avg=46,62, 90=72, 99=133, 99.9=202, 99.99=249] [UPDATE: Count=10448, Max=437, Min=13, Avg=47,96, 90=75, 99=140, 99.9=238, 99.99=425] 
2024-09-17 18:29:48:155 79 sec: 2449604 operations; 31017 current ops/sec; est completion in 2 second [READ: Count=15347, Max=650, Min=17, Avg=31,1, 90=56, 99=95, 99.9=157, 99.99=206] [UPDATE: Count=15662, Max=618, Min=18, Avg=31,44, 90=59, 99=104, 99.9=192, 99.99=252] 
2024-09-17 18:29:49:155 80 sec: 2477483 operations; 27879 current ops/sec; est completion in 1 second [READ: Count=14003, Max=10335, Min=19, Avg=34,29, 90=59, 99=86, 99.9=167, 99.99=4879] [UPDATE: Count=13909, Max=10311, Min=18, Avg=35,36, 90=62, 99=98, 99.9=167, 99.99=3093] 
2024-09-17 18:29:49:964 80 sec: 2500000 operations; 27867,57 current ops/sec; [READ: Count=11262, Max=360, Min=19, Avg=34,5, 90=59, 99=93, 99.9=147, 99.99=183] [CLEANUP: Count=1, Max=746, Min=746, Avg=746, 90=746, 99=746, 99.9=746, 99.99=746] [UPDATE: Count=11217, Max=398, Min=18, Avg=35,35, 90=61, 99=104, 99.9=166, 99.99=222] 
[OVERALL], RunTime(ms), 80808
[OVERALL], Throughput(ops/sec), 30937.530937530937
[TOTAL_GCS_G1_Young_Generation], Count, 31
[TOTAL_GC_TIME_G1_Young_Generation], Time(ms), 23
[TOTAL_GC_TIME_%_G1_Young_Generation], Time(%), 0.028462528462528464
[TOTAL_GCS_G1_Old_Generation], Count, 0
[TOTAL_GC_TIME_G1_Old_Generation], Time(ms), 0
[TOTAL_GC_TIME_%_G1_Old_Generation], Time(%), 0.0
[TOTAL_GCs], Count, 31
[TOTAL_GC_TIME], Time(ms), 23
[TOTAL_GC_TIME_%], Time(%), 0.028462528462528464
[READ], Operations, 1250839
[READ], AverageLatency(us), 31.073033379995348
[READ], MinLatency(us), 12
[READ], MaxLatency(us), 10335
[READ], 95thPercentileLatency(us), 66
[READ], 99thPercentileLatency(us), 113
[READ], Return=OK, 1250839
[CLEANUP], Operations, 1
[CLEANUP], AverageLatency(us), 746.0
[CLEANUP], MinLatency(us), 746
[CLEANUP], MaxLatency(us), 746
[CLEANUP], 95thPercentileLatency(us), 746
[CLEANUP], 99thPercentileLatency(us), 746
[UPDATE], Operations, 1249161
[UPDATE], AverageLatency(us), 31.49970500199734
[UPDATE], MinLatency(us), 13
[UPDATE], MaxLatency(us), 10543
[UPDATE], 95thPercentileLatency(us), 69
[UPDATE], 99thPercentileLatency(us), 119
[UPDATE], Return=OK, 1249161
