/usr/bin/java  -classpath /home/sebastiaoamaro/phd/torefidevel/tests/redis/ycsb-0.17.0/conf:/home/sebastiaoamaro/phd/torefidevel/tests/redis/ycsb-0.17.0/lib/HdrHistogram-2.1.4.jar:/home/sebastiaoamaro/phd/torefidevel/tests/redis/ycsb-0.17.0/lib/core-0.17.0.jar:/home/sebastiaoamaro/phd/torefidevel/tests/redis/ycsb-0.17.0/lib/htrace-core4-4.1.0-incubating.jar:/home/sebastiaoamaro/phd/torefidevel/tests/redis/ycsb-0.17.0/lib/jackson-core-asl-1.9.4.jar:/home/sebastiaoamaro/phd/torefidevel/tests/redis/ycsb-0.17.0/lib/jackson-mapper-asl-1.9.4.jar:/home/sebastiaoamaro/phd/torefidevel/tests/redis/ycsb-0.17.0/redis-binding/lib/commons-pool2-2.4.2.jar:/home/sebastiaoamaro/phd/torefidevel/tests/redis/ycsb-0.17.0/redis-binding/lib/jedis-2.9.0.jar:/home/sebastiaoamaro/phd/torefidevel/tests/redis/ycsb-0.17.0/redis-binding/lib/redis-binding-0.17.0.jar site.ycsb.Client -t -db site.ycsb.db.RedisClient -P workloads/workloada -s -p status.interval=1 -p operationcount=2500000 -p redis.host=172.38.0.11 -p redis.port=6379 -p redis.cluster=true -s
Command line: -t -db site.ycsb.db.RedisClient -P workloads/workloada -s -p status.interval=1 -p operationcount=2500000 -p redis.host=172.38.0.11 -p redis.port=6379 -p redis.cluster=true -s
YCSB Client 0.17.0

Loading workload...
Starting test.
2024-09-25 16:42:20:660 0 sec: 0 operations; est completion in 0 second 
DBWrapper: report latency for each error is false and specific error codes to track for latency are: []
2024-09-25 16:42:21:640 1 sec: 13621 operations; 13621 current ops/sec; est completion in 3 minutes [READ: Count=6758, Max=3753, Min=20, Avg=61,9, 90=87, 99=159, 99.9=228, 99.99=2761] [UPDATE: Count=6890, Max=2343, Min=20, Avg=65,59, 90=95, 99=171, 99.9=257, 99.99=588] 
2024-09-25 16:42:22:640 2 sec: 37346 operations; 23725 current ops/sec; est completion in 2 minutes [READ: Count=11912, Max=532, Min=20, Avg=40,43, 90=74, 99=151, 99.9=235, 99.99=455] [UPDATE: Count=11793, Max=468, Min=19, Avg=40,72, 90=76, 99=163, 99.9=273, 99.99=451] 
2024-09-25 16:42:23:640 3 sec: 62287 operations; 24941 current ops/sec; est completion in 1 minute [READ: Count=12369, Max=1019, Min=20, Avg=39,01, 90=62, 99=117, 99.9=214, 99.99=513] [UPDATE: Count=12577, Max=348, Min=19, Avg=38,19, 90=63, 99=119, 99.9=204, 99.99=292] 
2024-09-25 16:42:24:640 4 sec: 90578 operations; 28291 current ops/sec; est completion in 1 minute [READ: Count=14161, Max=867, Min=21, Avg=34,63, 90=61, 99=117, 99.9=199, 99.99=262] [UPDATE: Count=14135, Max=1612, Min=17, Avg=33,85, 90=62, 99=117, 99.9=204, 99.99=874] 
2024-09-25 16:42:25:640 5 sec: 114321 operations; 23743 current ops/sec; est completion in 1 minute [READ: Count=11876, Max=1791, Min=19, Avg=40,61, 90=74, 99=129, 99.9=217, 99.99=455] [UPDATE: Count=11857, Max=285, Min=19, Avg=41,21, 90=77, 99=142, 99.9=206, 99.99=258] 
2024-09-25 16:42:26:640 6 sec: 139719 operations; 25398 current ops/sec; est completion in 1 minute [READ: Count=12564, Max=467, Min=19, Avg=37,84, 90=70, 99=140, 99.9=241, 99.99=447] [UPDATE: Count=12843, Max=464, Min=19, Avg=38,98, 90=73, 99=154, 99.9=280, 99.99=446] 
2024-09-25 16:42:27:640 7 sec: 165686 operations; 25967 current ops/sec; est completion in 1 minute [READ: Count=12969, Max=740, Min=19, Avg=37,06, 90=65, 99=120, 99.9=189, 99.99=446] [UPDATE: Count=12992, Max=607, Min=19, Avg=37,78, 90=68, 99=130, 99.9=219, 99.99=454] 
2024-09-25 16:42:28:640 8 sec: 191699 operations; 26013 current ops/sec; est completion in 1 minute [READ: Count=13120, Max=1560, Min=19, Avg=36,8, 90=64, 99=110, 99.9=164, 99.99=221] [UPDATE: Count=12891, Max=405, Min=19, Avg=38,12, 90=67, 99=119, 99.9=193, 99.99=279] 
2024-09-25 16:42:29:640 9 sec: 221379 operations; 29680 current ops/sec; est completion in 1 minute [READ: Count=14884, Max=447, Min=19, Avg=32,33, 90=60, 99=91, 99.9=172, 99.99=288] [UPDATE: Count=14801, Max=1727, Min=19, Avg=33,19, 90=63, 99=92, 99.9=157, 99.99=385] 
2024-09-25 16:42:30:640 10 sec: 249072 operations; 27693 current ops/sec; est completion in 1 minute [READ: Count=13728, Max=514, Min=19, Avg=34,73, 90=62, 99=109, 99.9=176, 99.99=447] [UPDATE: Count=13960, Max=1163, Min=19, Avg=35,5, 90=65, 99=111, 99.9=181, 99.99=1096] 
2024-09-25 16:42:31:640 11 sec: 276720 operations; 27648 current ops/sec; est completion in 1 minute [READ: Count=13864, Max=1479, Min=19, Avg=34,95, 90=60, 99=117, 99.9=221, 99.99=310] [UPDATE: Count=13791, Max=895, Min=19, Avg=35,2, 90=62, 99=122, 99.9=206, 99.99=342] 
2024-09-25 16:42:32:640 12 sec: 304522 operations; 27802 current ops/sec; est completion in 1 minute [READ: Count=13778, Max=398, Min=19, Avg=34,56, 90=62, 99=114, 99.9=194, 99.99=261] [UPDATE: Count=14015, Max=460, Min=19, Avg=35,27, 90=66, 99=125, 99.9=209, 99.99=440] 
2024-09-25 16:42:33:640 13 sec: 325890 operations; 21368 current ops/sec; est completion in 1 minute [READ: Count=10751, Max=1102, Min=19, Avg=44,8, 90=78, 99=144, 99.9=221, 99.99=970] [UPDATE: Count=10626, Max=278, Min=19, Avg=46,48, 90=82, 99=159, 99.9=234, 99.99=260] 
2024-09-25 16:42:34:640 14 sec: 359910 operations; 34020 current ops/sec; est completion in 1 minute [READ: Count=17061, Max=1731, Min=19, Avg=28,44, 90=47, 99=83, 99.9=162, 99.99=322] [UPDATE: Count=16959, Max=486, Min=19, Avg=28,53, 90=50, 99=87, 99.9=175, 99.99=258] 
2024-09-25 16:42:35:640 15 sec: 388448 operations; 28538 current ops/sec; est completion in 1 minute [READ: Count=14134, Max=498, Min=19, Avg=33,78, 90=61, 99=110, 99.9=177, 99.99=496] [UPDATE: Count=14396, Max=329, Min=19, Avg=34,29, 90=64, 99=110, 99.9=180, 99.99=252] 
2024-09-25 16:42:36:640 16 sec: 413291 operations; 24843 current ops/sec; est completion in 1 minute [READ: Count=12493, Max=1088, Min=19, Avg=39,03, 90=66, 99=117, 99.9=233, 99.99=844] [UPDATE: Count=12353, Max=448, Min=18, Avg=39,48, 90=69, 99=119, 99.9=197, 99.99=447] 
2024-09-25 16:42:37:640 17 sec: 437864 operations; 24573 current ops/sec; est completion in 1 minute [READ: Count=12273, Max=982, Min=19, Avg=39,28, 90=67, 99=128, 99.9=175, 99.99=245] [UPDATE: Count=12299, Max=244, Min=19, Avg=40,01, 90=71, 99=132, 99.9=203, 99.99=239] 
2024-09-25 16:42:38:640 18 sec: 458622 operations; 20758 current ops/sec; est completion in 1 minute [READ: Count=10437, Max=525, Min=20, Avg=46,52, 90=80, 99=163, 99.9=253, 99.99=281] [UPDATE: Count=10317, Max=360, Min=15, Avg=47,7, 90=83, 99=178, 99.9=254, 99.99=351] 
2024-09-25 16:42:39:640 19 sec: 484791 operations; 26169 current ops/sec; est completion in 1 minute [READ: Count=13118, Max=594, Min=19, Avg=36,85, 90=63, 99=115, 99.9=204, 99.99=492] [UPDATE: Count=13055, Max=667, Min=19, Avg=37,53, 90=66, 99=122, 99.9=212, 99.99=498] 
2024-09-25 16:42:40:640 20 sec: 513355 operations; 28564 current ops/sec; est completion in 1 minute [READ: Count=14364, Max=461, Min=18, Avg=33,58, 90=60, 99=100, 99.9=185, 99.99=456] [UPDATE: Count=14191, Max=447, Min=19, Avg=34,4, 90=63, 99=112, 99.9=197, 99.99=263] 
2024-09-25 16:42:41:640 21 sec: 542697 operations; 29342 current ops/sec; est completion in 1 minute [READ: Count=14708, Max=627, Min=19, Avg=32,88, 90=56, 99=126, 99.9=203, 99.99=305] [UPDATE: Count=14641, Max=503, Min=19, Avg=33,3, 90=59, 99=128, 99.9=205, 99.99=497] 
2024-09-25 16:42:42:640 22 sec: 566796 operations; 24099 current ops/sec; est completion in 1 minute [READ: Count=12037, Max=773, Min=19, Avg=39,78, 90=74, 99=132, 99.9=204, 99.99=552] [UPDATE: Count=12064, Max=569, Min=19, Avg=41,15, 90=78, 99=143, 99.9=220, 99.99=452] 
2024-09-25 16:42:43:640 23 sec: 594571 operations; 27775 current ops/sec; est completion in 1 minute [READ: Count=13865, Max=588, Min=19, Avg=34,69, 90=61, 99=99, 99.9=173, 99.99=472] [UPDATE: Count=13904, Max=1709, Min=19, Avg=35,3, 90=64, 99=102, 99.9=171, 99.99=1011] 
2024-09-25 16:42:44:640 24 sec: 618471 operations; 23900 current ops/sec; est completion in 1 minute [READ: Count=12005, Max=553, Min=19, Avg=40,52, 90=74, 99=149, 99.9=243, 99.99=402] [UPDATE: Count=11898, Max=946, Min=19, Avg=41,14, 90=77, 99=154, 99.9=229, 99.99=844] 
2024-09-25 16:42:45:640 25 sec: 636652 operations; 18181 current ops/sec; est completion in 1 minute [READ: Count=9081, Max=1581, Min=20, Avg=52,83, 90=73, 99=140, 99.9=205, 99.99=706] [UPDATE: Count=9099, Max=494, Min=19, Avg=54,82, 90=78, 99=144, 99.9=198, 99.99=472] 
2024-09-25 16:42:46:640 26 sec: 661999 operations; 25347 current ops/sec; est completion in 1 minute [READ: Count=12732, Max=533, Min=19, Avg=37,99, 90=64, 99=145, 99.9=397, 99.99=475] [UPDATE: Count=12617, Max=522, Min=19, Avg=38,91, 90=68, 99=156, 99.9=354, 99.99=519] 
2024-09-25 16:42:47:640 27 sec: 687793 operations; 25794 current ops/sec; est completion in 1 minute [READ: Count=12914, Max=1667, Min=20, Avg=37,75, 90=67, 99=124, 99.9=196, 99.99=1191] [UPDATE: Count=12877, Max=444, Min=19, Avg=37,76, 90=70, 99=121, 99.9=195, 99.99=369] 
2024-09-25 16:42:48:640 28 sec: 710539 operations; 22746 current ops/sec; est completion in 1 minute [READ: Count=11486, Max=570, Min=19, Avg=42,06, 90=75, 99=147, 99.9=232, 99.99=420] [UPDATE: Count=11267, Max=578, Min=19, Avg=43,71, 90=79, 99=159, 99.9=244, 99.99=471] 
2024-09-25 16:42:49:640 29 sec: 743855 operations; 33316 current ops/sec; est completion in 1 minute [READ: Count=16811, Max=249, Min=17, Avg=28,92, 90=52, 99=76, 99.9=172, 99.99=246] [UPDATE: Count=16513, Max=254, Min=19, Avg=29,31, 90=55, 99=87, 99.9=166, 99.99=214] 
2024-09-25 16:42:50:640 30 sec: 768226 operations; 24371 current ops/sec; est completion in 1 minute [READ: Count=12204, Max=2063, Min=19, Avg=39,38, 90=65, 99=119, 99.9=203, 99.99=460] [UPDATE: Count=12162, Max=2433, Min=19, Avg=40,47, 90=69, 99=122, 99.9=188, 99.99=647] 
2024-09-25 16:42:51:640 31 sec: 799631 operations; 31405 current ops/sec; est completion in 1 minute [READ: Count=15667, Max=429, Min=19, Avg=30,79, 90=52, 99=83, 99.9=147, 99.99=221] [UPDATE: Count=15734, Max=444, Min=19, Avg=30,9, 90=55, 99=86, 99.9=154, 99.99=212] 
2024-09-25 16:42:52:640 32 sec: 822000 operations; 22369 current ops/sec; est completion in 1 minute [READ: Count=11215, Max=539, Min=19, Avg=43,39, 90=70, 99=130, 99.9=212, 99.99=525] [UPDATE: Count=11158, Max=1048, Min=19, Avg=43,81, 90=73, 99=127, 99.9=206, 99.99=771] 
2024-09-25 16:42:53:640 33 sec: 847434 operations; 25434 current ops/sec; est completion in 1 minute [READ: Count=12581, Max=1453, Min=17, Avg=37,9, 90=66, 99=125, 99.9=204, 99.99=771] [UPDATE: Count=12849, Max=515, Min=19, Avg=38,53, 90=69, 99=131, 99.9=253, 99.99=491] 
2024-09-25 16:42:54:640 34 sec: 872070 operations; 24636 current ops/sec; est completion in 1 minute [READ: Count=12194, Max=598, Min=19, Avg=39,27, 90=65, 99=130, 99.9=198, 99.99=402] [UPDATE: Count=12437, Max=731, Min=19, Avg=39,82, 90=67, 99=134, 99.9=216, 99.99=358] 
2024-09-25 16:42:55:640 35 sec: 899468 operations; 27398 current ops/sec; est completion in 1 minute [READ: Count=13765, Max=413, Min=19, Avg=35,08, 90=67, 99=133, 99.9=217, 99.99=339] [UPDATE: Count=13634, Max=649, Min=19, Avg=35,92, 90=70, 99=142, 99.9=249, 99.99=580] 
2024-09-25 16:42:56:640 36 sec: 929619 operations; 30151 current ops/sec; est completion in 1 minute [READ: Count=15024, Max=1957, Min=19, Avg=32,04, 90=59, 99=92, 99.9=173, 99.99=278] [UPDATE: Count=15124, Max=601, Min=19, Avg=32,35, 90=61, 99=96, 99.9=174, 99.99=319] 
2024-09-25 16:42:57:640 37 sec: 959357 operations; 29738 current ops/sec; est completion in 1 minute [READ: Count=14850, Max=245, Min=19, Avg=32,46, 90=59, 99=105, 99.9=162, 99.99=234] [UPDATE: Count=14899, Max=311, Min=19, Avg=32,93, 90=62, 99=109, 99.9=189, 99.99=308] 
2024-09-25 16:42:58:640 38 sec: 986924 operations; 27567 current ops/sec; est completion in 59 seconds [READ: Count=13921, Max=566, Min=19, Avg=35,23, 90=63, 99=121, 99.9=196, 99.99=451] [UPDATE: Count=13638, Max=509, Min=19, Avg=35,41, 90=66, 99=127, 99.9=209, 99.99=457] 
2024-09-25 16:42:59:640 39 sec: 1016167 operations; 29243 current ops/sec; est completion in 57 seconds [READ: Count=14645, Max=1524, Min=19, Avg=33,29, 90=63, 99=103, 99.9=175, 99.99=323] [UPDATE: Count=14609, Max=290, Min=19, Avg=33,18, 90=64, 99=105, 99.9=175, 99.99=263] 
2024-09-25 16:43:00:640 40 sec: 1040943 operations; 24776 current ops/sec; est completion in 57 seconds [READ: Count=12451, Max=321, Min=19, Avg=38,92, 90=73, 99=139, 99.9=243, 99.99=306] [UPDATE: Count=12313, Max=1379, Min=19, Avg=39,92, 90=77, 99=147, 99.9=219, 99.99=362] 
2024-09-25 16:43:01:640 41 sec: 1073360 operations; 32417 current ops/sec; est completion in 55 seconds [READ: Count=16211, Max=642, Min=19, Avg=29,98, 90=55, 99=82, 99.9=153, 99.99=452] [UPDATE: Count=16212, Max=473, Min=19, Avg=29,98, 90=58, 99=80, 99.9=174, 99.99=316] 
2024-09-25 16:43:02:640 42 sec: 1099684 operations; 26324 current ops/sec; est completion in 54 seconds [READ: Count=13049, Max=1563, Min=19, Avg=36,91, 90=65, 99=118, 99.9=188, 99.99=315] [UPDATE: Count=13270, Max=447, Min=17, Avg=37,04, 90=67, 99=124, 99.9=221, 99.99=356] 
2024-09-25 16:43:03:640 43 sec: 1128098 operations; 28414 current ops/sec; est completion in 53 seconds [READ: Count=14155, Max=354, Min=15, Avg=34,07, 90=62, 99=106, 99.9=158, 99.99=234] [UPDATE: Count=14257, Max=919, Min=19, Avg=34,38, 90=64, 99=107, 99.9=178, 99.99=453] 
2024-09-25 16:43:04:640 44 sec: 1159673 operations; 31575 current ops/sec; est completion in 51 seconds [READ: Count=15825, Max=509, Min=19, Avg=30,54, 90=59, 99=102, 99.9=179, 99.99=313] [UPDATE: Count=15746, Max=884, Min=19, Avg=30,98, 90=61, 99=100, 99.9=175, 99.99=241] 
2024-09-25 16:43:05:640 45 sec: 1180993 operations; 21320 current ops/sec; est completion in 51 seconds [READ: Count=10554, Max=519, Min=19, Avg=45,3, 90=73, 99=132, 99.9=200, 99.99=514] [UPDATE: Count=10771, Max=2057, Min=19, Avg=45,96, 90=75, 99=133, 99.9=200, 99.99=350] 
2024-09-25 16:43:06:640 46 sec: 1210006 operations; 29013 current ops/sec; est completion in 50 seconds [READ: Count=14436, Max=578, Min=19, Avg=33,34, 90=58, 99=110, 99.9=197, 99.99=349] [UPDATE: Count=14580, Max=537, Min=19, Avg=33,58, 90=61, 99=116, 99.9=182, 99.99=285] 
2024-09-25 16:43:07:640 47 sec: 1237129 operations; 27123 current ops/sec; est completion in 48 seconds [READ: Count=13692, Max=6687, Min=19, Avg=35,7, 90=66, 99=150, 99.9=318, 99.99=813] [UPDATE: Count=13434, Max=2575, Min=19, Avg=36,04, 90=70, 99=155, 99.9=388, 99.99=1333] 
2024-09-25 16:43:08:640 48 sec: 1263591 operations; 26462 current ops/sec; est completion in 47 seconds [READ: Count=13343, Max=635, Min=19, Avg=36,21, 90=64, 99=111, 99.9=192, 99.99=256] [UPDATE: Count=13113, Max=702, Min=19, Avg=37,44, 90=67, 99=120, 99.9=190, 99.99=248] 
2024-09-25 16:43:09:640 49 sec: 1291568 operations; 27977 current ops/sec; est completion in 46 seconds [READ: Count=14001, Max=318, Min=19, Avg=34,4, 90=61, 99=107, 99.9=193, 99.99=280] [UPDATE: Count=13976, Max=319, Min=19, Avg=35,03, 90=64, 99=123, 99.9=211, 99.99=315] 
2024-09-25 16:43:10:640 50 sec: 1317501 operations; 25933 current ops/sec; est completion in 45 seconds [READ: Count=13070, Max=740, Min=19, Avg=37,11, 90=68, 99=125, 99.9=228, 99.99=349] [UPDATE: Count=12866, Max=311, Min=19, Avg=37,97, 90=72, 99=135, 99.9=197, 99.99=270] 
2024-09-25 16:43:11:640 51 sec: 1346306 operations; 28805 current ops/sec; est completion in 44 seconds [READ: Count=14590, Max=732, Min=19, Avg=33,53, 90=60, 99=93, 99.9=165, 99.99=441] [UPDATE: Count=14210, Max=936, Min=19, Avg=33,93, 90=63, 99=97, 99.9=167, 99.99=339] 
2024-09-25 16:43:12:640 52 sec: 1377396 operations; 31090 current ops/sec; est completion in 43 seconds [READ: Count=15595, Max=616, Min=16, Avg=31,07, 90=60, 99=87, 99.9=157, 99.99=449] [UPDATE: Count=15497, Max=608, Min=19, Avg=31,56, 90=62, 99=95, 99.9=168, 99.99=253] 
2024-09-25 16:43:13:640 53 sec: 1408867 operations; 31471 current ops/sec; est completion in 42 seconds [READ: Count=15620, Max=343, Min=16, Avg=30,66, 90=58, 99=116, 99.9=204, 99.99=302] [UPDATE: Count=15853, Max=351, Min=19, Avg=31,15, 90=61, 99=124, 99.9=226, 99.99=307] 
2024-09-25 16:43:14:640 54 sec: 1433892 operations; 25025 current ops/sec; est completion in 41 seconds [READ: Count=12500, Max=1118, Min=15, Avg=38,51, 90=65, 99=123, 99.9=215, 99.99=448] [UPDATE: Count=12525, Max=345, Min=19, Avg=39,32, 90=69, 99=128, 99.9=211, 99.99=297] 
2024-09-25 16:43:15:640 55 sec: 1458290 operations; 24398 current ops/sec; est completion in 40 seconds [READ: Count=12128, Max=636, Min=18, Avg=39,56, 90=67, 99=123, 99.9=228, 99.99=304] [UPDATE: Count=12269, Max=321, Min=19, Avg=40,34, 90=70, 99=127, 99.9=218, 99.99=316] 
2024-09-25 16:43:16:640 56 sec: 1485543 operations; 27253 current ops/sec; est completion in 39 seconds [READ: Count=13708, Max=868, Min=14, Avg=35,16, 90=62, 99=110, 99.9=181, 99.99=322] [UPDATE: Count=13554, Max=828, Min=19, Avg=36,16, 90=65, 99=119, 99.9=181, 99.99=274] 
2024-09-25 16:43:17:640 57 sec: 1508822 operations; 23279 current ops/sec; est completion in 38 seconds [READ: Count=11437, Max=892, Min=19, Avg=41,41, 90=72, 99=131, 99.9=194, 99.99=833] [UPDATE: Count=11833, Max=306, Min=20, Avg=42,29, 90=76, 99=135, 99.9=197, 99.99=252] 
2024-09-25 16:43:18:640 58 sec: 1533544 operations; 24722 current ops/sec; est completion in 37 seconds [READ: Count=12475, Max=506, Min=20, Avg=38,89, 90=64, 99=107, 99.9=161, 99.99=265] [UPDATE: Count=12244, Max=448, Min=19, Avg=39,95, 90=67, 99=111, 99.9=179, 99.99=247] 
2024-09-25 16:43:19:640 59 sec: 1556452 operations; 22908 current ops/sec; est completion in 36 seconds [READ: Count=11421, Max=309, Min=20, Avg=41,9, 90=68, 99=117, 99.9=191, 99.99=241] [UPDATE: Count=11487, Max=404, Min=19, Avg=43,37, 90=72, 99=127, 99.9=195, 99.99=262] 
2024-09-25 16:43:20:640 60 sec: 1591707 operations; 35255 current ops/sec; est completion in 35 seconds [READ: Count=17501, Max=1101, Min=19, Avg=27,45, 90=34, 99=78, 99.9=151, 99.99=274] [UPDATE: Count=17758, Max=379, Min=18, Avg=27,4, 90=34, 99=81, 99.9=157, 99.99=250] 
2024-09-25 16:43:21:640 61 sec: 1622120 operations; 30413 current ops/sec; est completion in 34 seconds [READ: Count=15234, Max=773, Min=16, Avg=31,61, 90=58, 99=87, 99.9=194, 99.99=457] [UPDATE: Count=15183, Max=578, Min=18, Avg=32,37, 90=61, 99=98, 99.9=187, 99.99=265] 
2024-09-25 16:43:22:640 62 sec: 1651578 operations; 29458 current ops/sec; est completion in 32 seconds [READ: Count=14660, Max=651, Min=19, Avg=32,94, 90=62, 99=114, 99.9=188, 99.99=291] [UPDATE: Count=14790, Max=980, Min=18, Avg=33,18, 90=64, 99=114, 99.9=190, 99.99=672] 
2024-09-25 16:43:23:640 63 sec: 1682800 operations; 31222 current ops/sec; est completion in 31 seconds [READ: Count=15759, Max=854, Min=19, Avg=31,07, 90=57, 99=90, 99.9=164, 99.99=251] [UPDATE: Count=15462, Max=408, Min=18, Avg=31,09, 90=60, 99=95, 99.9=179, 99.99=248] 
2024-09-25 16:43:24:640 64 sec: 1715618 operations; 32818 current ops/sec; est completion in 30 seconds [READ: Count=16394, Max=249, Min=19, Avg=29,35, 90=52, 99=77, 99.9=146, 99.99=212] [UPDATE: Count=16428, Max=349, Min=19, Avg=29,72, 90=55, 99=85, 99.9=181, 99.99=248] 
2024-09-25 16:43:25:640 65 sec: 1741644 operations; 26026 current ops/sec; est completion in 29 seconds [READ: Count=12932, Max=381, Min=19, Avg=37,19, 90=68, 99=123, 99.9=201, 99.99=296] [UPDATE: Count=13099, Max=325, Min=19, Avg=37,75, 90=70, 99=126, 99.9=179, 99.99=250] 
2024-09-25 16:43:26:640 66 sec: 1764118 operations; 22474 current ops/sec; est completion in 28 seconds [READ: Count=11308, Max=1750, Min=19, Avg=43,11, 90=77, 99=159, 99.9=280, 99.99=713] [UPDATE: Count=11157, Max=430, Min=17, Avg=43,67, 90=81, 99=174, 99.9=270, 99.99=388] 
2024-09-25 16:43:27:640 67 sec: 1794486 operations; 30368 current ops/sec; est completion in 27 seconds [READ: Count=15160, Max=501, Min=19, Avg=31,92, 90=60, 99=88, 99.9=166, 99.99=394] [UPDATE: Count=15210, Max=484, Min=19, Avg=32,08, 90=63, 99=88, 99.9=158, 99.99=212] 
2024-09-25 16:43:28:640 68 sec: 1813356 operations; 18870 current ops/sec; est completion in 26 seconds [READ: Count=9456, Max=375, Min=20, Avg=51,2, 90=78, 99=143, 99.9=222, 99.99=256] [UPDATE: Count=9413, Max=336, Min=19, Avg=52,47, 90=81, 99=154, 99.9=223, 99.99=297] 
2024-09-25 16:43:29:640 69 sec: 1843720 operations; 30364 current ops/sec; est completion in 25 seconds [READ: Count=15272, Max=1052, Min=19, Avg=31,97, 90=59, 99=93, 99.9=173, 99.99=577] [UPDATE: Count=15092, Max=282, Min=19, Avg=31,99, 90=61, 99=98, 99.9=166, 99.99=236] 
2024-09-25 16:43:30:640 70 sec: 1871679 operations; 27959 current ops/sec; est completion in 24 seconds [READ: Count=14024, Max=329, Min=19, Avg=34,57, 90=64, 99=108, 99.9=163, 99.99=270] [UPDATE: Count=13940, Max=423, Min=18, Avg=35,1, 90=66, 99=106, 99.9=174, 99.99=310] 
2024-09-25 16:43:31:640 71 sec: 1899978 operations; 28299 current ops/sec; est completion in 23 seconds [READ: Count=14033, Max=288, Min=19, Avg=33,98, 90=61, 99=104, 99.9=172, 99.99=281] [UPDATE: Count=14268, Max=910, Min=19, Avg=34,61, 90=64, 99=113, 99.9=175, 99.99=490] 
2024-09-25 16:43:32:640 72 sec: 1935550 operations; 35572 current ops/sec; est completion in 21 seconds [READ: Count=17719, Max=1263, Min=19, Avg=27,28, 90=29, 99=66, 99.9=125, 99.99=272] [UPDATE: Count=17847, Max=393, Min=19, Avg=27,12, 90=29, 99=70, 99.9=155, 99.99=250] 
2024-09-25 16:43:33:640 73 sec: 1968924 operations; 33374 current ops/sec; est completion in 20 seconds [READ: Count=16855, Max=546, Min=19, Avg=28,86, 90=47, 99=90, 99.9=183, 99.99=260] [UPDATE: Count=16527, Max=927, Min=19, Avg=29,27, 90=52, 99=94, 99.9=202, 99.99=294] 
2024-09-25 16:43:34:640 74 sec: 2005855 operations; 36931 current ops/sec; est completion in 19 seconds [READ: Count=18413, Max=887, Min=18, Avg=26,14, 90=33, 99=74, 99.9=156, 99.99=239] [UPDATE: Count=18508, Max=532, Min=19, Avg=26,32, 90=34, 99=78, 99.9=163, 99.99=257] 
2024-09-25 16:43:35:640 75 sec: 2030409 operations; 24554 current ops/sec; est completion in 18 seconds [READ: Count=12311, Max=522, Min=19, Avg=39,45, 90=65, 99=102, 99.9=160, 99.99=476] [UPDATE: Count=12243, Max=454, Min=19, Avg=39,98, 90=67, 99=104, 99.9=176, 99.99=258] 
2024-09-25 16:43:36:640 76 sec: 2060275 operations; 29866 current ops/sec; est completion in 17 seconds [READ: Count=14902, Max=452, Min=19, Avg=32,11, 90=57, 99=91, 99.9=173, 99.99=451] [UPDATE: Count=14966, Max=470, Min=19, Avg=32,86, 90=60, 99=97, 99.9=189, 99.99=296] 
2024-09-25 16:43:37:640 77 sec: 2094948 operations; 34673 current ops/sec; est completion in 15 seconds [READ: Count=17305, Max=410, Min=17, Avg=27,8, 90=51, 99=79, 99.9=148, 99.99=205] [UPDATE: Count=17371, Max=1001, Min=19, Avg=28,19, 90=54, 99=86, 99.9=177, 99.99=450] 
2024-09-25 16:43:38:640 78 sec: 2117279 operations; 22331 current ops/sec; est completion in 15 seconds [READ: Count=11326, Max=3293, Min=19, Avg=43,54, 90=74, 99=152, 99.9=260, 99.99=1022] [UPDATE: Count=11004, Max=394, Min=19, Avg=43,94, 90=77, 99=159, 99.9=247, 99.99=338] 
2024-09-25 16:43:39:640 79 sec: 2141371 operations; 24092 current ops/sec; est completion in 14 seconds [READ: Count=12023, Max=306, Min=15, Avg=39,68, 90=68, 99=125, 99.9=212, 99.99=247] [UPDATE: Count=12066, Max=1013, Min=19, Avg=41,13, 90=72, 99=141, 99.9=253, 99.99=482] 
2024-09-25 16:43:40:640 80 sec: 2170133 operations; 28762 current ops/sec; est completion in 13 seconds [READ: Count=14328, Max=277, Min=19, Avg=33,67, 90=62, 99=130, 99.9=208, 99.99=269] [UPDATE: Count=14435, Max=332, Min=19, Avg=33,96, 90=64, 99=138, 99.9=216, 99.99=295] 
2024-09-25 16:43:41:640 81 sec: 2196302 operations; 26169 current ops/sec; est completion in 12 seconds [READ: Count=13203, Max=367, Min=19, Avg=36,98, 90=68, 99=128, 99.9=210, 99.99=278] [UPDATE: Count=12968, Max=246, Min=19, Avg=37,31, 90=71, 99=134, 99.9=203, 99.99=236] 
2024-09-25 16:43:42:640 82 sec: 2223621 operations; 27319 current ops/sec; est completion in 11 seconds [READ: Count=13753, Max=785, Min=20, Avg=35,29, 90=62, 99=103, 99.9=175, 99.99=460] [UPDATE: Count=13567, Max=452, Min=19, Avg=35,9, 90=65, 99=104, 99.9=171, 99.99=447] 
2024-09-25 16:43:43:640 83 sec: 2257231 operations; 33610 current ops/sec; est completion in 9 second [READ: Count=16749, Max=519, Min=19, Avg=28,8, 90=56, 99=83, 99.9=159, 99.99=449] [UPDATE: Count=16860, Max=452, Min=19, Avg=28,97, 90=58, 99=89, 99.9=165, 99.99=241] 
2024-09-25 16:43:44:640 84 sec: 2288558 operations; 31327 current ops/sec; est completion in 8 second [READ: Count=15782, Max=709, Min=19, Avg=30,73, 90=51, 99=85, 99.9=156, 99.99=456] [UPDATE: Count=15543, Max=953, Min=19, Avg=31,15, 90=54, 99=95, 99.9=200, 99.99=353] 
2024-09-25 16:43:45:640 85 sec: 2317416 operations; 28858 current ops/sec; est completion in 7 second [READ: Count=14448, Max=910, Min=19, Avg=33,49, 90=58, 99=132, 99.9=221, 99.99=393] [UPDATE: Count=14409, Max=652, Min=19, Avg=33,88, 90=61, 99=151, 99.9=249, 99.99=391] 
2024-09-25 16:43:46:640 86 sec: 2355336 operations; 37920 current ops/sec; est completion in 6 second [READ: Count=18909, Max=786, Min=19, Avg=25,37, 90=28, 99=65, 99.9=136, 99.99=466] [UPDATE: Count=19021, Max=473, Min=19, Avg=25,63, 90=29, 99=70, 99.9=165, 99.99=246] 
2024-09-25 16:43:47:640 87 sec: 2376912 operations; 21576 current ops/sec; est completion in 5 second [READ: Count=10660, Max=4439, Min=19, Avg=44,29, 90=80, 99=170, 99.9=285, 99.99=729] [UPDATE: Count=10915, Max=11055, Min=19, Avg=46,05, 90=84, 99=178, 99.9=287, 99.99=722] 
2024-09-25 16:43:48:640 88 sec: 2407350 operations; 30438 current ops/sec; est completion in 4 second [READ: Count=15220, Max=763, Min=19, Avg=31,79, 90=55, 99=115, 99.9=237, 99.99=479] [UPDATE: Count=15210, Max=391, Min=19, Avg=32,01, 90=58, 99=119, 99.9=200, 99.99=329] 
2024-09-25 16:43:49:640 89 sec: 2431567 operations; 24217 current ops/sec; est completion in 3 second [READ: Count=12137, Max=643, Min=19, Avg=39,88, 90=68, 99=126, 99.9=207, 99.99=272] [UPDATE: Count=12078, Max=933, Min=19, Avg=40,65, 90=70, 99=136, 99.9=217, 99.99=480] 
2024-09-25 16:43:50:640 90 sec: 2456969 operations; 25402 current ops/sec; est completion in 2 second [READ: Count=12671, Max=11223, Min=19, Avg=37,88, 90=64, 99=115, 99.9=195, 99.99=783] [UPDATE: Count=12734, Max=10287, Min=19, Avg=38,5, 90=67, 99=127, 99.9=211, 99.99=560] 
2024-09-25 16:43:51:640 91 sec: 2479284 operations; 22315 current ops/sec; est completion in 1 second [READ: Count=11312, Max=3077, Min=19, Avg=43,38, 90=72, 99=118, 99.9=195, 99.99=295] [UPDATE: Count=11004, Max=5531, Min=19, Avg=44,07, 90=75, 99=118, 99.9=195, 99.99=317] 
2024-09-25 16:43:52:377 91 sec: 2500000 operations; 28108,55 current ops/sec; [READ: Count=10406, Max=451, Min=19, Avg=34,46, 90=62, 99=113, 99.9=197, 99.99=396] [CLEANUP: Count=1, Max=758, Min=758, Avg=758, 90=758, 99=758, 99.9=758, 99.99=758] [UPDATE: Count=10304, Max=459, Min=19, Avg=34,59, 90=64, 99=119, 99.9=194, 99.99=436] 
[OVERALL], RunTime(ms), 91737
[OVERALL], Throughput(ops/sec), 27251.817696240338
[TOTAL_GCS_G1_Young_Generation], Count, 31
[TOTAL_GC_TIME_G1_Young_Generation], Time(ms), 36
[TOTAL_GC_TIME_%_G1_Young_Generation], Time(%), 0.03924261748258609
[TOTAL_GCS_G1_Old_Generation], Count, 0
[TOTAL_GC_TIME_G1_Old_Generation], Time(ms), 0
[TOTAL_GC_TIME_%_G1_Old_Generation], Time(%), 0.0
[TOTAL_GCs], Count, 31
[TOTAL_GC_TIME], Time(ms), 36
[TOTAL_GC_TIME_%], Time(%), 0.03924261748258609
[READ], Operations, 1250745
[READ], AverageLatency(us), 35.36385993947607
[READ], MinLatency(us), 14
[READ], MaxLatency(us), 11223
[READ], 95thPercentileLatency(us), 74
[READ], 99thPercentileLatency(us), 117
[READ], Return=OK, 1250745
[CLEANUP], Operations, 1
[CLEANUP], AverageLatency(us), 758.0
[CLEANUP], MinLatency(us), 758
[CLEANUP], MaxLatency(us), 758
[CLEANUP], 95thPercentileLatency(us), 758
[CLEANUP], 99thPercentileLatency(us), 758
[UPDATE], Operations, 1249255
[UPDATE], AverageLatency(us), 35.91868593681834
[UPDATE], MinLatency(us), 15
[UPDATE], MaxLatency(us), 11055
[UPDATE], 95thPercentileLatency(us), 77
[UPDATE], 99thPercentileLatency(us), 124
[UPDATE], Return=OK, 1249255
